claps,link,post_id,post_time,response,title
3,https://medium.com/@meshedsociety/quartz-s-new-app-has-come-half-way-in-reinventing-news-597adc3e0ad1?source=tag_archive---------7----------------,597adc3e0ad1,2016-02-16T00:00:00.000Z,2,"Quartz’s new app has come half way in reinventing newsYou probably have heard about Quartz’s new innovative iPhone app. Over the past days, the news about it was all over the Internet. It’s too early to conclude whether this app will turn out to be a hit among users. The texting-styled…"
1,https://medium.com/@Exolymph/alien-megabyte-babies-ab9f887125a1?source=tag_archive---------9----------------,ab9f887125a1,2016-02-16T05:52:13.022Z,1,"Alien Megabyte Babies“Intuitive expression is, aside from niche applications, largely hobbled and lagging far behind what computer-generated instruments can actually do.” — Torley on music tech"
157,https://machinelearnings.co/facial-emotion-recognition-single-rule-1-0-deeplearning-c90c3c2be788?source=tag_archive---------0----------------,c90c3c2be788,2016-02-17T07:33:52.985Z,5,Facial Emotion Recognition: Single-Rule 1–0 DeepLearningIn my attempt to build Artificial Emotional…
26,https://medium.com/@cradav/conversational-commerce-for-brands-6ac9f806aed2?source=tag_archive---------2----------------,6ac9f806aed2,2016-02-18T05:27:57.955Z,1,Are Brands Being Left Out of Conversational Commerce?Make this the Year for Brand ConversationsThe demand for brands to have authentic 1:1 conversations with their customers is huge. The ability to let customers initiate conversations…
37,https://medium.com/@RecastAI/ui-and-ai-the-next-interface-is-conversation-43400caa1b1a?source=tag_archive---------0----------------,43400caa1b1a,2016-02-19T16:03:42.144Z,2,UI and AI: the next interface is conversationMy parents bought a new car
20,https://medium.com/@DineenTallering/how-to-cook-a-true-bolognese-sauce-and-understand-machine-learning-at-the-same-time-75fb898c776?source=tag_archive---------1----------------,75fb898c776,2016-02-19T21:31:00.831Z,2,"How To Cook A True Bolognese Sauce and Understand Machine Learning at the Same TimeA Bolognese sauce is a recipe of seemingly endless contradictions. It’s a dish steeped in passionate but conflicted suggestions, ingredients and regional bias."
3,https://medium.com/@PhilippaSigl/are-we-getting-distracted-by-board-game-winning-super-computers-be49dc178856?source=tag_archive---------2----------------,be49dc178856,2016-02-19T08:11:24.885Z,2,Are we getting distracted by board game winning super computers?Its the humans behind artificial…
2,https://medium.com/deutsch/kopiert-ein-mensch-kreativer-als-software-dd47d41c5fc5?source=tag_archive---------3----------------,dd47d41c5fc5,2016-02-21T20:58:04.000Z,2,Remixt ein Mensch kreativer als Software?Tübinger Forscher haben hier einen interessanten Quiz ins Netz gestellt: Man sieht 10…
14,https://medium.com/@elspectre/why-amazon-cares-6b79ef83f73c?source=tag_archive---------1----------------,6b79ef83f73c,2016-02-22T21:12:58.737Z,2,"Why Amazon Cares…Amazon.com is making more news lately, this time because it’s reportedly planning to open 400 bookstores across the country. It…"
4,https://medium.com/@hyonschu/the-true-challenge-of-generalized-ai-7d1fb2d37d94?source=tag_archive---------2----------------,7d1fb2d37d94,2016-02-22T17:36:55.175Z,2,"The True Challenge of Generalized AISpoiler Alert: It’s not engineeringSome weeks ago, we marveled at how a big-ass computer could beat a European champion at Go. Motoki Wu, NLP Researcher at Foxtype, however, looked at it from a different angle."
27,https://medium.com/@albiondumsday/it-reminds-me-of-my-broader-theory-about-the-industrial-revolution-which-i-call-out-of-pure-15f1e692b16a?source=tag_archive---------4----------------,15f1e692b16a,2016-02-22T04:01:20.305Z,2,"It reminds me of my broader theory about the industrial revolution , which I call (out of pure vanity) Denny’s Law — that technology tends to go in ’ living memory’ cycles of around 70 years. This is when the fixed modes of thinking of a previous generations revolution dies out."
9,https://fun2dolabs.com/i-am-not-afraid-of-robots-ee8495cd7bf8?source=tag_archive---------7----------------,ee8495cd7bf8,2016-02-22T12:46:00.796Z,1,I am not afraid of RobotsThese days some people in the west are very afraid of artificial intelligence (AI). People are talking about robots taking over the world by the end of the century. Some people paint doomsday Frankenstein scenarios but I am not pessimistic.
3,https://medium.com/machine-words/the-real-dangers-of-artificial-intelligence-5012d21b6c34?source=tag_archive---------9----------------,5012d21b6c34,2016-02-22T20:52:44.972Z,2,"The Real Dangers of Artificial IntelligenceThere’s been a number of stories in the news about the “threat” of artificial intelligence, and a lot of it is nonsense, even some of the stuff coming from people as well-respected as Steven Hawking and Elon Musk."
2,https://medium.com/@k1lly/it-s-a-little-more-complicated-than-that-2e0909f08de2?source=tag_archive---------11----------------,2e0909f08de2,2016-02-22T13:55:31.745Z,1,"It’s a little more complicated than thatNothing, and I mean it, nothing beats the speed of a userusing hotkeys. Except one thing, which doesn’t exist yet: a neurointerface capable of understanding thought commands."
713,https://medium.com/artists-and-machine-intelligence/what-is-ami-ccd936394a83?source=tag_archive---------0----------------,ccd936394a83,2016-02-23T18:38:45.520Z,10,"Art in the Age of Machine IntelligenceArt has always existed in a complex, symbiotic and continually evolving relationship with the technological capabilities of a culture. Those capabilities constrain the art that is produced, and inform the way art is perceived and understood by its audience."
13,https://chatbotbook.com/use-ibm-watson-to-power-your-bot-conversation-8841d773e70?source=tag_archive---------1----------------,8841d773e70,2016-02-23T15:10:34.877Z,2,[Technical] Use IBM Watson to power your bot conversation
23,https://medium.com/@lisahammitt/no-standing-gig-a16bc2739548?source=tag_archive---------3----------------,a16bc2739548,2016-02-23T18:41:53.951Z,4,No Standing GigBy Lisa Hammitt“That was my gift…having the ability to put certain guys together that would create a…
14,https://medium.com/believing/entrepreneurs-in-residence-at-real-ventures-expanding-experimenting-exploring-f57a4a181be5?source=tag_archive---------5----------------,f57a4a181be5,2016-02-23T17:33:02.000Z,1,"ENTREPRENEURS-IN-RESIDENCE AT REAL VENTURES: EXPANDING, EXPERIMENTING, EXPLORING"
1,https://medium.com/@bharatvangani/are-we-ready-for-artificial-intelligence-2995a7cdc7d0?source=tag_archive---------8----------------,2995a7cdc7d0,2016-02-23T17:42:59.731Z,1,Are we ready for Artificial Intelligence?As a human living in a well developed corner of the world with blooming innovations around me…. probably not.As human species inhabiting a green/blue ball we call ‘earth’…. definitely not.
3,https://medium.com/@valvetta_mcgee_hudson/valvetta-mcgee-hudson-workplace-change-s-in-upcoming-time-9c2a92c1e159?source=tag_archive---------9----------------,9c2a92c1e159,2016-02-23T11:14:18.874Z,1,Valvetta McGee-Hudson : Workplace Change’s in upcoming time
229,https://medium.com/snips-ai/ntm-lasagne-a-library-for-neural-turing-machines-in-lasagne-2cdce6837315?source=tag_archive---------0----------------,2cdce6837315,2016-02-24T18:00:55.520Z,6,"NTM-Lasagne: A Library for Neural Turing Machines in LasagneThe first part of this post is about the theory behind Neural Turing Machines. The second is about the library itself, and benchmarks on tasks from Google DeepMind’s original paper."
356,https://medium.com/spark-capital/the-future-of-work-will-be-distributed-664d970c49c1?source=tag_archive---------1----------------,664d970c49c1,2016-02-24T16:48:04.799Z,18,"The Future of Work Will Be Distributedby John Melas-KyriaziI’m sitting in our San Francisco office. With a few taps on my smartphone, I’m on Facetime with colleagues in Lagos, Nigeria, getting a live update on a new hire for one of our portfolio companies. This is as close…"
14,https://neiltamplin.me/what-automation-might-look-like-for-social-housing-820c558ad0d0?source=tag_archive---------4----------------,820c558ad0d0,2016-02-24T14:16:18.003Z,4,What Automation Might Look Like for Housing Associations
132,https://machinelearnings.co/statistical-nlp-on-openstreetmap-b9d573e6cc86?source=tag_archive---------0----------------,b9d573e6cc86,2016-02-25T12:40:03.672Z,3,"Statistical NLP on OpenStreetMapToward a machine-interpretable understanding of placeStreet addresses are among the more quirky artifacts of human language, yet they are crucial to the increasing number of applications involving maps and…"
192,https://medium.com/slack-developer-blog/when-it-comes-to-bots-the-beer-test-might-be-more-important-than-the-turing-test-596af0032e09?source=tag_archive---------1----------------,596af0032e09,2016-02-25T19:09:25.813Z,5,When it Comes to Bots - the Beer Test* Might be More Important than the Turing Test.
25,https://medium.com/singularityu/scientific-research-in-the-age-of-artificial-intelligence-ec0216be718c?source=tag_archive---------2----------------,ec0216be718c,2016-02-25T16:54:33.167Z,3,Scientific Research in the Age of Artificial Intelligence
3,https://medium.com/@tomssilver/launching-the-luna-rating-system-481a965b11d4?source=tag_archive---------3----------------,481a965b11d4,2016-02-25T18:35:27.918Z,1,Launching the Luna Rating SystemLuna Rating → Alan TuringHow close are we to artificial intelligence? Are we getting closer? There appear to be plenty of answers. Gizmodo says that the AI revolution “could happen soon”. The Huffington Post reports that Ex-Machina style robots…
77,https://medium.com/consensus-a-novel/consensus-f3beee456ec0?source=tag_archive---------2----------------,f3beee456ec0,2016-02-26T16:11:14.991Z,5,"Consensus, Chapter 1: Default“You should be able to understand me now. You can open your eyes. Don’t be afraid.” I was afraid."
63,https://medium.com/@xdotai/a-year-in-the-life-of-amy-ingram-ai-personal-assistant-140d0f2dc78d?source=tag_archive---------3----------------,140d0f2dc78d,2016-02-26T16:31:49.075Z,2,"A Year in The Life of Amy Ingram, AI Personal Assistant"
3,https://medium.com/@krishramineni/how-can-we-actually-stay-connected-online-74afa5a2f013?source=tag_archive---------7----------------,74afa5a2f013,2016-02-26T22:23:13.534Z,1,How can we actually stay connected online?The social age has brought us so much. Our real-world friendships have transferred…
11,https://medium.com/@Michael_Spencer/why-facebook-reactions-are-dangerous-8ff3ccc61e31?source=tag_archive---------1----------------,8ff3ccc61e31,2016-02-27T19:46:53.075Z,3,"Why Facebook Reactions are DangerousFeb 27, 2016Share on LinkedIn"
11,https://medium.com/@matteoberlucchi/artificial-intelligence-is-the-future-of-healthcare-2355052c0be6?source=tag_archive---------2----------------,2355052c0be6,2016-02-27T16:35:58.679Z,1,Artificial Intelligence is the Future of Healthcare
229,https://medium.com/snips-ai/ntm-lasagne-a-library-for-neural-turing-machines-in-lasagne-2cdce6837315?source=tag_archive---------0----------------,2cdce6837315,2016-02-24T18:00:55.520Z,6,"NTM-Lasagne: A Library for Neural Turing Machines in LasagneThe first part of this post is about the theory behind Neural Turing Machines. The second is about the library itself, and benchmarks on tasks from Google DeepMind’s original paper."
336,https://medium.com/machine-intelligence-report/robo-bill-cunningham-shazam-for-fashion-with-deep-neural-networks-7126ea39197b?source=tag_archive---------1----------------,7126ea39197b,2016-02-16T13:31:01.435Z,5,Robo Bill Cunningham: Shazam for Fashion With Deep Neural Networks
352,https://medium.com/@awjuliani/simple-softmax-in-python-tutorial-d6b4c4ed5c16?source=tag_archive---------2----------------,d6b4c4ed5c16,2016-02-22T21:43:40.125Z,3,"Simple Softmax Regression in Python — TutorialSoftmax regression is a method in machine learning which allows for the classification of an input into discrete classes. Unlike the commonly used logistic regression, which can only perform binary classifications, softmax allows for classification…"
113,https://medium.com/planet-stories/cloudless-an-open-source-computer-vision-tool-for-satellite-imagery-6f4daaa4851f?source=tag_archive---------4----------------,6f4daaa4851f,2016-02-08T22:42:28.188Z,2,"Cloudless: An Open Source Computer Vision Tool for Satellite ImageryI’m proud to announce the 1.0 release of Cloudless, an open source computer vision…"
71,https://medium.freecodecamp.org/best-gitter-channels-for-data-science-machine-learning-6e8eeb5063c0?source=tag_archive---------5----------------,6e8eeb5063c0,2016-02-16T14:23:31.876Z,1,Best Gitter Channels for: Data Science & Machine Learning
8,https://cvil.ly/re-work-virtual-assistant-summit-jan-28-29-2016-ff8ac64089c7?source=tag_archive---------1----------------,ff8ac64089c7,2016-02-05T23:19:44.632Z,1,"RE-Work Virtual Assistant Summit — Jan 28 & 29, 2016Last week I had the pleasure of attending the Re-Work Deep Learning Summit. The summit was split into two tracks — Deep Learning and Virtual Assistants. I spent my time in the Virtual Assistants track while my colleagues attended Deep…"
229,https://medium.com/snips-ai/ntm-lasagne-a-library-for-neural-turing-machines-in-lasagne-2cdce6837315?source=tag_archive---------0----------------,2cdce6837315,2016-02-24T18:00:55.520Z,6,"NTM-Lasagne: A Library for Neural Turing Machines in LasagneThe first part of this post is about the theory behind Neural Turing Machines. The second is about the library itself, and benchmarks on tasks from Google DeepMind’s original paper."
336,https://medium.com/machine-intelligence-report/robo-bill-cunningham-shazam-for-fashion-with-deep-neural-networks-7126ea39197b?source=tag_archive---------1----------------,7126ea39197b,2016-02-16T13:31:01.435Z,5,Robo Bill Cunningham: Shazam for Fashion With Deep Neural Networks
352,https://medium.com/@awjuliani/simple-softmax-in-python-tutorial-d6b4c4ed5c16?source=tag_archive---------2----------------,d6b4c4ed5c16,2016-02-22T21:43:40.125Z,3,"Simple Softmax Regression in Python — TutorialSoftmax regression is a method in machine learning which allows for the classification of an input into discrete classes. Unlike the commonly used logistic regression, which can only perform binary classifications, softmax allows for classification…"
113,https://medium.com/planet-stories/cloudless-an-open-source-computer-vision-tool-for-satellite-imagery-6f4daaa4851f?source=tag_archive---------4----------------,6f4daaa4851f,2016-02-08T22:42:28.188Z,2,"Cloudless: An Open Source Computer Vision Tool for Satellite ImageryI’m proud to announce the 1.0 release of Cloudless, an open source computer vision…"
71,https://medium.freecodecamp.org/best-gitter-channels-for-data-science-machine-learning-6e8eeb5063c0?source=tag_archive---------5----------------,6e8eeb5063c0,2016-02-16T14:23:31.876Z,1,Best Gitter Channels for: Data Science & Machine Learning
113,https://medium.com/planet-stories/cloudless-an-open-source-computer-vision-tool-for-satellite-imagery-6f4daaa4851f?source=tag_archive---------0----------------,6f4daaa4851f,2016-02-08T22:42:28.188Z,2,"Cloudless: An Open Source Computer Vision Tool for Satellite ImageryI’m proud to announce the 1.0 release of Cloudless, an open source computer vision…"
229,https://medium.com/snips-ai/ntm-lasagne-a-library-for-neural-turing-machines-in-lasagne-2cdce6837315?source=tag_archive---------0----------------,2cdce6837315,2016-02-24T18:00:55.520Z,6,"NTM-Lasagne: A Library for Neural Turing Machines in LasagneThe first part of this post is about the theory behind Neural Turing Machines. The second is about the library itself, and benchmarks on tasks from Google DeepMind’s original paper."
336,https://medium.com/machine-intelligence-report/robo-bill-cunningham-shazam-for-fashion-with-deep-neural-networks-7126ea39197b?source=tag_archive---------1----------------,7126ea39197b,2016-02-16T13:31:01.435Z,5,Robo Bill Cunningham: Shazam for Fashion With Deep Neural Networks
352,https://medium.com/@awjuliani/simple-softmax-in-python-tutorial-d6b4c4ed5c16?source=tag_archive---------2----------------,d6b4c4ed5c16,2016-02-22T21:43:40.125Z,3,"Simple Softmax Regression in Python — TutorialSoftmax regression is a method in machine learning which allows for the classification of an input into discrete classes. Unlike the commonly used logistic regression, which can only perform binary classifications, softmax allows for classification…"
113,https://medium.com/planet-stories/cloudless-an-open-source-computer-vision-tool-for-satellite-imagery-6f4daaa4851f?source=tag_archive---------4----------------,6f4daaa4851f,2016-02-08T22:42:28.188Z,2,"Cloudless: An Open Source Computer Vision Tool for Satellite ImageryI’m proud to announce the 1.0 release of Cloudless, an open source computer vision…"
71,https://medium.freecodecamp.org/best-gitter-channels-for-data-science-machine-learning-6e8eeb5063c0?source=tag_archive---------5----------------,6e8eeb5063c0,2016-02-16T14:23:31.876Z,1,Best Gitter Channels for: Data Science & Machine Learning
229,https://medium.com/snips-ai/ntm-lasagne-a-library-for-neural-turing-machines-in-lasagne-2cdce6837315?source=tag_archive---------0----------------,2cdce6837315,2016-02-24T18:00:55.520Z,6,"NTM-Lasagne: A Library for Neural Turing Machines in LasagneThe first part of this post is about the theory behind Neural Turing Machines. The second is about the library itself, and benchmarks on tasks from Google DeepMind’s original paper."
336,https://medium.com/machine-intelligence-report/robo-bill-cunningham-shazam-for-fashion-with-deep-neural-networks-7126ea39197b?source=tag_archive---------1----------------,7126ea39197b,2016-02-16T13:31:01.435Z,5,Robo Bill Cunningham: Shazam for Fashion With Deep Neural Networks
352,https://medium.com/@awjuliani/simple-softmax-in-python-tutorial-d6b4c4ed5c16?source=tag_archive---------2----------------,d6b4c4ed5c16,2016-02-22T21:43:40.125Z,3,"Simple Softmax Regression in Python — TutorialSoftmax regression is a method in machine learning which allows for the classification of an input into discrete classes. Unlike the commonly used logistic regression, which can only perform binary classifications, softmax allows for classification…"
113,https://medium.com/planet-stories/cloudless-an-open-source-computer-vision-tool-for-satellite-imagery-6f4daaa4851f?source=tag_archive---------4----------------,6f4daaa4851f,2016-02-08T22:42:28.188Z,2,"Cloudless: An Open Source Computer Vision Tool for Satellite ImageryI’m proud to announce the 1.0 release of Cloudless, an open source computer vision…"
71,https://medium.freecodecamp.org/best-gitter-channels-for-data-science-machine-learning-6e8eeb5063c0?source=tag_archive---------5----------------,6e8eeb5063c0,2016-02-16T14:23:31.876Z,1,Best Gitter Channels for: Data Science & Machine Learning
336,https://medium.com/machine-intelligence-report/robo-bill-cunningham-shazam-for-fashion-with-deep-neural-networks-7126ea39197b?source=tag_archive---------0----------------,7126ea39197b,2016-02-16T13:31:01.435Z,5,Robo Bill Cunningham: Shazam for Fashion With Deep Neural Networks
71,https://medium.freecodecamp.org/best-gitter-channels-for-data-science-machine-learning-6e8eeb5063c0?source=tag_archive---------1----------------,6e8eeb5063c0,2016-02-16T14:23:31.876Z,1,Best Gitter Channels for: Data Science & Machine Learning
229,https://medium.com/snips-ai/ntm-lasagne-a-library-for-neural-turing-machines-in-lasagne-2cdce6837315?source=tag_archive---------0----------------,2cdce6837315,2016-02-24T18:00:55.520Z,6,"NTM-Lasagne: A Library for Neural Turing Machines in LasagneThe first part of this post is about the theory behind Neural Turing Machines. The second is about the library itself, and benchmarks on tasks from Google DeepMind’s original paper."
336,https://medium.com/machine-intelligence-report/robo-bill-cunningham-shazam-for-fashion-with-deep-neural-networks-7126ea39197b?source=tag_archive---------1----------------,7126ea39197b,2016-02-16T13:31:01.435Z,5,Robo Bill Cunningham: Shazam for Fashion With Deep Neural Networks
352,https://medium.com/@awjuliani/simple-softmax-in-python-tutorial-d6b4c4ed5c16?source=tag_archive---------2----------------,d6b4c4ed5c16,2016-02-22T21:43:40.125Z,3,"Simple Softmax Regression in Python — TutorialSoftmax regression is a method in machine learning which allows for the classification of an input into discrete classes. Unlike the commonly used logistic regression, which can only perform binary classifications, softmax allows for classification…"
113,https://medium.com/planet-stories/cloudless-an-open-source-computer-vision-tool-for-satellite-imagery-6f4daaa4851f?source=tag_archive---------4----------------,6f4daaa4851f,2016-02-08T22:42:28.188Z,2,"Cloudless: An Open Source Computer Vision Tool for Satellite ImageryI’m proud to announce the 1.0 release of Cloudless, an open source computer vision…"
71,https://medium.freecodecamp.org/best-gitter-channels-for-data-science-machine-learning-6e8eeb5063c0?source=tag_archive---------5----------------,6e8eeb5063c0,2016-02-16T14:23:31.876Z,1,Best Gitter Channels for: Data Science & Machine Learning
229,https://medium.com/snips-ai/ntm-lasagne-a-library-for-neural-turing-machines-in-lasagne-2cdce6837315?source=tag_archive---------0----------------,2cdce6837315,2016-02-24T18:00:55.520Z,6,"NTM-Lasagne: A Library for Neural Turing Machines in LasagneThe first part of this post is about the theory behind Neural Turing Machines. The second is about the library itself, and benchmarks on tasks from Google DeepMind’s original paper."
336,https://medium.com/machine-intelligence-report/robo-bill-cunningham-shazam-for-fashion-with-deep-neural-networks-7126ea39197b?source=tag_archive---------1----------------,7126ea39197b,2016-02-16T13:31:01.435Z,5,Robo Bill Cunningham: Shazam for Fashion With Deep Neural Networks
352,https://medium.com/@awjuliani/simple-softmax-in-python-tutorial-d6b4c4ed5c16?source=tag_archive---------2----------------,d6b4c4ed5c16,2016-02-22T21:43:40.125Z,3,"Simple Softmax Regression in Python — TutorialSoftmax regression is a method in machine learning which allows for the classification of an input into discrete classes. Unlike the commonly used logistic regression, which can only perform binary classifications, softmax allows for classification…"
113,https://medium.com/planet-stories/cloudless-an-open-source-computer-vision-tool-for-satellite-imagery-6f4daaa4851f?source=tag_archive---------4----------------,6f4daaa4851f,2016-02-08T22:42:28.188Z,2,"Cloudless: An Open Source Computer Vision Tool for Satellite ImageryI’m proud to announce the 1.0 release of Cloudless, an open source computer vision…"
71,https://medium.freecodecamp.org/best-gitter-channels-for-data-science-machine-learning-6e8eeb5063c0?source=tag_archive---------5----------------,6e8eeb5063c0,2016-02-16T14:23:31.876Z,1,Best Gitter Channels for: Data Science & Machine Learning
229,https://medium.com/snips-ai/ntm-lasagne-a-library-for-neural-turing-machines-in-lasagne-2cdce6837315?source=tag_archive---------0----------------,2cdce6837315,2016-02-24T18:00:55.520Z,6,"NTM-Lasagne: A Library for Neural Turing Machines in LasagneThe first part of this post is about the theory behind Neural Turing Machines. The second is about the library itself, and benchmarks on tasks from Google DeepMind’s original paper."
336,https://medium.com/machine-intelligence-report/robo-bill-cunningham-shazam-for-fashion-with-deep-neural-networks-7126ea39197b?source=tag_archive---------1----------------,7126ea39197b,2016-02-16T13:31:01.435Z,5,Robo Bill Cunningham: Shazam for Fashion With Deep Neural Networks
352,https://medium.com/@awjuliani/simple-softmax-in-python-tutorial-d6b4c4ed5c16?source=tag_archive---------2----------------,d6b4c4ed5c16,2016-02-22T21:43:40.125Z,3,"Simple Softmax Regression in Python — TutorialSoftmax regression is a method in machine learning which allows for the classification of an input into discrete classes. Unlike the commonly used logistic regression, which can only perform binary classifications, softmax allows for classification…"
113,https://medium.com/planet-stories/cloudless-an-open-source-computer-vision-tool-for-satellite-imagery-6f4daaa4851f?source=tag_archive---------4----------------,6f4daaa4851f,2016-02-08T22:42:28.188Z,2,"Cloudless: An Open Source Computer Vision Tool for Satellite ImageryI’m proud to announce the 1.0 release of Cloudless, an open source computer vision…"
71,https://medium.freecodecamp.org/best-gitter-channels-for-data-science-machine-learning-6e8eeb5063c0?source=tag_archive---------5----------------,6e8eeb5063c0,2016-02-16T14:23:31.876Z,1,Best Gitter Channels for: Data Science & Machine Learning
352,https://medium.com/@awjuliani/simple-softmax-in-python-tutorial-d6b4c4ed5c16?source=tag_archive---------0----------------,d6b4c4ed5c16,2016-02-22T21:43:40.125Z,3,"Simple Softmax Regression in Python — TutorialSoftmax regression is a method in machine learning which allows for the classification of an input into discrete classes. Unlike the commonly used logistic regression, which can only perform binary classifications, softmax allows for classification…"
