claps,link,post_id,post_time,response,title
433,https://medium.com/ilenze-com/object-detection-using-deep-learning-for-advanced-users-part-1-183bbbb08b19?source=tag_archive---------0----------------,183bbbb08b19,2016-09-17T23:56:52.289Z,4,Object Detection using Deep Learning for advanced users (Part-1)Prologue:This is a three part series which will elaborate on Object Detection in images using Convolutional Neural Networks (CNN). First part will deal with groundbreaking papers in detection. Second part will give an…
147,https://medium.com/@acrosson/building-a-deep-learning-box-d17d97e2905c?source=tag_archive---------1----------------,d17d97e2905c,2016-09-17T19:09:27.220Z,16,"Building a Deep Learning BoxThis is part one of our building a deep learning machine series. You can find the other posts here:Building a Deep Learning BoxGPU Virtualization with KVM / QEMUInstalling Nvidia, Cuda, CuDNN…"
141,https://medium.com/self-driving-cars/tensorflow-vs-tf-learn-vs-keras-vs-tf-slim-b83811966020?source=tag_archive---------2----------------,b83811966020,2016-09-17T04:14:53.520Z,12,TensorFlow vs. TF Learn vs. Keras vs. TF-SlimThe quest for a really easy deep learning library.
3,https://medium.com/@andraganescu/shameless-plug-but-sincere-nonetheless-c65382d0aa5?source=tag_archive---------9----------------,c65382d0aa5,2016-09-17T21:43:13.504Z,1,"Shameless plug, but sincere nonethelessHi Nitin, I really enjoyed this story even more so as it is something I’ve mulled on for a lot of time. I liked this idea the most:What matters is the emergent behaviour (the neural pattern) out of the collective work of everyone who…"
1.5K,https://chatbotslife.com/ultimate-guide-to-leveraging-nlp-machine-learning-for-you-chatbot-531ff2dd870c?source=tag_archive---------0----------------,531ff2dd870c,2016-09-18T14:26:01.872Z,6,Ultimate Guide to Leveraging NLP & Machine Learning for your ChatbotCode Snippets and Github Included
259,https://medium.com/autonomous-agents/bayesian-regularization-for-neuralnetworks-2f2d34f03adc?source=tag_archive---------1----------------,2f2d34f03adc,2016-09-18T03:50:12.723Z,2,"Bayesian Regularization for #NeuralNetworksIf you are a science or math nerd, there is no way in hell you would have not heard…"
21,https://medium.com/@bakiiii/deep-learning-ile-t%C3%BCrk%C3%A7e-film-yorumlar%C4%B1ndan-duygu-ve-puan-tahmini-78a606d86dde?source=tag_archive---------2----------------,78a606d86dde,2016-09-18T15:50:44.124Z,3,Word2Vec ile Türkçe Film Yorumlarından Duygu ve Puan Tahmini
15,https://machinelearnings.co/machine-learnings-9-e04fb266319f?source=tag_archive---------4----------------,e04fb266319f,2016-09-18T19:16:03.838Z,1,"Elon Musk Wants AI Spread Across Companies — #9Machine Learnings is a weekly roundup of machine learning, artificial intelligence, and data science news. Want to keep up with all the breakthroughs…"
3,https://medium.com/amruth-pillai/set-sail-at-banyan-hack-16-3d0528369050?source=tag_archive---------5----------------,3d0528369050,2016-09-18T15:34:12.984Z,1,How did we set SAIL at the Banyan Hack ‘16?The Banyan Hack 2016 was a 24-hour Hackathon that invited students from all over the…
10,https://medium.com/ml-for-newbies/newbies-guide-to-ml-part-7-1b168499ef21?source=tag_archive---------8----------------,1b168499ef21,2016-09-18T16:38:14.967Z,1,"Newbie’s Guide to ML — Part 7We’ve looked at entropy, information gain, and ID3. It’s time to put all of what we have learned into code…"
246,https://blog.cardiogr.am/three-challenges-for-artificial-intelligence-in-medicine-dfb9993ae750?source=tag_archive---------0----------------,dfb9993ae750,2016-09-19T22:08:38.956Z,7,"Three Challenges for Artificial Intelligence in MedicineWhy is the world’s most advanced AI used for cat videos, but not to help us live longer and healthier lives? A brief history of AI in Medicine, and the factors that may help it succeed where it has failed before."
7,https://tech.iheart.com/mapping-the-world-of-music-using-machine-learning-part-2-aa50b6a0304c?source=tag_archive---------2----------------,aa50b6a0304c,2016-09-19T15:54:45.656Z,1,Mapping the World of Music Using Machine Learning: Part 2In June 2016 Ravi Mody and Tim Schmeier gave a presentation at the NYC Machine Learning meetup to discuss their work on the data science team at iHeartRadio. This is the second in a three part article complementing the…
71,https://medium.com/@tak_lo/what-ive-learned-from-building-an-ai-ml-accelerator-from-the-ground-up-5d7882090bca?source=tag_archive---------3----------------,5d7882090bca,2016-09-19T06:06:15.396Z,1,"What I’ve learned from building an AI/ML accelerator from the ground-upJust 5 months ago we started Zeroth. And this Sunday, September 25 will be the application​ deadline for my first cohort."
1,https://medium.com/@e_green/learning-about-machine-learning-an-introduction-66365300aa4e?source=tag_archive---------20----------------,66365300aa4e,2016-09-19T00:27:09.401Z,1,"Learning About Machine Learning: An Introduction“Machine learning” is the kind of tech buzzword that is both alluring and vague. From tech giants like Google and Facebook to just-off-the-ground startups, machine learning seems to be everywhere. But what does it actually entail? And what is…"
127,https://medium.com/project-juno/european-machine-intelligence-landscape-43a22b44e961?source=tag_archive---------0----------------,43a22b44e961,2016-09-20T09:01:01.916Z,3,European Machine Intelligence LandscapeWe @ProjectJunoAI are big fans of landscapes. That’s why we’ve created a machine…
17,https://medium.com/@ChrisHerd/becoming-superhuman-49f270714c11?source=tag_archive---------7----------------,49f270714c11,2016-09-20T07:28:40.827Z,3,Becoming Superhuman: The Future of HumanityThe age of the superhuman is upon us.
2,https://medium.com/@philipe.ambroziodias/how-machine-learning-may-change-the-way-the-elderly-live-9666c7efc628?source=tag_archive---------10----------------,9666c7efc628,2016-09-20T01:34:58.267Z,1,"How machine learning may change the way the elderly liveAmong the different possible applications of machine learning and respective groups of people favored by them, some welcome ones would be for improvement of quality of life of the elderly."
61,https://medium.com/motiva/motiva-a-different-kind-of-marketing-technology-company-ef3d53075195?source=tag_archive---------11----------------,ef3d53075195,2016-09-20T15:24:15.592Z,1,Motiva: A Different Kind of Marketing Technology Company
2,https://medium.com/@jamie_maguire1/what-is-sentiment-analysis-how-can-it-help-my-business-brand-or-product-45b6471dec49?source=tag_archive---------15----------------,45b6471dec49,2016-09-20T12:07:48.527Z,1,"What is Sentiment Analysis? How can it help my business, brand or product?IntroductionPeople have always had an interest on what specific individuals or groups of individuals think or what their opinion is. Since the inception of the…"
1,https://medium.com/@phillip.a.schmanski/90-is-the-new-80-8e71dd3486b5?source=tag_archive---------24----------------,8e71dd3486b5,2016-09-20T22:19:02.036Z,1,"90 is the new 80My girlfriend is getting a Masters in Public Health and has a personal interest in geriatric care so in preparing a blog post about how machine learning could potentially help elderly folks in 10 years from now, I asked her about what are the areas that they could use the most help in. She gave me…"
238,https://towardsdatascience.com/how-i-predicted-the-stock-market-at-numerai-ml-tournament-6f74e1c8809e?source=tag_archive---------0----------------,6f74e1c8809e,2016-09-21T14:45:50.621Z,3,How I predicted the stock market at Numerai ML tournament
45,https://medium.com/@akadiyala/smart-buildings-the-silent-killer-app-of-iot-621d06e75367?source=tag_archive---------0----------------,621d06e75367,2016-09-22T18:23:50.417Z,2,Smart Buildings — the silent ‘killer app’ of IoT
28,https://aleph.vc/scaling-companies-through-management-by-exception-why-we-invested-7-5m-in-anodot-d73110d218ee?source=tag_archive---------1----------------,d73110d218ee,2016-09-22T14:08:39.756Z,1,Scaling companies through management by exception. Why we invested $7.5M in AnodotThe price of light is less than the cost of darkness.  — Arthur C. Nielsen (Market Researcher & Founder of ACNielsen)
28,https://medium.com/@camrongodbout/sales-automation-through-a-deep-learning-platform-b31ce032d6af?source=tag_archive---------2----------------,b31ce032d6af,2016-09-22T01:53:29.045Z,1,Sales Automation through a Deep Learning Platform
14,https://medium.com/equal-future/artificial-intelligence-will-force-us-to-confront-our-values-6f32682a32ec?source=tag_archive---------4----------------,6f32682a32ec,2016-09-22T17:42:59.594Z,2,"Artificial intelligence will force us to confront our values“Algorithmic accountability” is critical, but it presumes we know exactly what we’re trying to protect."
6,https://medium.com/@georgeprest/the-marketing-organisation-of-the-future-is-built-on-software-and-machine-learning-7770ae0167a2?source=tag_archive---------6----------------,7770ae0167a2,2016-09-22T18:29:51.025Z,1,The marketing organisation of the future is built on software and machine learning
823,https://medium.com/@awjuliani/generative-adversarial-networks-explained-with-a-classic-spongebob-squarepants-episode-54deab2fce39?source=tag_archive---------0----------------,54deab2fce39,2016-09-23T15:54:38.458Z,16,Generative Adversarial Networks Explained with a Classic Spongebob Squarepants Episode
44,https://medium.com/emergent-future/recognising-beer-with-tensorflow-9dedfee3c3c0?source=tag_archive---------1----------------,9dedfee3c3c0,2016-09-23T13:01:03.384Z,2,"Recognising Beer with TensorFlowOne of the demonstrations we have in Accenture Labs showcases a screen, with a camera which you can show a beer. The screen then recognises the beer and gives you information about it. It looks a little like this:"
21,https://medium.com/self-driving-cars/behavioral-cloning-25d6c8b88f37?source=tag_archive---------4----------------,25d6c8b88f37,2016-09-23T03:46:49.930Z,1,Behavioral CloningSign up for CarND to learn how to build deep neural networks to drive cars.
685,https://medium.com/@dhruvp/how-to-write-a-neural-network-to-play-pong-from-scratch-956b57d4f6e0?source=tag_archive---------0----------------,956b57d4f6e0,2016-09-25T22:35:09.930Z,9,"Write an AI to win at Pong from scratch with Reinforcement LearningThere’s a huge difference between reading about Reinforcement Learning and actually implementing it.In this post, you’ll implement a Neural Network for Reinforcement Learning and see it…"
42,https://medium.com/@akelleh/the-data-processing-inequality-da242b40800b?source=tag_archive---------1----------------,da242b40800b,2016-09-26T13:53:46.957Z,5,"The Data Processing InequalityIf you look at the wikipedia article for the data processing inequality, it’s really just a stub (as of the time this article was published). The inequality is given, but there is little context. The data processing inequality is fundamental to data science, machine…"
629,https://hackernoon.com/the-self-learning-quant-d3329fcc9915?source=tag_archive---------0----------------,d3329fcc9915,2016-09-27T05:27:46.293Z,14,The Self Learning QuantRecently there has been a lot of attention around Google DeepMinds victory over Lee Sedol in the board game Go. This…
127,https://medium.com/osldev-blog/tensorflow-serving-practical-introduction-9ce29ccd63f?source=tag_archive---------1----------------,9ce29ccd63f,2016-09-27T14:26:02.254Z,9,TensorFlow Serving practical introduction.TensorFlow has been open to the public for about a year now and the buzz is real…
217,https://hackernoon.com/intelligent-products-should-give-you-superpowers-eb546df73b10?source=tag_archive---------3----------------,eb546df73b10,2016-09-27T22:28:23.148Z,10,"Intelligent products should give you superpowersThe industry is falling over itself to make products ‘intelligent’ but what does that really mean to a user? As a Product Manager in this space, I’ve been thinking about intelligence and what it really means to users. There are many definitions…"
104,https://uxdesign.cc/6-ways-designers-need-to-adapt-in-the-age-of-ai-bdf22a55c295?source=tag_archive---------4----------------,bdf22a55c295,2016-09-27T16:44:38.213Z,2,6 Ways Designers Need to Adapt in the Age of AI
114,https://blog.datazar.com/first-debate-2016-sentimental-analysis-of-candidates-58d87092fc6a?source=tag_archive---------6----------------,58d87092fc6a,2016-09-27T20:59:39.825Z,1,Sentimental Analysis of the First Presidential Debate of 2016 Using Machine LearningThis post analyzes sentiment of people towards the 2016 presidential candidates post the First Presidential Debate using Tweets. We focus on Tweets containing the names of Hillary…
1.2K,https://medium.com/emergent-future/simple-reinforcement-learning-with-tensorflow-part-1-5-contextual-bandits-bff01d1aad9c?source=tag_archive---------0----------------,bff01d1aad9c,2016-09-28T01:23:05.977Z,12,Simple Reinforcement Learning with Tensorflow Part 1.5: Contextual Bandits
24,https://medium.com/self-driving-cars/artificial-intelligence-machine-learning-deep-learning-42d1284beb08?source=tag_archive---------4----------------,42d1284beb08,2016-09-28T15:55:25.710Z,1,"Artificial Intelligence, Machine Learning, Deep Learning"
5,https://medium.com/@charlestsai/commencement-6951204a29e8?source=tag_archive---------6----------------,6951204a29e8,2016-09-28T22:19:00.937Z,1,"Commencement: Machine vs. Human LearningOn May 16, 2020, IBM’s Watson addressed UC Berkeley’s Class of 2020 at their graduation —…"
252,https://medium.com/udacity/challenge-2-using-deep-learning-to-predict-steering-angles-f42004a36ff3?source=tag_archive---------0----------------,f42004a36ff3,2016-09-29T20:27:08.281Z,17,Challenge #2: Using Deep Learning to Predict Steering AnglesUdacity Self-Driving Car Challenge #2
683,https://medium.com/udacity/were-building-an-open-source-self-driving-car-ac3e973cd163?source=tag_archive---------1----------------,ac3e973cd163,2016-09-29T20:26:24.492Z,12,"We’re Building an Open Source Self-Driving CarAnd we want your help!At Udacity, we believe in democratizing education. How can we provide opportunity to everyone on the planet? We also believe in teaching really amazing and useful subject matter. When…"
331,https://medium.com/udacity/challenge-1-3d-model-for-camera-mount-f5ffcc1655b5?source=tag_archive---------2----------------,f5ffcc1655b5,2016-09-29T20:26:45.230Z,4,Challenge #1: 3D Model for Camera MountUdacity Self-Driving Car Challenge #1
379,https://medium.com/startup-grind/building-an-ai-startup-realities-tactics-6e1d18a4f7ab?source=tag_archive---------3----------------,6e1d18a4f7ab,2016-09-29T19:26:31.000Z,7,Building an AI Startup: Realities & TacticsInside: The 5 Ps to Building a Great AI Company
126,https://medium.com/@jakestein/data-engineer-vs-data-scientist-the-difference-according-to-linkedin-e0bee6248fd4?source=tag_archive---------4----------------,e0bee6248fd4,2016-09-29T13:45:15.375Z,2,Data Engineers vs. Data Scientists: The Difference According to LinkedIn Data
46,https://blog.metaflow.fr/sparse-coding-a-simple-exploration-152a3c900a7c?source=tag_archive---------5----------------,152a3c900a7c,2016-09-29T12:41:11.232Z,2,Sparse coding: A simple explorationDisclaimer:
107,https://medium.com/@nikhilbd/pointwise-vs-pairwise-vs-listwise-learning-to-rank-80a8fe8fadfd?source=tag_archive---------6----------------,80a8fe8fadfd,2016-09-29T16:38:31.155Z,1,Pointwise vs. Pairwise vs. Listwise Learning to Rank
13,https://futureofwork.ai/the-perils-learnings-of-naming-a-bot-74bfa833e630?source=tag_archive---------11----------------,74bfa833e630,2016-09-29T17:47:51.764Z,1,"The Perils & Learnings of Naming a BotWhen we started Zoom.ai, we built an automated assistant for everyone in the workplace.But that assistant needed a name that was memorable and relatable, so we called it Ava, short for “automated virtual assistant”."
2,https://medium.com/@I_AM_IBN/artificial-intelligence-and-the-caribbean-c733c122a6dd?source=tag_archive---------25----------------,c733c122a6dd,2016-09-29T19:36:08.918Z,2,Artificial Intelligence and the CaribbeanIf you read global tech news you’ll see that the next “big thing” is Artificial…
1.1K,https://medium.com/rasa-blog/do-it-yourself-nlp-for-bot-developers-2e2da2817f3d?source=tag_archive---------0----------------,2e2da2817f3d,2016-09-01T09:55:12.553Z,18,"Do-it-yourself NLP for bot developersI believe in most cases it makes sense for bot makers to build their own natural language parser, rather than using a third party API. There are good strategic and technical arguments for doing this, and I want to show how easily you can put something together…"
215,https://medium.com/@astroteller/perspectives-on-ai-f706d234caa5?source=tag_archive---------1----------------,f706d234caa5,2016-09-01T16:52:27.548Z,14,"Perspectives on AIIn 1997, when I was a graduate student studying computer science, I published my first novel, a parable about the dangers of approaching technology in general — and artificial intelligence (AI) in particular — with fear and hostility. Having done a Ph.D. in AI in the 90’s, I’ve been working for…"
65,https://thecoffeelicious.com/from-the-jetsons-to-a-woman-in-tech-535c8971bec9?source=tag_archive---------4----------------,535c8971bec9,2016-09-01T00:06:51.962Z,1,"From The Jetsons to a Woman in TechI was 5. It was Saturday morning. I jumped out of bed, still in my GI Joe pajamas (that my mom…"
27,https://mustapha.me/an-example-using-star-wars-of-how-bad-apples-machine-learning-is-c4baa2ccbf96?source=tag_archive---------5----------------,c4baa2ccbf96,2016-09-01T11:15:03.502Z,2,An Example Using Star Wars of How Bad Apple’s “Machine Learning” is
57,https://medium.com/@andykamath/deep-learning-and-random-forest-regression-algorithms-to-predict-likes-on-instagram-7051ae532c35?source=tag_archive---------6----------------,7051ae532c35,2016-09-01T03:20:00.180Z,1,Deep Learning and Random Forest Prediction Models for Image AnalyticsThe ProblemIt all started August 24th when one of my close friends was having a moral crisis — which of these Instagram pictures should I post? Which one will get the most…
17,https://medium.com/@salesforce/10-ways-artificial-intelligence-will-change-the-customer-experience-cfef4125c602?source=tag_archive---------8----------------,cfef4125c602,2016-09-01T17:08:09.163Z,2,10 Ways Artificial Intelligence Will Change the Customer ExperienceBy Brandon Reynolds
5,https://blog.converse.ai/why-making-bots-slower-might-be-a-good-idea-90c76ad623ce?source=tag_archive---------15----------------,90c76ad623ce,2016-09-01T15:57:37.235Z,2,"Why making bots slower might be a good idea.Whether or not your bot should act like a human is quite a controversial topic at the moment.In recent months we have had bots pretending to be humans, humans pretending to be bots, and it wouldn’t surprise me if we’ve had…"
1.7K,https://medium.com/@awjuliani/simple-reinforcement-learning-with-tensorflow-part-4-deep-q-networks-and-beyond-8438a3e2b8df?source=tag_archive---------0----------------,8438a3e2b8df,2016-09-02T17:29:52.399Z,48,Simple Reinforcement Learning with Tensorflow Part 4: Deep Q-Networks and Beyond
48,https://medium.com/the-downlinq/establishing-a-machine-learning-workflow-530628cfe67?source=tag_archive---------2----------------,530628cfe67,2016-09-02T21:40:57.257Z,1,"Establishing a Machine Learning WorkflowWhile the rapid advancements in neural networks offer enormous promise for the field of imagery analytics, application of these technologies against an ever-increasing volume of commercially available satellite imagery remains in its early stages. CosmiQ…"
11,https://medium.com/@matthiasroder/why-classical-music-needs-hackathons-498a18190dc0?source=tag_archive---------6----------------,498a18190dc0,2016-09-02T11:05:03.947Z,2,"Why Classical Music Needs HackathonsThe Eliette and Herbert von Karajan Institute and the MIT Music Department are hosting a Classical Music Hackathon in Boston, October 21–23."
7,https://medium.com/@lolitataub/cognitive-computing-ai-resources-ebbb0f23376c?source=tag_archive---------8----------------,ebbb0f23376c,2016-09-02T20:55:01.223Z,2,Cognitive Computing / AI ResourcesBy Lolita Taub (@lolitataub)
19,https://medium.com/@kurtybot/why-extra-terrestrials-are-not-organisms-5de99034a08b?source=tag_archive---------1----------------,5de99034a08b,2016-09-03T11:52:40.728Z,4,Why Extra Terrestrials Are Not Organisms“We are not alone.”Nobody really thinks twice when hearing this. This saying has mended into its very fabric that the benefit of finding other life forms means we can be freed from our loneliness. The saying isn’t “We are not…
28,https://medium.com/@cj.maybery/the-first-thing-a-conscious-robot-might-do-is-commit-suicide-a-thought-experiment-43ccbb2a97c5?source=tag_archive---------0----------------,43ccbb2a97c5,2016-09-04T03:25:26.891Z,2,The first thing a conscious robot might do is commit suicide. A thought experiment.
18,https://medium.com/enrique-dans/think-your-job-is-safe-get-real-de254ad3a37c?source=tag_archive---------4----------------,de254ad3a37c,2016-09-04T20:37:11.543Z,1,"Think your job is safe? Get real.US distribution giant Walmart has announced it’s sacking 7,000 employees due to increased automation…"
575,https://chatbotslife.com/10-tips-on-creating-an-addictive-chatbot-experience-b796ea6d1178?source=tag_archive---------0----------------,b796ea6d1178,2016-09-05T20:43:57.258Z,9,"10 Tips on Creating an Addictive ChatBotOver the past few months, I have been making bots, a lot of bots. Here are some of the…"
11,https://ryanxcharlestimes.com/own-the-robots-a-twenty-year-strategy-2462d676485e?source=tag_archive---------5----------------,2462d676485e,2016-09-05T19:07:51.267Z,2,Own the Robots: A Twenty Year StrategyAlmost every technology-focused organization is beginning to leverage machine learning to…
60,https://becominghuman.ai/a-purpose-driven-user-experience-ef00c937078?source=tag_archive---------6----------------,ef00c937078,2016-09-05T10:59:20.714Z,2,A Purpose-Driven User ExperienceApps are tools that help us satisfy our needs and our desires. Yet our operating systems know nothing of our needs and desires. My word processor doesn’t know why I’m opening it; my email client why I’m composing a message; nor my social network service what I’m looking…
1,https://medium.com/@aleclaza/thanks-for-the-thoughtful-response-tobias-goebel-5a1b14d13dc8?source=tag_archive---------15----------------,5a1b14d13dc8,2016-09-05T21:22:49.088Z,Thanks,"Thanks for the thoughtful response, Tobias Goebel. You helped me realize that what I had written as context should actually be further broken down into two distinct areas.What does the system know about the user based on their interaction with the system?"
1,https://medium.com/@OwenBanner/i-like-the-idea-of-artificial-intelligence-that-mimics-human-interaction-by-sampling-bits-of-cc5d580465c3?source=tag_archive---------24----------------,cc5d580465c3,2016-09-05T04:45:25.926Z,1,"I like the idea of artificial intelligence that mimics human interaction by sampling bits of popular culture and literature and interspersing them with its vocabulary. It would be, simultaneously, that statement that artificial intelligence could at best achieve a facsimile of human interaction and commentary on how we often turn to memes and pop…"
44,https://medium.com/autonomous-agents/mathematical-foundation-for-noise-bias-and-variance-in-neuralnetworks-4f79ee801850?source=tag_archive---------0----------------,4f79ee801850,2016-09-06T06:29:46.398Z,1,"Mathematical foundation for Noise, Bias and Variance in #NeuralNetworks"
44,https://medium.com/@USCTO/public-input-and-next-steps-on-the-future-of-artificial-intelligence-458b82059fc3?source=tag_archive---------1----------------,458b82059fc3,2016-09-06T22:14:23.511Z,1,"Public Input and Next Steps on the Future of Artificial IntelligenceBy: Ed Felten and Terah LyonsToday, as part of the White House Future of Artificial Intelligence Initiative, OSTP is releasing the public comments submitted on…"
20,https://medium.com/@jomicheII/the-fable-of-the-ants-or-why-the-representative-agent-is-no-such-thing-2cdcf4337690?source=tag_archive---------2----------------,2cdcf4337690,2016-09-06T14:33:51.000Z,3,"The Fable of the Ants, or Why the Representative Agent is No Such Thing"
20,https://humanizing.tech/what-is-a-neural-lace-628eae0f6ec4?source=tag_archive---------3----------------,628eae0f6ec4,2016-09-06T13:01:02.031Z,1,What Is A Neural Lace?Interesting use cases for injecting a mesh machine into your brain
81,https://medium.com/@dtunkelang/the-uncanny-valley-of-chatbots-9f265b42d83b?source=tag_archive---------4----------------,9f265b42d83b,2016-09-06T14:04:51.372Z,”,"The Uncanny Valley of ChatbotsIn 1970, roboticist Masahiro Mori coined the phrase “uncanny valley” (不気味の谷 in the original Japanese) to denote the phenomenon that when a machine seems close-but-not-quite human, it triggers a negative response. We especially see this effect in animated films, such as The…"
6,https://medium.com/@heidi.young/conversations-with-ozlo-happily-engaging-with-a-sidekick-1b66db749e5b?source=tag_archive---------6----------------,1b66db749e5b,2016-09-06T05:04:23.232Z,1,"Conversations with Ozlo: Happily Engaging with a SidekickThink about the number of conversations you have in a day. With more communication mediums available than ever, you most certainly have a lot of them. The variation on these conversations is huge; a quick text message to your…"
