claps,link,post_id,post_time,response,title
24,https://chatbotslife.com/ai-a-roadmap-for-context-65ef01fe4567?source=tag_archive---------4----------------,65ef01fe4567,2016-12-26T14:12:24.151Z,1,"AI, a RoadMap for ContextOver-hype and AI seem to go hand in hand. Full General Artificial Intelligence, where a machine can have an…"
43,https://medium.com/health-ai/artificial-intelligence-in-health-care-weekly-roundup-7-96c048b49890?source=tag_archive---------5----------------,96c048b49890,2016-12-26T10:01:01.692Z,2,"Artificial Intelligence in Health Care: Liver Fibrosis, Prostate Cancer, Safer Driving"
148,https://medium.com/@petervoss/why-arent-more-people-working-on-agi-7c8367bf2615?source=tag_archive---------6----------------,7c8367bf2615,2016-12-26T05:30:26.523Z,3,"Why aren’t more people working on AGI?This question came up again at a recent debate on the merits of advanced AI.Here’s a list of some of the most common reasons, plus an analysis of why there seems to be so little progress in AGI development:"
2,https://medium.com/@anujsharma_1/hi-i-have-retrained-inceptions-final-layer-using-flower-dataset-with-fine-tuning-turned-on-aa438ede5904?source=tag_archive---------9----------------,aa438ede5904,2016-12-26T09:51:18.798Z,1,"Hi I have retrained inceptions final layer using flower dataset with fine tuning turned on.I have managed to generate .pb ,.pbtxt , chkpoint files successfully after getting an accuracy of 93% .But I am stuck at making this model usable for predictions."
242,https://towardsdatascience.com/deep-learning-basic-mathematics-for-deep-learning-a82981e95e3b?source=tag_archive---------0----------------,a82981e95e3b,2016-12-27T11:22:16.044Z,3,Deep Learning: Basic Mathematics for Deep Learning
135,https://chatbotslife.com/what-is-agi-438150f80356?source=tag_archive---------2----------------,438150f80356,2016-12-27T05:46:36.984Z,1,"What is AGI?Let’s start at the beginning. Why do we even need this term?60 years ago when the term ‘AI’ was coined, the ambition was to build machines that can learn and reason like humans. Over several decades of trying and failing (badly), the original vision was largely abandoned…"
76,https://chatbotslife.com/check-out-this-new-video-a-friendly-introduction-to-neural-networks-and-deep-learning-50a1375585fd?source=tag_archive---------3----------------,50a1375585fd,2016-12-27T20:20:29.619Z,2,A friendly introduction to Neural Networks and Deep Learning
9,https://chatbotslife.com/quantum-deep-learner-95499aa5335c?source=tag_archive---------7----------------,95499aa5335c,2016-12-27T23:42:25.622Z,1,"Quantum Deep LearnerI am huge fan of mix-n-matches and especially using things in places you least expect it to be used, the Indian in me calls this jugaad. Needless to say, this naturally extends to mashing one of my passions, deep learning and one of my long time curiosities, Quantum Mechanics."
1,https://medium.den.ai/lets-face-it-90b5c1ba4398?source=tag_archive---------16----------------,90b5c1ba4398,2016-12-27T01:12:35.099Z,1,Let’s face it. Most newsletters suck. They try to sell something without adding any value so I unsubscribe from them as soon as I discover that they are useless. But today I’ve…
240,https://medium.com/intuitionmachine/is-conditional-logic-the-new-deep-learning-hotness-96832774907b?source=tag_archive---------0----------------,96832774907b,2016-12-28T08:28:59.177Z,1,Is Conditional Logic the New Deep Learning Hotness?
100,https://medium.com/@lailadahi/my-self-driving-car-nano-degree-project-1-finding-lane-lines-2cd44a45a7?source=tag_archive---------1----------------,2cd44a45a7,2016-12-28T23:32:09.053Z,2,Project(1): Finding Lane Lines.Hopefully a series of posts addressing my progress in the self-driving…
15,https://blog.chappiebot.com/chappiebot-db6c6fa0254c?source=tag_archive---------3----------------,db6c6fa0254c,2016-12-28T10:34:31.834Z,1,"ChappiebotGửi đến bạn lời xin chào!Hơn 3 tháng trước, hành trình đến với AI của tớ bắt đầu với bài viết Lính mới & Deep Learning. Trải qua từ sự ngô nghê, mơ hồ và dần định hình mô hình, kiến trúc cho các ứng dụng cụ thể, tớ bắt đầu tiến đến bước xây dựng đội ngũ để cùng nhau thực hiện mục…"
375,https://medium.com/intuitionmachine/the-holographic-principle-and-deep-learning-52c2d6da8d9?source=tag_archive---------0----------------,52c2d6da8d9,2016-12-29T12:16:39.229Z,4,The Holographic Principle: Why Deep Learning Works
171,https://medium.com/on-coding/what-is-machine-learning-and-why-is-it-important-4255000e19bc?source=tag_archive---------1----------------,4255000e19bc,2016-12-29T11:43:39.203Z,2,"What Is Machine Learning And Why Is It Important?A beginner’s guide to artificial neural networksAt the end of 2016, it’s hard to escape the cultural influence of artificial intelligence. The biggest company in the world is publicly staking its future on it; Seoul…"
104,https://medium.com/@IdTypeThat/watson-knowledge-studio-tips-tricks-60466df0a204?source=tag_archive---------3----------------,60466df0a204,2016-12-29T23:28:28.085Z,2,Watson Knowledge Studio — Tips & TricksMany developers ask me about any additional advice or insights per the construction and…
50,https://medium.com/@mukulmalik/how-machine-learning-is-being-abused-91e17bf52363?source=tag_archive---------4----------------,91e17bf52363,2016-12-29T10:25:58.814Z,2,"How Machine Learning is Being Abused“If world is already talking about it, then it’s already obsolete.” -Donald KnuthLet’s start with the most offensive ones"
5,https://medium.com/@acarabott/caffe-opencl-macos-sierra-amd-2e979518503?source=tag_archive---------5----------------,2e979518503,2016-12-29T00:12:54.750Z,1,"Caffe openCL macOS Sierra AMDNo Nvidia/CUDA in the new macs, trying my luck with the openCL branch of CaffeDependenciesInstall http://brew.sh/ if you don’t have it"
1,https://medium.com/austin-data-science/data-science-community-update-2eeada4cb35b?source=tag_archive---------13----------------,2eeada4cb35b,2016-12-29T20:22:04.762Z,4,"Data Science Community UpdateDEC 2016It’s *almost* time to pop bubbly, light the fireworks and gear up for a brand new year. Before we get too excited about 2017, a proper salute to 2016 is in order. Below are a few highlights in data developments from 2016."
560,https://blog.coast.ai/continuous-video-classification-with-tensorflow-inception-and-recurrent-nets-250ba9ff6b85?source=tag_archive---------0----------------,250ba9ff6b85,2016-12-30T18:30:19.634Z,14,"Continuous video classification with TensorFlow, Inception and Recurrent NetsPart 2 of a series exploring continuous classification methods."
154,https://paulovasconcellos.com.br/o-que-e-machine-learning-e-como-aprender-sem-gastar-nada-2e612f13102b?source=tag_archive---------1----------------,2e612f13102b,2016-12-30T12:03:19.891Z,3,O que é Machine Learning e como aprender sem gastar nada
333,https://medium.com/@jason_trost/collection-of-deep-learning-cyber-security-research-papers-e1f856f71042?source=tag_archive---------2----------------,e1f856f71042,2016-12-30T12:35:23.756Z,3,Collection of Deep Learning Cyber Security Research Papers
13,https://medium.com/@satnalikamayank12/predicting-number-of-cars-passing-a-toll-booth-by-applying-arima-model-cc8229ca629?source=tag_archive---------4----------------,cc8229ca629,2016-12-30T19:23:09.164Z,2,Predicting number of cars passing a toll booth by applying ARIMA model
27,https://medium.com/@tak_lo/2016-year-in-review-an-inside-look-at-9-things-weve-learned-about-building-artificial-2c0e9b5f4471?source=tag_archive---------5----------------,2c0e9b5f4471,2016-12-30T09:34:38.852Z,4,"Zeroth.AI 2016 Year In Review: An Inside Look At 9 Things We’ve Learned About Building Artificial Intelligence StartupsStanding at the end of 2016, and after eight weeks of our current Zeroth.AI cohort have passed, we’re now ready to take on…"
160,https://research.jukedeck.com/audio-synthesis-at-jukedeck-788239d65494?source=tag_archive---------0----------------,788239d65494,2016-12-01T13:01:59.198Z,7,"Audio synthesis at JukedeckIf you’ve ever used Jukedeck, you’ll know our AI generates original musical audio from scratch. But what happens between you requesting a piece of music and us delivering you audio?"
488,https://medium.com/charged-tech/i-got-a-google-home-and-finally-understand-the-future-of-computing-e7de00487d7d?source=tag_archive---------1----------------,e7de00487d7d,2016-12-01T17:41:19.926Z,12,Google Home changed the way I think about voice assistants
132,https://hackernoon.com/generating-music-using-markov-chains-40c3f3f46405?source=tag_archive---------2----------------,40c3f3f46405,2016-12-01T23:44:45.182Z,8,"Generating Music Using Markov ChainsSo this weekend, I revisited a project that I had sitting on the back burner. For this techsploration, I tried to procedurally generate music using a rudimentary implementation of a Markov chain. This project was actually inspired by the music of the Korean pianist…"
317,https://hackernoon.com/react-vs-machine-learning-the-plight-of-non-tech-companies-2c030fb1ae23?source=tag_archive---------3----------------,2c030fb1ae23,2016-12-01T04:49:03.212Z,8,React vs Machine Learning — the plight of non-tech companies
53,https://medium.com/insurge-intelligence/uk-military-will-use-artificially-intelligent-lasers-to-expand-britains-economic-empire-82fbfc66a243?source=tag_archive---------4----------------,82fbfc66a243,2016-12-01T13:58:56.084Z,5,UK military will use artificially intelligent lasers to expand Britain’s economic empireSay what?by Nafeez Ahmed
133,https://medium.com/@sderymail/challenges-of-knowledge-graph-part-1-d9ffe9e35214?source=tag_archive---------5----------------,d9ffe9e35214,2016-12-01T17:46:56.681Z,3,Challenges of Knowledge GraphsFrom Strings to Things — An Introduction
4,https://blog.semantics3.com/our-product-categorization-just-took-a-quantum-leap-with-ai-and-machine-learning-7dd08bf951ef?source=tag_archive---------8----------------,7dd08bf951ef,2016-12-01T16:08:43.179Z,1,Our product categorization just took a quantum leap with AI and Machine LearningCrossing the Human…
49,https://medium.com/emergent-future/the-convergence-of-physical-virtual-worlds-mixed-reality-ai-biosyncing-3670e595bbde?source=tag_archive---------11----------------,3670e595bbde,2016-12-01T02:51:57.919Z,1,"The Convergence of Physical & Virtual Worlds: Mixed Reality, AI, & BiosyncingThe Convergence refers to utilizing three suites of technologies — mixed reality, artificial intelligence, and biosyncing —…"
35,https://medium.com/lux-capital/investing-in-intelligence-announcing-zavain-dars-promotion-to-principal-580f6fdbeadd?source=tag_archive---------12----------------,580f6fdbeadd,2016-12-01T15:43:11.611Z,2,"Investing in Intelligence: Announcing Zavain Dar’s Promotion to PrincipalWe’re proud to share the promotion of our colleague Zavain Dar to Principal at Lux Capital. Since 2014, Zavain has been actively investing in and partnering with Lux entrepreneurs, while based in our…"
26,https://humanizing.tech/biorobots-who-build-themselves-99259e3fa931?source=tag_archive---------13----------------,99259e3fa931,2016-12-01T19:48:43.545Z,2,BioRobots Who Build ThemselvesHow colonizing other worlds and rebuilding our own require an entirely different set of technologies.
11,https://humanizing.tech/when-humans-touch-their-music-beabb735c320?source=tag_archive---------17----------------,beabb735c320,2016-12-01T00:26:41.572Z,1,When Humans Touch Their MusicSheet music is becoming obsolete in a world where you physically touch your favorite song.
6,https://hackernoon.com/here-come-the-machines-d6d27d9be438?source=tag_archive---------24----------------,d6d27d9be438,2016-12-01T00:55:16.798Z,1,"Here Come the MachinesHere come the machines,Look at their sheen.Will they need our data?Will they take our data?Will they take it by force?"
8,https://revelry.south.io/colloquy-with-machines-part-1-of-6-c178e1179589?source=tag_archive---------30----------------,c178e1179589,2016-12-01T15:14:33.367Z,1,Colloquy With Machines — Part 1 of 6What Conversational UX Means For Our Future
12,https://medium.com/@eva.dimitrova/chatbots-qt3-new-books-by-dead-authors-7c1f1141156?source=tag_archive---------38----------------,7c1f1141156,2016-12-01T10:19:00.128Z,1,"Artificial Intelligence reviving dead authorsI was in a bar with a friend last night, talking about Michael Crichton and his…"
2,https://medium.com/@Pandata_News/using-ai-to-boost-e-commerce-sales-86f82df517d5?source=tag_archive---------39----------------,86f82df517d5,2016-12-01T10:50:36.220Z,1,"Using AI to Boost E-Commerce SalesFor e-commerce and traditional brick-and-mortar retailers, it’s a tough market out there. For physical location retailers, part of the reason is the rise of online shopping, to which they are rushing to join the fray. For e-commerce retailers, part of the reason is low…"
2.3K,https://medium.com/mmc-writes/the-fourth-industrial-revolution-a-primer-on-artificial-intelligence-ai-ff5e7fffcae1?source=tag_archive---------0----------------,ff5e7fffcae1,2016-12-02T08:15:34.413Z,31,The fourth industrial revolution: a primer on Artificial Intelligence (AI)“The last 10 years have…
542,https://medium.com/mindorks/intelligence-in-mobile-applications-ca3be3c0e773?source=tag_archive---------1----------------,ca3be3c0e773,2016-12-02T08:05:12.544Z,2,"Intelligence in Mobile Applications.Machine learning is a cool topic nowadays, people are excited about Google Assistant, Apple…"
147,https://medium.com/iotforall/forget-personal-assistants-the-real-battle-is-for-voice-uis-e86697fc82d1?source=tag_archive---------2----------------,e86697fc82d1,2016-12-02T18:26:16.016Z,12,"Forget personal assistants, The real battle is for voice UIs"
56,https://rgabydesign.com/a-i-for-designers-e82f1f62d2e?source=tag_archive---------3----------------,e82f1f62d2e,2016-12-02T15:27:35.521Z,1,A.I. for DesignersHackday with Somatic and R/GA
40,https://medium.com/cognitivebusiness/cognitive-tourism-how-a-popular-tourist-destination-personalizes-your-visit-4ca5c3efc0ce?source=tag_archive---------5----------------,4ca5c3efc0ce,2016-12-02T22:23:55.003Z,2,Cognitive Tourism: Lanzarote creates personalized experience for visitorsA “Virtual tour guide”…
42,https://chatbotsmagazine.com/developing-a-chatbot-train-it-like-a-human-61c9f0e4fb23?source=tag_archive---------6----------------,61c9f0e4fb23,2016-12-02T18:35:17.120Z,1,Developing a Chatbot? Train it like a human!Disclaimer: There is a lot of writing aheadWe are gradually incorporating chatbots in our daily lives. Whether it’s a start-up RightClick.io that is claiming to make websites out of it or a normal insomno chatter bot that is…
31,https://medium.com/@davidfumo/what-machine-learning-can-do-for-you-350a3cf66db2?source=tag_archive---------12----------------,350a3cf66db2,2016-12-02T11:19:31.859Z,1,What Machine Learning can do for you?I believe many of the products you use on your daily basis under the hoods use machine…
3,https://blog.keyreply.com/what-to-think-about-before-building-your-enterprise-chatbot-7b245065d056?source=tag_archive---------13----------------,7b245065d056,2016-12-02T20:14:06.001Z,2,What to think about before building your enterprise chatbot5 greatest considerations behind implementing and putting your enterprise chatbot to work
2,https://medium.com/@woodyennui/options-500c3a235667?source=tag_archive---------34----------------,500c3a235667,2016-12-02T14:00:50.304Z,1,"OptionsPlaying our Adventure Time version of the board/card game Munchkin, it occurred to me that what humans lack more than any other internal resource is the ability to conjure and evaluate at will their myriad options."
2.6K,https://medium.com/@TalPerry/deep-learning-the-stock-market-df853d139e02?source=tag_archive---------0----------------,df853d139e02,2016-12-03T19:30:38.041Z,62,Deep Learning the Stock MarketUpdate 25.1.17 — Took me a while but here is an ipython notebook with a rough implementation
29,https://hackernoon.com/i-trained-a-robot-to-write-in-singlish-this-is-what-it-wrote-caeb5dde671d?source=tag_archive---------1----------------,caeb5dde671d,2016-12-03T00:53:04.944Z,1,"I trained a robot to write in Singlish, this is what it wrote."
1K,https://medium.com/@erikhallstrm/backpropagation-from-the-beginning-77356edf427d?source=tag_archive---------0----------------,77356edf427d,2016-12-04T12:56:08.142Z,9,"Backpropagation from the beginningI have tried to understand backpropagation by reading some explanations, but I’ve always felt that the derivations lack some details. In this article I will try to explain it from the beginning hopefully not leaving anything out (theory wise at least). Let’s get…"
93,https://medium.com/intuitionmachine/the-different-ways-that-internet-giants-approach-deep-learning-research-753c9f99d9f1?source=tag_archive---------1----------------,753c9f99d9f1,2016-12-04T14:33:16.572Z,5,Deep Learning Race: A Survey of Industry Players’ Strategies
70,https://medium.com/transmission-newsletter/open-source-tesla-autopilot-song-genre-prediction-apples-confirmed-car-efforts-classical-music-e321f3cd3d36?source=tag_archive---------2----------------,e321f3cd3d36,2016-12-04T23:44:16.204Z,7,"Open Source Tesla Autopilot, Song Genre Prediction, Apple’s Confirmed Car Efforts, Classical Music Datasets & MoreTransmission #5"
60,https://medium.com/swlh/hi-i-am-a-bot-and-i-will-take-away-your-job-in-the-travel-industry-485fb6b492d5?source=tag_archive---------3----------------,485fb6b492d5,2016-12-04T03:56:42.454Z,2,"Hi, I Am a Bot, and I will Take Away Your Job in the Travel IndustryThree Ways the Travel Industry will be Affected by Artificial Intelligence (AI) in the Next Few Years"
4,https://medium.com/@oaneto/a-new-type-of-customer-service-company-e56fb83fa7b9?source=tag_archive---------10----------------,e56fb83fa7b9,2016-12-04T23:49:58.109Z,1,Part 3 — A new type of customer service company
2,https://medium.com/@grahambm/of-course-i-agree-however-the-emphasis-amongst-the-commercial-learning-and-unimaginative-edtech-728fef7ab18c?source=tag_archive---------16----------------,728fef7ab18c,2016-12-04T12:18:31.345Z,1,"Of course, I agree however the emphasis amongst the commercial learning and unimaginative EdTech corporations (they know who they are) is focused on centralised AI designed on the back of legacy business models and thinking.There is nothing disruptive nor transformative about these iterative baby steps that merely seek to…"
7,https://medium.com/@Amplify/what-if-an-ai-chooses-to-do-something-that-is-wildly-destructive-to-society-9111483b87fd?source=tag_archive---------19----------------,9111483b87fd,2016-12-04T22:29:47.854Z,1,What if an AI chooses to do something that is wildly destructive to society? Then you don’t empower it. Think about an AI that does something mildly destructive to society. It goes around doing graffiti. It spray paints offensive things. Are you going to voluntarily give your money to this AI? Probably not. This means that the AI won’t be able to…
1,https://medium.com/@woodyennui/holy-cow-df-great-comment-669df5580aca?source=tag_archive---------31----------------,669df5580aca,2016-12-04T22:12:24.675Z,1,"Holy cow, DF, great comment! I know very little about the science behind attention (if I knew more maybe I could make something of myself;) But I am always astounded at the many options I pick up in the game, but never give a single thought to. Perhaps what I am actually expressing is a kind of sorrow, at the inevitable passage of time, and how not…"
293,https://hackernoon.com/traffic-signs-classification-with-deep-learning-b0cb03e23efb?source=tag_archive---------0----------------,b0cb03e23efb,2016-12-05T19:13:13.130Z,10,Traffic signs classification with Deep Learning.You can find my code here. It might be more up to date than the article ;).IntroThis is the second article in the self driving cars series. If you want to know why I’m sharing this and more…
20,https://virtualrealitypop.com/2017-virtual-reality-a-semi-comprehensive-forecast-3811ad01ae8c?source=tag_archive---------1----------------,3811ad01ae8c,2016-12-05T21:32:23.863Z,2,2017 Virtual Reality: A Semi-Comprehensive Forecast2016 In VR Recap
15,https://medium.com/@samsachedina/effective-data-science-latent-dirichlet-allocation-a109742f7d1c?source=tag_archive---------2----------------,a109742f7d1c,2016-12-05T01:52:39.436Z,1,Optimal Data Science: Latent Dirichlet Allocation
258,https://medium.com/@ivanliljeqvist/using-ai-to-generate-lyrics-5aba7950903?source=tag_archive---------3----------------,5aba7950903,2016-12-05T15:40:46.017Z,3,Using AI to generate lyricsCan we make AI write music and lyrics for us? Can we train machines to express feelings and thoughts in…
106,https://medium.com/the-spike/watching-a-paradigm-shift-unfold-how-the-brain-makes-decisions-5bea912b58a7?source=tag_archive---------4----------------,5bea912b58a7,2016-12-05T11:27:46.722Z,4,Watching a paradigm shift unfold: how the brain makes decisionsThree brutal rounds of scientific boxing
47,https://medium.com/the-mission/westworld-5294d9f45a34?source=tag_archive---------5----------------,5294d9f45a34,2016-12-05T18:55:15.862Z,2,A Spoiler-Free Look at What WestWorld Says About OurWorld
387,https://medium.com/axiomzenteam/honest-guide-to-machine-learning-part-three-54a1c71a9d64?source=tag_archive---------6----------------,54a1c71a9d64,2016-12-05T18:46:15.747Z,1,Honest Guide to Machine Learning: Part ThreeNatural Language Processing
6,https://blog.hutoma.ai/hu-toma-bot-building-101-just-add-txt-bd03d757d2f9?source=tag_archive---------8----------------,bd03d757d2f9,2016-12-05T15:11:25.144Z,1,"hu:toma Bot Building 101 ( Just add .txt )Building a “chatbot” is currently the on-trend thing to do, but why? Corporate innovation teams, SME’s and freelancers alike see the opportunity in adding conversational functionality to their web & mobile applications."
11,https://machinelearnings.co/machine-learnings-20-ai-bots-need-to-be-funny-or-people-get-pissed-7c935428fa3a?source=tag_archive---------11----------------,7c935428fa3a,2016-12-05T22:16:38.533Z,1,AI bots need to be funny or people get pissed — #20
9,https://tincture.io/amazon-in-digital-health-what-the-future-might-look-like-46f36b3cc04b?source=tag_archive---------14----------------,46f36b3cc04b,2016-12-05T18:51:11.994Z,1,Amazon in Digital Health? What the Future Might Look LikePart Three: “Echolocation” — The Race to the…
2,https://medium.com/@paparodi/a-search-engine-for-things-86219a31882a?source=tag_archive---------23----------------,86219a31882a,2016-12-05T17:32:46.836Z,1,"A Search Engine for ThingsIn an article published last week in IEEE Intelligent Systems, authors Payam Barnaghi and Amit Sheth explain that the growth of the Internet of Things creates the need for search solutions with new requirements, beyond traditional web pages and text or semantic search. Given…"
4,https://medium.com/science-political/how-do-you-tell-a-kid-hes-going-to-become-an-android-b928c6a96720?source=tag_archive---------29----------------,b928c6a96720,2016-12-05T17:01:02.880Z,2,How do you tell a kid he’s going to become an android?
2,https://medium.com/@VibhorMathur/messengers-next-move-in-bots-b47a05c3c9a2?source=tag_archive---------33----------------,b47a05c3c9a2,2016-12-05T19:25:16.225Z,1,Messenger’s Next Move (in bots)Facebook has been slowly releasing new features to support their theory that the future of business is…
1.2K,https://hackernoon.com/deep-learning-cheat-sheet-25421411e460?source=tag_archive---------0----------------,25421411e460,2016-12-06T00:36:49.568Z,6,Deep Learning Cheat SheetDeep Learning can be overwhelming when new to the subject. Here are some cheats and tips to get you through it.
408,https://slackhq.com/wired-founder-kevin-kelly-on-letting-go-of-ai-anxiety-bcd94e50dedc?source=tag_archive---------1----------------,bcd94e50dedc,2016-12-06T18:00:31.498Z,11,Wired founder Kevin Kelly on letting go of AI anxietyHow machines and humans together will transform…
114,https://medium.com/intuitionmachine/10-deep-learning-trends-and-predictions-for-2017-f28ca0666669?source=tag_archive---------2----------------,f28ca0666669,2016-12-06T18:26:51.069Z,1,10 Deep Learning Trends and Predictions for 2017
134,https://medium.com/world-economic-forum/by-2030-this-is-what-computers-will-be-able-to-do-cb139c863463?source=tag_archive---------3----------------,cb139c863463,2016-12-06T08:33:02.912Z,3,"By 2030, this is what computers will be able to do"
223,https://medium.com/intuitionmachine/predictive-learning-is-the-key-to-deep-learning-acceleration-93e063195fd0?source=tag_archive---------4----------------,93e063195fd0,2016-12-06T12:47:15.610Z,4,“Predictive Learning” is the New Buzzword in Deep Learning
49,https://medium.com/the-downlinq/super-resolution-on-satellite-imagery-using-deep-learning-part-2-c9ce41dc0ee0?source=tag_archive---------6----------------,c9ce41dc0ee0,2016-12-06T13:54:58.226Z,1,"Super-Resolution on Satellite Imagery using Deep Learning, Part 2"
30,https://thereisonlyr.com/the-golden-ratio-of-westworld-e13b645ebc5b?source=tag_archive---------7----------------,e13b645ebc5b,2016-12-06T20:49:07.985Z,2,"The Golden Ratio Of WestworldEpisode 10: Dualities, trinities, and the meaning of life."
