claps,link,post_id,post_time,response,title
113,https://medium.com/@aneesha/visualising-top-features-in-linear-svm-with-scikit-learn-and-matplotlib-3454ab18a14d?source=tag_archive---------0----------------,3454ab18a14d,2016-02-01T06:19:35.356Z,5,"Visualising Top Features in Linear SVM with Scikit Learn and MatplotlibA classifier need not be a black-box! I know we are often dealing with very high dimensional data but particularly with a linear Support Vector Machine, it is possible to take a peek at the top features…"
28,https://medium.com/@leapingllamas/the-role-of-model-interpretability-in-data-science-703918f64330?source=tag_archive---------2----------------,703918f64330,2016-02-01T14:13:07.088Z,2,"The role of model interpretability in data scienceIn data science, models can involve abstract features in high dimensional spaces, or they can be more concrete, in lower dimensions, and more readily understood by humans; that is, they are interpretable. What’s the role of interpretable…"
6,https://blog.ment.at/streaming-random-forest-90d39277d71f?source=tag_archive---------4----------------,90d39277d71f,2016-02-01T13:07:22.612Z,1,"Streaming Random ForestAs promised in our previous blog post (Flavours of Streaming Processing), in this post we report the performance of our weapon of choice when it comes to classification on data streams: the Streaming Random Forest (SRF).​Random Forests were introduced by Leo Breiman et al in 2001…"
2,https://blog.datascientistworkbench.com/making-hadoop-easy-for-data-scientists-5addcedf00f?source=tag_archive---------5----------------,5addcedf00f,2016-02-01T17:56:06.646Z,2,Making Hadoop Easy for Data ScientistsIt’s no secret that Data Scientists love Notebooks. There is a lot one can do with Jupyter notebooks in Data Scientist Workbench - from exploring data to data wrangling to building analytic models to creating beautiful data-driven plots and sharing them with…
1,https://medium.com/@juliantagell/my-naive-view-of-data-science-d18dc145ad21?source=tag_archive---------8----------------,d18dc145ad21,2016-02-02T22:19:26.452Z,1,"My naive view of data scienceSo, there you have it."
25,https://thinkgrowth.org/60-of-everything-we-know-is-wrong-e5a100ad7895?source=tag_archive---------1----------------,e5a100ad7895,2016-02-03T18:38:19.983Z,4,60% of Everything We Know Is Wrong**Maybe
1,https://genomix.me/molecular-predictors-of-alzheimer-s-disease-a-collaboration-with-sage-bionetworks-my-insight-1c130524d39?source=tag_archive---------2----------------,1c130524d39,2016-02-03T00:54:24.091Z,2,Molecular Predictors of Alzheimer’s DiseaseMy Insight Health Data Science Consulting Project — A collaboration with Sage BionetworksThe Problem
5,https://code.likeagirl.io/how-to-re-light-the-mathematical-flame-in-you-49f2350a8201?source=tag_archive---------3----------------,49f2350a8201,2016-02-03T14:56:06.703Z,1,How to (re)light the mathematical flame in you.Originally posted on linkedin.com
43,https://medium.com/omada-health/little-weight-lies-8439afc6d469?source=tag_archive---------0----------------,8439afc6d469,2016-02-05T23:55:50.793Z,5,"Little Weight Liesby: Eric Williams, Director of Data Science @ Omada Health"
11,https://ai-alignment.com/semi-supervised-learning-from-side-information-483d5db474a2?source=tag_archive---------1----------------,483d5db474a2,2016-02-05T00:53:15.850Z,1,Semi-supervised learning from side informationA simple algorithm for leveraging side information while learning from sparse feedback.
12,https://medium.com/@aneesha/timeseries-forecasting-with-the-forecast-r-package-and-shiny-6fa04c64196?source=tag_archive---------0----------------,6fa04c64196,2016-02-06T12:37:30.017Z,1,"Timeseries Forecasting with the forecast R package and ShinyI’m more of a Python person — I love Python’s syntax, the tons of Machine Learning libraries in Python and Django (for web dev). …but I swap to R when necessity calls, and necessity usually takes the form of a useful library…"
20,https://medium.com/@iliasfl/data-science-tricks-correcting-that-0-99-correlation-c892ae211476?source=tag_archive---------0----------------,c892ae211476,2016-02-07T08:42:25.850Z,1,Data Science tricks: Excited to find a 0.99 correlation? Check for uptrends first!
7,https://medium.com/@senseiabi/this-post-was-originally-published-on-www-marbble-com-b7bf3ec37450?source=tag_archive---------2----------------,b7bf3ec37450,2016-02-07T16:48:10.655Z,1,This post was originally published on www.marbble.comData Analytics — Devil is in the details (Part 1)
66,https://gab41.lab41.org/the-nine-must-have-datasets-for-investigating-recommender-systems-ce9421bf981c?source=tag_archive---------0----------------,ce9421bf981c,2016-02-08T17:42:00.000Z,1,"The Nine Must-Have Datasets for Investigating Recommender SystemsLab41 is currently in the midst of Project Hermes, an exploration of different recommender systems in order to build up some intuition (and of course, hard data) about how these algorithms can be used to solve data…"
280,https://medium.com/@j/how-we-used-design-research-to-launch-the-new-york-times-en-espa%C3%B1ol-ae23c5c3001a?source=tag_archive---------0----------------,ae23c5c3001a,2016-02-09T02:04:31.045Z,9,How we used design research to launch The New York Times en Español
14,https://medium.com/i-data/let-s-not-be-hypocrites-85382ce86267?source=tag_archive---------0----------------,85382ce86267,2016-02-10T20:31:10.227Z,My,"Let’s not be HypocritesMy response to the Uber “Dead Miles” ArgumentJay Cassano reached out to me as he was writing his piece on Uber’s “dead miles” (linked below), questioning Uber’s current practice saving driver location data for potential product…"
28,https://medium.com/runkeeper-everyone-every-run/this-the-music-you-should-run-to-because-science-8f17829f99f?source=tag_archive---------0----------------,8f17829f99f,2016-02-11T16:05:38.516Z,1,"This the music you should run to, because science"
74,https://medium.com/tradeshift-engineering/scaling-up-machine-learning-algorithm-for-form-recognition-bd09b319e14a?source=tag_archive---------1----------------,bd09b319e14a,2016-02-11T08:46:00.809Z,1,"Scaling up machine learning algorithm for form recognitionOne of the most important things we do at Tradeshift is help connect new companies to the Tradeshift network. We have many ways to make that easier, including multiple integrations to other systems. However, there are a lot of…"
642,https://medium.com/@EvanSinar/7-data-visualization-types-you-should-be-using-more-and-how-to-start-4015b5d4adf2?source=tag_archive---------0----------------,4015b5d4adf2,2016-02-14T21:42:33.045Z,8,7 Data Visualization Types You Should be Using More (and How to Start)
40,https://austinstartups.com/gravitational-wave-ushers-in-a-new-wave-of-data-science-928d620d727?source=tag_archive---------1----------------,928d620d727,2016-02-15T06:48:36.423Z,2,"Gravitational Wave Ushers in a New Wave of Data ScienceAuthor’s note: I have a PhD in Astrophysics from the University of Texas at Austin. For 10 years, I studied the physics around super massive black…"
17,https://towardsdatascience.com/machine-learning-i-a-general-perspective-dee207dba335?source=tag_archive---------3----------------,dee207dba335,2016-02-15T15:43:03.587Z,1,"Machine Learning I: A General PerspectiveMore than a year, I’ve been studying on machine learning and I decided to put my…"
4,https://medium.com/@_dkatz/i-need-some-help-with-the-statistical-analysis-of-ad-performance-7a14b6169447?source=tag_archive---------4----------------,7a14b6169447,2016-02-15T15:05:23.166Z,2,"I need some help with the Statistical Analysis of Ad PerformanceI’m looking for someone who is familiar with statistical analysis, and in particular with thinking about sample sizes. We run a lot of ads, look at how well they perform and make decisions around which ads are working…"
942,https://m.signalvnoise.com/data-scientists-mostly-just-do-arithmetic-and-that-s-a-good-thing-c6371885f7f6?source=tag_archive---------0----------------,c6371885f7f6,2016-02-16T17:21:10.982Z,30,"Data scientists mostly just do arithmetic and that’s a good thingHi, I’m Noah. I work at Basecamp. Sometimes I’m called a “data scientist.” Mostly, I just do arithmetic, and I’m ok with that."
273,https://medium.com/mit-media-lab/highly-effective-data-science-teams-e90bb13bb709?source=tag_archive---------1----------------,e90bb13bb709,2016-02-16T17:12:24.876Z,5,Highly Effective Data Science Teams14 questions that separate teams that struggle from teams that…
90,https://medium.com/omada-health/what-digital-health-learned-from-netflix-how-data-science-is-creating-self-learning-healthcare-2f0aa160c124?source=tag_archive---------2----------------,2f0aa160c124,2016-02-16T17:57:57.196Z,3,What Digital Health Learned From Netflix: How Data Science Is Creating Self-Learning Healthcare
71,https://medium.freecodecamp.org/best-gitter-channels-for-data-science-machine-learning-6e8eeb5063c0?source=tag_archive---------3----------------,6e8eeb5063c0,2016-02-16T14:23:31.876Z,1,Best Gitter Channels for: Data Science & Machine Learning
101,https://medium.com/@AlfredBaudisch/o-que-%C3%A9-ci%C3%AAncia-de-dados-data-science-7af5bdac101a?source=tag_archive---------4----------------,7af5bdac101a,2016-02-16T00:05:39.566Z,2,Ciência de Dados é explorar Big Data para fazer perguntas para prever o futuro“A primeira regra da…
157,https://machinelearnings.co/facial-emotion-recognition-single-rule-1-0-deeplearning-c90c3c2be788?source=tag_archive---------0----------------,c90c3c2be788,2016-02-17T07:33:52.985Z,5,Facial Emotion Recognition: Single-Rule 1–0 DeepLearningIn my attempt to build Artificial Emotional…
66,https://tech.instacart.com/data-science-at-instacart-dabbd2d3f279?source=tag_archive---------1----------------,dabbd2d3f279,2016-02-17T17:19:09.000Z,1,"Data Science at InstacartAt Instacart, we are revolutionizing the way people buy groceries. We give busy professionals, parents and…"
178,https://medium.com/airbnb-engineering/beginning-with-ourselves-48c5ed46a703?source=tag_archive---------0----------------,48c5ed46a703,2016-02-18T16:44:19.293Z,6,Beginning with OurselvesUsing Data Science to Improve Diversity at Airbnbby Riley Newman and Elena Grewal
15,https://medium.com/day-i-learned/how-to-detect-locks-on-redshift-f144d23d4e09?source=tag_archive---------2----------------,f144d23d4e09,2016-02-18T20:30:34.710Z,4,"How to detect locks on RedshiftWhen you take a look to Redshift documentation they recommend you using STV_LOCKS, which results on:It seems really useful until you have real database lock. The last month I was trying to solve a lock that was blocking lots of processes. Finally…"
352,https://medium.com/@awjuliani/simple-softmax-in-python-tutorial-d6b4c4ed5c16?source=tag_archive---------0----------------,d6b4c4ed5c16,2016-02-22T21:43:40.125Z,3,"Simple Softmax Regression in Python — TutorialSoftmax regression is a method in machine learning which allows for the classification of an input into discrete classes. Unlike the commonly used logistic regression, which can only perform binary classifications, softmax allows for classification…"
33,https://medium.com/@itsaguytalking/the-role-of-statistical-significance-in-growth-hacking-c80648fde2eb?source=tag_archive---------1----------------,c80648fde2eb,2016-02-22T14:58:49.127Z,2,The Role of Statistical Significance in Growth ExperimentsThe concepts of experimental design and hypothesis testing originate from the work of Ronald Fisher in the early 20th century. These concepts originated as tools for rigorously testing the validity of a hypothesis. For instance…
18,https://medium.com/data-engineering/the-reactive-machine-learning-book-is-live-2eb5ff3d36ff?source=tag_archive---------4----------------,2eb5ff3d36ff,2016-02-22T03:46:48.299Z,1,"The Reactive Machine Learning book is live!At long last, I’m thrilled to announce that Reactive Machine Learning Systems is now…"
13,https://medium.com/the-data-logs/a-month-of-data-58f636fa5c97?source=tag_archive---------9----------------,58f636fa5c97,2016-02-22T17:31:06.132Z,1,A Month of DataEvaluating my journey thus farHello everyone. It’s still a little hard to believe that I started this journey about a month ago. I wanted to update you all as to what I’ve accomplished and where I’m going next.
1.5K,https://medium.com/airbnb-engineering/data-infrastructure-at-airbnb-8adfb34f169c?source=tag_archive---------0----------------,8adfb34f169c,2016-02-23T14:06:01.154Z,13,"Data Infrastructure at AirbnbBy James Mayfield, Krishna Puttaswamy, Swaroop Jagadish, and Kevin Long"
281,https://medium.com/hci-design-at-uw/introducing-vega-lite-438f9215f09e?source=tag_archive---------1----------------,438f9215f09e,2016-02-23T17:48:56.743Z,2,"Introducing Vega-LiteToday we are excited to announce the official 1.0 release of Vega-Lite, a high-level format for rapidly creating…"
167,https://render.betaworks.com/the-network-is-everything-89ed6b8b3290?source=tag_archive---------2----------------,89ed6b8b3290,2016-02-23T22:21:24.537Z,6,The Network is Everything —analyzing the Anchor launch using social data.
1,https://medium.com/@CodingNeo/data-driven-education-b63a61ed8491?source=tag_archive---------5----------------,b63a61ed8491,2016-02-23T16:03:56.152Z,2,"Data-Driven EducationIf you are already a parent, the education of your children will definitely your biggest thing you want to consider in…"
255,https://m.signalvnoise.com/practical-skills-that-practical-data-scientists-need-da71e6b93f95?source=tag_archive---------0----------------,da71e6b93f95,2016-02-24T13:56:39.319Z,12,"Practical skills that practical data scientists needWhen I wrote about how I mostly just use arithmetic, a lot of people asked me about what skills or tools a data scientist needs if not fancy algorithms. What is this mythical “basic math” that I mentioned? Here’s my take on what skills…"
34,https://medium.com/@jeremyclover/the-umbrella-approach-to-analytics-b986052798cc?source=tag_archive---------1----------------,b986052798cc,2016-02-24T20:02:56.646Z,1,The Umbrella Approach to AnalyticsProviding coverage and proving value as a small analytics team.
1.97K,https://medium.com/airbnb-engineering/scaling-knowledge-at-airbnb-875d73eff091?source=tag_archive---------0----------------,875d73eff091,2016-02-25T14:06:01.627Z,29,Scaling Knowledge at Airbnbby Chetan Sharma and Jan OvergoorProblem
132,https://machinelearnings.co/statistical-nlp-on-openstreetmap-b9d573e6cc86?source=tag_archive---------1----------------,b9d573e6cc86,2016-02-25T12:40:03.672Z,3,"Statistical NLP on OpenStreetMapToward a machine-interpretable understanding of placeStreet addresses are among the more quirky artifacts of human language, yet they are crucial to the increasing number of applications involving maps and…"
91,https://medium.com/@pete/the-first-three-rules-of-data-analysis-52b1dc9ad321?source=tag_archive---------3----------------,52b1dc9ad321,2016-02-25T23:10:56.073Z,2,"The first three rules of data analysisDon’t underestimate their significance1. Correlation ≠ CausationAn oldie and a goodie. Oft-cited, almost as frequently misunderstood. Compare:“We changed to 1-week…"
64,https://medium.com/@5agado/conversation-analyzer-baa80c566d7b?source=tag_archive---------4----------------,baa80c566d7b,2016-02-25T19:04:45.588Z,1,"Conversation Analyzer - An IntroductionI “needed” to have a backup of my chat conversations, didn’t trust Facebook —of course. After the disappointment in the available solutions and tools for such a task, I just decided to rely on the old and gold DIY technique.Once I got a simple working…"
12,https://medium.com/@charlesrt/setting-an-open-standard-for-job-postings-9e548f8fc9bd?source=tag_archive---------5----------------,9e548f8fc9bd,2016-02-25T12:57:08.449Z,2,Setting an open standard for job postingsJob-seekers and employers need a better experience
28,https://medium.com/omada-health/minds-over-matter-b3cc661248aa?source=tag_archive---------2----------------,b3cc661248aa,2016-02-26T18:57:21.979Z,1,"Minds Over Matterby: Ryan Quan, Data Scientist @ Omada Health"
88,https://medium.com/@aneesha/recursive-feature-elimination-with-scikit-learn-3a2cbdf23fb7?source=tag_archive---------0----------------,3a2cbdf23fb7,2016-02-27T10:26:57.365Z,2,Recursive Feature Elimination with Scikit LearnDatasets used to train classification and regression algorithms are high dimensional in nature — this means that they contain many features or attributes. In textual datasets each feature is a word and as you can imagine the vocabulary used in the…
4,https://medium.com/@YvesMulkers/the-most-important-skill-in-data-science-mining-and-visualizing-your-data-10fabf41d32e?source=tag_archive---------1----------------,10fabf41d32e,2016-02-27T11:26:53.093Z,1,The Most Important Skill in Data Science: Mining and Visualizing your Data
113,https://medium.com/@aneesha/visualising-top-features-in-linear-svm-with-scikit-learn-and-matplotlib-3454ab18a14d?source=tag_archive---------0----------------,3454ab18a14d,2016-02-01T06:19:35.356Z,5,"Visualising Top Features in Linear SVM with Scikit Learn and MatplotlibA classifier need not be a black-box! I know we are often dealing with very high dimensional data but particularly with a linear Support Vector Machine, it is possible to take a peek at the top features…"
28,https://medium.com/@leapingllamas/the-role-of-model-interpretability-in-data-science-703918f64330?source=tag_archive---------1----------------,703918f64330,2016-02-01T14:13:07.088Z,2,"The role of model interpretability in data scienceIn data science, models can involve abstract features in high dimensional spaces, or they can be more concrete, in lower dimensions, and more readily understood by humans; that is, they are interpretable. What’s the role of interpretable…"
6,https://blog.ment.at/streaming-random-forest-90d39277d71f?source=tag_archive---------3----------------,90d39277d71f,2016-02-01T13:07:22.612Z,1,"Streaming Random ForestAs promised in our previous blog post (Flavours of Streaming Processing), in this post we report the performance of our weapon of choice when it comes to classification on data streams: the Streaming Random Forest (SRF).​Random Forests were introduced by Leo Breiman et al in 2001…"
5,https://medium.com/@vanderglaz/an-outstanding-feature-of-classical-music-is-the-joy-of-feeling-it-de5bfae67d8d?source=tag_archive---------11----------------,de5bfae67d8d,2016-02-01T04:44:54.640Z,1,"An outstanding feature of classical music is the joy of feeling it. Usually it happens all at once: a new version of you suddenly starts to distinguish one composer from the other just by the sound. I am actually using any opportunity to convert people to my classical music religion, so this blog is my recruiting station also."
2,https://ai-alignment.com/turning-reflection-up-to-11-1bd6171afd21?source=tag_archive---------1----------------,1bd6171afd21,2016-02-02T05:55:10.164Z,1,Turning reflection up to 11Statistically extrapolating volition.Suppose that Hugh wants to build a super-Hugh-level question-answerer.Hugh could train a system to imitate Hugh’s answers. But that approach will at best be…
56,https://medium.com/@Accel/congratulations-to-the-swiftkey-team-on-its-acquisition-by-microsoft-836ff6258f5e?source=tag_archive---------1----------------,836ff6258f5e,2016-02-03T08:07:04.007Z,1,"Congratulations to the SwiftKey Team on its Acquisition by Microsoft!Congratulations to co-founders Ben Medlock, Jon Reynolds and the entire SwiftKey team – makers of the world’s smartest mobile keyboard application – on their acquisition by Microsoft."
6,https://medium.com/@OwenChen/neuroscience-and-machine-learning-perspectives-of-jazz-improvisation-75fc46ed8111?source=tag_archive---------5----------------,75fc46ed8111,2016-02-03T23:17:40.341Z,3,Neuroscience and Machine Learning perspectives of Jazz ImprovisationRamblings from an aspiring jazz-fusion musician andsoftware engineer with a strong interest in the cognitive sciences.
26,https://medium.com/@richwong/congratulations-to-the-swiftkey-team-on-its-acquisition-by-microsoft-abd77b686013?source=tag_archive---------6----------------,abd77b686013,2016-02-03T08:04:42.811Z,1,"Congratulations to the SwiftKey Team on its Acquisition by Microsoft!Congratulations to co-founders Ben Medlock, Jon Reynolds and the entire SwiftKey team — makers of the world’s smartest mobile keyboard application — on their acquisition by Microsoft, announced today!"
11,https://ai-alignment.com/semi-supervised-learning-from-side-information-483d5db474a2?source=tag_archive---------0----------------,483d5db474a2,2016-02-05T00:53:15.850Z,1,Semi-supervised learning from side informationA simple algorithm for leveraging side information while learning from sparse feedback.
364,https://blog.coast.ai/using-reinforcement-learning-in-python-to-teach-a-virtual-car-to-avoid-obstacles-6e782cc7d4c6?source=tag_archive---------0----------------,6e782cc7d4c6,2016-02-06T22:07:23.738Z,17,"Using reinforcement learning in Python to teach a virtual car to avoid obstaclesAn experiment in Q-learning, neural networks and Pygame."
27,https://medium.com/@srkiranraj/human-learning-machine-learning-6a930bfd5d32?source=tag_archive---------1----------------,6a930bfd5d32,2016-02-06T10:18:34.387Z,4,Human Learning == Machine LearningA rant on how humans are learning the way computers are intended to.
24,https://medium.com/@un1crom/how-i-reverse-engineered-facebook-s-feed-algorithms-to-make-a-fortune-selling-art-and-realized-c4c4755e174?source=tag_archive---------0----------------,c4c4755e174,2016-02-07T19:53:38.574Z,1,How I Reverse-Engineered Facebook’s Feed Algorithms to Make A Fortune Selling Art and Realized Facebook is Actually a Person Now“Pictures are worth a 1000 words or in the case of Facebook worth billions of dollars and total understanding of…
113,https://medium.com/planet-stories/cloudless-an-open-source-computer-vision-tool-for-satellite-imagery-6f4daaa4851f?source=tag_archive---------0----------------,6f4daaa4851f,2016-02-08T22:42:28.188Z,2,"Cloudless: An Open Source Computer Vision Tool for Satellite ImageryI’m proud to announce the 1.0 release of Cloudless, an open source computer vision…"
11,https://medium.com/the-data-of-things/machine-learning-and-cognitive-systems-part-2-big-data-analytics-d3ce7023325b?source=tag_archive---------1----------------,d3ce7023325b,2016-02-08T07:54:00.000Z,1,"Machine Learning and Cognitive Systems, Part 2: Big Data Analytics"
29,https://ayearofai.com/rohan-2-time-progress-ae804fa86cca?source=tag_archive---------0----------------,ae804fa86cca,2016-02-09T07:04:33.676Z,3,"Rohan #2: Artificial intelligence, ∂Progress/∂TimeA technical and philosophical analysis on the past…"
18,https://medium.com/@CognitiveScale/five-reasons-jarvis-is-not-a-job-killer-5aaa9922da2d?source=tag_archive---------2----------------,5aaa9922da2d,2016-02-09T18:40:15.444Z,1,"Five Reasons JARVIS Is Not a Job KillerManoj Saxena, Executive Chairman, @manojsaxena"
74,https://medium.com/tradeshift-engineering/scaling-up-machine-learning-algorithm-for-form-recognition-bd09b319e14a?source=tag_archive---------0----------------,bd09b319e14a,2016-02-11T08:46:00.809Z,1,"Scaling up machine learning algorithm for form recognitionOne of the most important things we do at Tradeshift is help connect new companies to the Tradeshift network. We have many ways to make that easier, including multiple integrations to other systems. However, there are a lot of…"
169,https://medium.com/netflix-techblog/distributed-time-travel-for-feature-generation-389cccdd3907?source=tag_archive---------0----------------,389cccdd3907,2016-02-12T08:00:00.000Z,1,Distributed Time Travel for Feature Generationusing historical data to test new features
4,https://advice.goboon.co/how-machine-learning-is-revolutionizing-recruiting-8e1879f0ce98?source=tag_archive---------5----------------,8e1879f0ce98,2016-02-12T02:56:47.618Z,1,How Machine Learning is Revolutionizing Recruiting
130,https://medium.com/zetta-venture-partners/vertical-beats-horizontal-in-supervised-machine-learning-e9d17ff2d443?source=tag_archive---------0----------------,e9d17ff2d443,2016-02-13T00:50:57.993Z,3,Vertical Beats Horizontal in Machine LearningBuilding businesses on Machine Learning technologySignup for our newsletter hereThe best products in the world are made by vertically integrated businesses: Apple’s…
10,https://medium.com/@nicolapizzolato/would-you-bet-against-sex-robots-ai-could-leave-half-of-world-unemployed-8f8eef719aef?source=tag_archive---------1----------------,8f8eef719aef,2016-02-13T15:00:07.000Z,1,"Would you bet against sex robots? AI ‘could leave half of world unemployed’Artificial intelligence could put more than half the planet’s population out of a job, a computer scientist says. Photograph: Science Picture Co./Corbis"
11,https://medium.com/@xen/me-on-machine-learning-day-one-9ffb054ffbbe?source=tag_archive---------2----------------,9ffb054ffbbe,2016-02-14T00:29:26.459Z,1,"Me on machine learning. Day oneThis year I decided to start machine learning, with support of my wife we plan to make me the new generation student that will do study on Coursera, Khan Academy and other similar sites."
5,https://medium.com/@libbykinsey/the-ai-fallacy-and-special-pleading-bdfba9173bd4?source=tag_archive---------5----------------,bdfba9173bd4,2016-02-15T07:08:38.009Z,1,"The ‘AI fallacy’ and ‘special pleading’My brother-in-law gave me this book for Christmas, written by father and son duo Richard and Daniel Susskind:"
