claps,link,post_id,post_time,response,title
17,https://towardsdatascience.com/machine-learning-i-a-general-perspective-dee207dba335?source=tag_archive---------6----------------,dee207dba335,2016-02-15T15:43:03.587Z,1,"Machine Learning I: A General PerspectiveMore than a year, I’ve been studying on machine learning and I decided to put my…"
412,https://ayearofai.com/rohan-3-deriving-the-normal-equation-using-matrix-calculus-1a1b16f65dda?source=tag_archive---------0----------------,1a1b16f65dda,2016-02-16T16:19:56.904Z,8,Rohan #3: Deriving the Normal Equation using matrix calculusUnderstanding the analytical solution to…
71,https://medium.freecodecamp.org/best-gitter-channels-for-data-science-machine-learning-6e8eeb5063c0?source=tag_archive---------2----------------,6e8eeb5063c0,2016-02-16T14:23:31.876Z,1,Best Gitter Channels for: Data Science & Machine Learning
22,https://medium.com/@radiowolfgang/the-machines-are-rising-whether-you-like-it-or-not-1725180bbc5d?source=tag_archive---------3----------------,1725180bbc5d,2016-02-16T11:49:12.541Z,2,The Machines are Rising — Whether you like it or notBy Michael Brooks
58,https://medium.com/@xdotai/how-to-teach-a-machine-to-understand-us-d4b376f78609?source=tag_archive---------6----------------,d4b376f78609,2016-02-16T15:56:56.902Z,2,"How to Teach a Machine to Understand UsBy Dennis R. MortensenWe are fast moving from the app era to the era of the intelligent agent. Over the next half decade, we’ll witness the birth of hundreds if not thousands of autonomous intelligent agents. By definition, these…"
157,https://machinelearnings.co/facial-emotion-recognition-single-rule-1-0-deeplearning-c90c3c2be788?source=tag_archive---------0----------------,c90c3c2be788,2016-02-17T07:33:52.985Z,5,Facial Emotion Recognition: Single-Rule 1–0 DeepLearningIn my attempt to build Artificial Emotional…
29,https://medium.com/zappos-engineering/the-clustering-process-47d70f75f4eb?source=tag_archive---------1----------------,47d70f75f4eb,2016-02-17T01:18:09.423Z,1,"The Clustering ProcessIn my experience as a Data Scientist in an e-commerce company, when asked a question, clustering is very often the answer. The problem with clustering being the answer is that it raises a 100 other questions."
6,https://medium.com/@alexolivier/defining-luxury-with-instagram-google-vision-api-part-1-data-collection-96ff9dd69ce9?source=tag_archive---------0----------------,96ff9dd69ce9,2016-02-21T12:37:51.357Z,4,"Defining ‘Luxury’ with Instagram & Google Vision API — Part 1: Data CollectionIt maybe the suppressed psychologist in me trying to get out (which sounds like a great case study for any shrink…), but I’ve always found the “showing off”-ness of Instagram intriguing."
352,https://medium.com/@awjuliani/simple-softmax-in-python-tutorial-d6b4c4ed5c16?source=tag_archive---------0----------------,d6b4c4ed5c16,2016-02-22T21:43:40.125Z,3,"Simple Softmax Regression in Python — TutorialSoftmax regression is a method in machine learning which allows for the classification of an input into discrete classes. Unlike the commonly used logistic regression, which can only perform binary classifications, softmax allows for classification…"
7,https://medium.com/@Practical/differential-privacy-considered-harmful-f420ce717846?source=tag_archive---------1----------------,f420ce717846,2016-02-22T11:21:12.825Z,3,Differential Privacy considered not practicalA criticism of Differential Privacy and the “Privacy — First” approach.Differential Privacy is an elegant & beautiful mathematical theory. Much like the Statistical Learning Theory (by Vapnik & Chervonenkis) and Probably…
18,https://medium.com/data-engineering/the-reactive-machine-learning-book-is-live-2eb5ff3d36ff?source=tag_archive---------5----------------,2eb5ff3d36ff,2016-02-22T03:46:48.299Z,1,"The Reactive Machine Learning book is live!At long last, I’m thrilled to announce that Reactive Machine Learning Systems is now…"
229,https://medium.com/snips-ai/ntm-lasagne-a-library-for-neural-turing-machines-in-lasagne-2cdce6837315?source=tag_archive---------0----------------,2cdce6837315,2016-02-24T18:00:55.520Z,6,"NTM-Lasagne: A Library for Neural Turing Machines in LasagneThe first part of this post is about the theory behind Neural Turing Machines. The second is about the library itself, and benchmarks on tasks from Google DeepMind’s original paper."
356,https://medium.com/spark-capital/the-future-of-work-will-be-distributed-664d970c49c1?source=tag_archive---------1----------------,664d970c49c1,2016-02-24T16:48:04.799Z,18,"The Future of Work Will Be Distributedby John Melas-KyriaziI’m sitting in our San Francisco office. With a few taps on my smartphone, I’m on Facetime with colleagues in Lagos, Nigeria, getting a live update on a new hire for one of our portfolio companies. This is as close…"
132,https://machinelearnings.co/statistical-nlp-on-openstreetmap-b9d573e6cc86?source=tag_archive---------0----------------,b9d573e6cc86,2016-02-25T12:40:03.672Z,3,"Statistical NLP on OpenStreetMapToward a machine-interpretable understanding of placeStreet addresses are among the more quirky artifacts of human language, yet they are crucial to the increasing number of applications involving maps and…"
61,https://blog.coast.ai/reinforcement-learning-in-python-to-teach-a-virtual-car-to-avoid-obstacles-part-2-93e614fcd238?source=tag_archive---------1----------------,93e614fcd238,2016-02-25T06:18:23.591Z,1,"Reinforcement learning in Python to teach a virtual car to avoid obstacles — part 2Looking at loss, parameter tuning, and next stepsSomething that bothered me after publishing part 1 of my exploration of…"
7,https://medium.com/@Pinterest_Engineering/automating-human-evaluation-at-pinterest-cad2f41cbe39?source=tag_archive---------2----------------,cad2f41cbe39,2016-02-25T08:00:00.000Z,1,"Automating human evaluation at PinterestMaesen Churchill | Pinterest engineer, DiscoveryComputers are so smart these days. Machine learning accomplishes some pretty amazing feats at Pinterest, from making sophisticated recommendations to building higher-quality home…"
7,https://medium.com/mobgen/image-recognition-what-is-it-and-why-it-can-be-beneficial-for-your-company-53cabf4fa624?source=tag_archive---------5----------------,53cabf4fa624,2016-02-25T13:53:40.164Z,1,"Image recognition: what is it, and why it can be beneficial for your company"
63,https://medium.com/@xdotai/a-year-in-the-life-of-amy-ingram-ai-personal-assistant-140d0f2dc78d?source=tag_archive---------0----------------,140d0f2dc78d,2016-02-26T16:31:49.075Z,2,"A Year in The Life of Amy Ingram, AI Personal Assistant"
6,https://medium.com/@amyburvall/learning-as-remix-students-as-skateboarders-2f3d8fed4aab?source=tag_archive---------2----------------,2f3d8fed4aab,2016-02-26T21:13:52.608Z,1,"Learning as Remix, Students as SkateboardersSteve Wheeler (@timbuckteeth) has started a blog series called #LearningIs(referenced in my last post) and in doing so has challenged all of us to think about how we define learning.Learning Like a Machine"
88,https://medium.com/@aneesha/recursive-feature-elimination-with-scikit-learn-3a2cbdf23fb7?source=tag_archive---------0----------------,3a2cbdf23fb7,2016-02-27T10:26:57.365Z,2,Recursive Feature Elimination with Scikit LearnDatasets used to train classification and regression algorithms are high dimensional in nature — this means that they contain many features or attributes. In textual datasets each feature is a word and as you can imagine the vocabulary used in the…
259,https://medium.com/tradecraft-traction/why-we-can-t-rely-on-technology-for-a-better-future-1aee9fd8e946?source=tag_archive---------0----------------,1aee9fd8e946,2016-02-01T21:17:58.890Z,10,Why we can’t rely on technology for a better futureA tech revolution is coming. Our future depends on…
93,https://hackernoon.com/how-to-design-for-your-algorithmic-self-757c7df601e2?source=tag_archive---------1----------------,757c7df601e2,2016-02-01T17:13:42.661Z,5,"How to Design for Your Algorithmic SelfOnce a year, I check in with some of my friends on Facebook. Really? Once a year? You are…"
3,https://medium.com/bad-tech/why-every-women-should-delete-their-tinder-pictures-now-52ac1054fa1b?source=tag_archive---------3----------------,52ac1054fa1b,2016-02-01T22:02:35.340Z,1,"What Tinder isn’t Telling You: Why Every Woman Should Delete their Tinder Pictures NowThis post is meant to scare you. So I’m going to pause right now so you can head on over to Tinder, OKCupid, Bumble, Hinge, Happn, Match, and all the other ones (paid and free…"
13,https://medium.com/@CodinGame/introducing-scarak-a-i-coding-master-i-loved-the-idea-of-making-a-bot-do-simple-tasks-c529a09a9d43?source=tag_archive---------10----------------,c529a09a9d43,2016-02-01T18:47:16.627Z,1,"Introducing Scarak, A.I. Coding Master: “I loved the idea of making a bot do simple tasks”"
2,https://medium.com/@grahama_is/i-wonder-are-we-rushing-headlong-to-a-scenario-where-the-50-person-tribe-example-doesn-t-apply-838dfa70daa9?source=tag_archive---------20----------------,838dfa70daa9,2016-02-01T02:33:08.106Z,1,"I wonder — are we rushing headlong to a scenario where the 50 person Tribe example doesn’t apply? The end of skill specialization.Scenario — let’s travel to 30,000 BCE and gift a tribe with a Star Trek replicator. Specialization roles no longer apply. No need to hunt, gather, make clothes, and etc. No need to learn basic…"
23,https://medium.com/how-did-this-happen/call-for-submissions-how-did-this-happen-a5cb5e2ef4f3?source=tag_archive---------0----------------,a5cb5e2ef4f3,2016-02-02T17:42:49.382Z,6,Call For Submissions: How Did This Happen?Round One: Humanity is destroyed by a super artificial intelligence. How did this happen???
2,https://ai-alignment.com/turning-reflection-up-to-11-1bd6171afd21?source=tag_archive---------1----------------,1bd6171afd21,2016-02-02T05:55:10.164Z,1,Turning reflection up to 11Statistically extrapolating volition.Suppose that Hugh wants to build a super-Hugh-level question-answerer.Hugh could train a system to imitate Hugh’s answers. But that approach will at best be…
56,https://medium.com/@Accel/congratulations-to-the-swiftkey-team-on-its-acquisition-by-microsoft-836ff6258f5e?source=tag_archive---------0----------------,836ff6258f5e,2016-02-03T08:07:04.007Z,1,"Congratulations to the SwiftKey Team on its Acquisition by Microsoft!Congratulations to co-founders Ben Medlock, Jon Reynolds and the entire SwiftKey team – makers of the world’s smartest mobile keyboard application – on their acquisition by Microsoft."
26,https://medium.com/@richwong/congratulations-to-the-swiftkey-team-on-its-acquisition-by-microsoft-abd77b686013?source=tag_archive---------1----------------,abd77b686013,2016-02-03T08:04:42.811Z,1,"Congratulations to the SwiftKey Team on its Acquisition by Microsoft!Congratulations to co-founders Ben Medlock, Jon Reynolds and the entire SwiftKey team — makers of the world’s smartest mobile keyboard application — on their acquisition by Microsoft, announced today!"
20,https://medium.com/@seibelj/the-grid-over-promise-under-deliver-and-the-lies-told-by-ai-startups-40aa98415d8e?source=tag_archive---------0----------------,40aa98415d8e,2016-02-04T18:32:40.162Z,4,"“The Grid” — Over Promise, Under Deliver, and the Lies Told by AI StartupsArtificial Intelligence companies are promising the Moon, but at one company the reality is firmly on Earth"
4,https://medium.com/@maximum/why-do-we-have-to-die-a13774761132?source=tag_archive---------2----------------,a13774761132,2016-02-05T15:27:26.624Z,1,Why do we have to die?& why death makes no sense… anymore
8,https://cvil.ly/re-work-virtual-assistant-summit-jan-28-29-2016-ff8ac64089c7?source=tag_archive---------4----------------,ff8ac64089c7,2016-02-05T23:19:44.632Z,1,"RE-Work Virtual Assistant Summit — Jan 28 & 29, 2016Last week I had the pleasure of attending the Re-Work Deep Learning Summit. The summit was split into two tracks — Deep Learning and Virtual Assistants. I spent my time in the Virtual Assistants track while my colleagues attended Deep…"
364,https://blog.coast.ai/using-reinforcement-learning-in-python-to-teach-a-virtual-car-to-avoid-obstacles-6e782cc7d4c6?source=tag_archive---------0----------------,6e782cc7d4c6,2016-02-06T22:07:23.738Z,17,"Using reinforcement learning in Python to teach a virtual car to avoid obstaclesAn experiment in Q-learning, neural networks and Pygame."
27,https://medium.com/@srkiranraj/human-learning-machine-learning-6a930bfd5d32?source=tag_archive---------1----------------,6a930bfd5d32,2016-02-06T10:18:34.387Z,4,Human Learning == Machine LearningA rant on how humans are learning the way computers are intended to.
6,https://medium.com/@seysconstantijn/waking-up-in-2020-with-your-quantified-self-5bace28ba853?source=tag_archive---------2----------------,5bace28ba853,2016-02-06T22:01:09.399Z,2,"Waking up in 2020 with your quantified selfBEEP BEEP It’s 5 AM Monday morning. “If you wake up now, you will be happier today.” said a friendly but strict voice.I get out of bed. “I ordered a standing desk from Amazon to see if this will make you more productive.” That…"
3,https://medium.com/@cabada/texting-my-home-ed32ccbbb6f8?source=tag_archive---------5----------------,ed32ccbbb6f8,2016-02-06T17:55:09.635Z,1,"Texting my HomeI’m into the home automation industry and I’m building “cool” stuff day by day for my home hoping to free it to everyone one day.Right now I’m finishing a home personal assistant. It’s a data-hungry personal assistant that interacts with all your actuators and sensors, not…"
24,https://medium.com/@un1crom/how-i-reverse-engineered-facebook-s-feed-algorithms-to-make-a-fortune-selling-art-and-realized-c4c4755e174?source=tag_archive---------0----------------,c4c4755e174,2016-02-07T19:53:38.574Z,1,How I Reverse-Engineered Facebook’s Feed Algorithms to Make A Fortune Selling Art and Realized Facebook is Actually a Person Now“Pictures are worth a 1000 words or in the case of Facebook worth billions of dollars and total understanding of…
16,https://medium.com/how-did-this-happen/we-re-facing-the-end-of-civilization-because-we-depend-on-intelligent-infrastructure-that-s-just-59423dd9a6b2?source=tag_archive---------2----------------,59423dd9a6b2,2016-02-07T19:50:50.847Z,1,"The best laid schemes of mice and menOften go awry.– Robert Burns, To a MouseWe’re facing the end of civilization because we depend on intelligent infrastructure that’s just too helpful.Phase 1: Sanctioned Monopoly"
17,https://blog.magicx.co/introducing-magicx-aka-why-not-magictiger-7ca1b897b31e?source=tag_archive---------1----------------,7ca1b897b31e,2016-02-08T10:46:17.631Z,1,"Introducing MagicX (aka why not MagicTiger)“If I had asked people what they wanted, they would have said faster horses.”"
15,https://medium.com/how-did-this-happen/how-did-this-happen-b29fd74243d0?source=tag_archive---------2----------------,b29fd74243d0,2016-02-08T15:01:00.863Z,2,"How Did This Happen???A brief report.First, what happened?Well, yes, to be clear: humanity is very likely at its end. In the year 2085, the population of traditional, independently controlled, humans on Earth and assorted ships…"
10,https://medium.com/the-virtual-mentor/ai-for-mentorship-a6d0965c4599?source=tag_archive---------6----------------,a6d0965c4599,2016-02-08T17:09:05.015Z,3,"AI For Mentorship?Imagine that you have a virtual mentor in your pocket.As we said, in 2016 innovation is going local, and emerging markets are the place to grow the most promising startups."
1,https://medium.com/@ALEX_McLEOD_/start-up-singularity-4460e9f47f21?source=tag_archive---------16----------------,4460e9f47f21,2016-02-08T18:53:51.041Z,1,"Start-up SingularityIt’s been eight years since the lean start-up methodology meaningfully reshuffled how we start and operate businesses. It’s also been eight years of tremendous successes and failures. Although remarkable at the time, lean presents itself with inherent problems. For one, although it mitigates…"
1,https://medium.com/@nornagon/the-true-self-preface-8d43686e7cfe?source=tag_archive---------18----------------,8d43686e7cfe,2016-02-08T17:20:02.049Z,1,"The true self: prefaceMoravec’s Paradox says that, in AI, the easy things are hard and the hard things are relatively easy. That is, it’s pretty straightforward to make a computer program that is better than the best human at things we think of as “higher reasoning”, such as playing chess or proving theorems…"
29,https://ayearofai.com/rohan-2-time-progress-ae804fa86cca?source=tag_archive---------0----------------,ae804fa86cca,2016-02-09T07:04:33.676Z,3,"Rohan #2: Artificial intelligence, ∂Progress/∂TimeA technical and philosophical analysis on the past…"
18,https://medium.com/@CognitiveScale/five-reasons-jarvis-is-not-a-job-killer-5aaa9922da2d?source=tag_archive---------3----------------,5aaa9922da2d,2016-02-09T18:40:15.444Z,1,"Five Reasons JARVIS Is Not a Job KillerManoj Saxena, Executive Chairman, @manojsaxena"
39,https://medium.com/@neal_lathia/archetypes-of-online-conversations-ba10e1c1e7c3?source=tag_archive---------6----------------,ba10e1c1e7c3,2016-02-09T21:01:05.301Z,1,"Archetypes of online conversationsSmart messaging is only one paradigmI’ve been reading a lot about the imminent age of smart messaging and virtual assistants. Some great reads, offering a variety of perspectives (from business through to design and…"
4,https://becominghuman.ai/technology-device-i-m-loving-sigmo-8e26d4531b6b?source=tag_archive---------8----------------,8e26d4531b6b,2016-02-09T19:29:08.421Z,2,"Technology Device I'm loving — SigmoYou got bored on a certain weekend and decided to have a weekend getaway with friends at Benin Republic — A country you’ve never been to. Very early on a Saturday morning, you all took a taxi to the bus park to board a bus to your new destination."
2,https://medium.com/the-nine-connections-view/what-the-new-twitter-timeline-will-mean-for-publishers-and-brands-d4ba7ed66cfa?source=tag_archive---------3----------------,d4ba7ed66cfa,2016-02-10T22:13:15.939Z,2,"What the new Twitter timeline will mean for publishers and brandsGonnie, Product Strategist at Nine Connections"
226,https://medium.com/@dtunkelang/a-conversation-between-two-ais-c929d4f5f1d0?source=tag_archive---------0----------------,c929d4f5f1d0,2016-02-12T23:56:00.890Z,8,"A Conversation Between Two AIsThe other day, I was introduced to Jason at Clara Labs, a startup whose product is an AI personal assistant to schedule meetings. As it so happens, I use x.ai, a startup whose product is also an AI personal assistant to schedule meetings."
73,https://chatbotsmagazine.com/bots-the-future-of-human-computer-interaction-56696f7aff56?source=tag_archive---------1----------------,56696f7aff56,2016-02-12T19:38:16.784Z,2,Bots: The future of human-computer interaction.At least until we are borg.I wrote recently about the evolution from Web > Apps > Bots. Today I’m taking a little more time to unpack two key aspects in the rise of today’s bots and why they represent a…
130,https://medium.com/zetta-venture-partners/vertical-beats-horizontal-in-supervised-machine-learning-e9d17ff2d443?source=tag_archive---------0----------------,e9d17ff2d443,2016-02-13T00:50:57.993Z,3,Vertical Beats Horizontal in Machine LearningBuilding businesses on Machine Learning technologySignup for our newsletter hereThe best products in the world are made by vertically integrated businesses: Apple’s…
17,https://medium.com/@karlaherne/in-less-than-2-minutes-you-ll-understand-why-google-has-condemned-humanity-to-extinction-20c51328ffa7?source=tag_archive---------2----------------,20c51328ffa7,2016-02-13T10:51:51.476Z,3,In less than 2 minutes you’ll understand why Google has condemned humanity to extinctionIt won’t be aliens or a natural disaster that brings the end of the world.It will be Google.
14,https://thecoffeelicious.com/a-i-d2064ae0508a?source=tag_archive---------3----------------,d2064ae0508a,2016-02-13T19:14:20.256Z,1,"A.I.The phrase Artificial Intelligence unerringly brings to mind images of robots, modified brains and eventually the end of the world. Doomsday scenarios and A.I. are usually tied together in the same way:The A.I. starts adapting and takes the shape of a fully functional intelligence, often…"
10,https://medium.com/@nicolapizzolato/would-you-bet-against-sex-robots-ai-could-leave-half-of-world-unemployed-8f8eef719aef?source=tag_archive---------6----------------,8f8eef719aef,2016-02-13T15:00:07.000Z,1,"Would you bet against sex robots? AI ‘could leave half of world unemployed’Artificial intelligence could put more than half the planet’s population out of a job, a computer scientist says. Photograph: Science Picture Co./Corbis"
5,https://medium.com/@wanderingskull/dr-sarif-or-how-i-learned-to-stop-worrying-and-love-the-human-revolution-c8d9658cfeac?source=tag_archive---------0----------------,c8d9658cfeac,2016-02-14T04:49:18.479Z,1,"Dr. Sarif, Or How I Learned To Stop Worrying And Love The Human Revolution."
11,https://medium.com/@xen/me-on-machine-learning-day-one-9ffb054ffbbe?source=tag_archive---------2----------------,9ffb054ffbbe,2016-02-14T00:29:26.459Z,1,"Me on machine learning. Day oneThis year I decided to start machine learning, with support of my wife we plan to make me the new generation student that will do study on Coursera, Khan Academy and other similar sites."
9,https://medium.com/business-as-unusual/my-version-of-the-future-of-work-e65af24d30b2?source=tag_archive---------4----------------,e65af24d30b2,2016-02-14T17:26:21.237Z,3,"My Version of the Future of WorkThis is what the future of work looks like to me. This view of the future of work is imagined through the lens of employee productivity and engagement. My focus then is on how future employees will communicate, collaborate, and get things done."
20,https://medium.com/@tgm/some-thoughts-on-artificial-intelligence-a42fb65b9a58?source=tag_archive---------2----------------,a42fb65b9a58,2016-02-15T19:56:25.437Z,3,"Some Thoughts on Artificial IntelligenceThe Current State of Things: A lot has been made of artificial intelligence (AI) recently. After decades of disappointment, increased computing power and masses of usable data are changing things. Google just announced that an AI beat a human grandmaster at…"
5,https://medium.com/@libbykinsey/the-ai-fallacy-and-special-pleading-bdfba9173bd4?source=tag_archive---------6----------------,bdfba9173bd4,2016-02-15T07:08:38.009Z,1,"The ‘AI fallacy’ and ‘special pleading’My brother-in-law gave me this book for Christmas, written by father and son duo Richard and Daniel Susskind:"
17,https://towardsdatascience.com/machine-learning-i-a-general-perspective-dee207dba335?source=tag_archive---------7----------------,dee207dba335,2016-02-15T15:43:03.587Z,1,"Machine Learning I: A General PerspectiveMore than a year, I’ve been studying on machine learning and I decided to put my…"
1,https://medium.com/@satish.charmal/technology-74ff239c7290?source=tag_archive---------14----------------,74ff239c7290,2016-02-15T09:01:23.869Z,1,"TechnologyTechnology (“science of craft”, from Greek τέχνη, techne, “art, skill, cunning of hand”; and -λογία, -logia[3]) is the collection of techniques, skills, methods and processes used in the production of goods or services or in the accomplishment of objectives, such as scientific investigation. Technology can…"
412,https://ayearofai.com/rohan-3-deriving-the-normal-equation-using-matrix-calculus-1a1b16f65dda?source=tag_archive---------0----------------,1a1b16f65dda,2016-02-16T16:19:56.904Z,8,Rohan #3: Deriving the Normal Equation using matrix calculusUnderstanding the analytical solution to…
336,https://medium.com/machine-intelligence-report/robo-bill-cunningham-shazam-for-fashion-with-deep-neural-networks-7126ea39197b?source=tag_archive---------1----------------,7126ea39197b,2016-02-16T13:31:01.435Z,5,Robo Bill Cunningham: Shazam for Fashion With Deep Neural Networks
93,https://medium.com/mission-log/why-we-don-t-take-siri-seriously-98119ba23151?source=tag_archive---------2----------------,98119ba23151,2016-02-16T15:47:10.881Z,5,"Why we don’t take Siri seriouslyThe rise of the robot assistant is happening. Last year, Amazon’s Echo accounted for a quarter of all…"
22,https://medium.com/@radiowolfgang/the-machines-are-rising-whether-you-like-it-or-not-1725180bbc5d?source=tag_archive---------3----------------,1725180bbc5d,2016-02-16T11:49:12.541Z,2,The Machines are Rising — Whether you like it or notBy Michael Brooks
11,https://medium.com/pandorabots-blog/on-chatbots-37888b939ae4?source=tag_archive---------4----------------,37888b939ae4,2016-02-16T00:00:00.000Z,5,"On ChatbotsChatbots, historically maligned as “weak AI,” are finally transforming from ugly duckling to beautiful swan. According to recent predictions, chatbots (#ConvComm) will be big. Like, Google-killing big, heralding the end of apps and search as we know it — or so proclaimed Forbes and The Wall Street Journal."
58,https://medium.com/@xdotai/how-to-teach-a-machine-to-understand-us-d4b376f78609?source=tag_archive---------5----------------,d4b376f78609,2016-02-16T15:56:56.902Z,2,"How to Teach a Machine to Understand UsBy Dennis R. MortensenWe are fast moving from the app era to the era of the intelligent agent. Over the next half decade, we’ll witness the birth of hundreds if not thousands of autonomous intelligent agents. By definition, these…"
