link,post_id,response,title
https://medium.com/intuitionmachine/pytorch-dynamic-computational-graphs-and-modular-deep-learning-7e7f89f18d1?source=tag_archive---------3----------------,7e7f89f18d1,6,"PyTorch, Dynamic Computational Graphs and Modular Deep Learning"
https://medium.com/intuitionmachine/how-to-explain-deep-learning-using-chaos-and-complexity-33de81c321de?source=tag_archive---------4----------------,33de81c321de,7,How to Explain Deep Learning using Chaos and Complexity
https://medium.com/udacity/the-udacity-class-who-will-bring-machines-to-life-ff3d52255554?source=tag_archive---------5----------------,ff3d52255554,1,The Udacity class who will bring machines to lifeEnrollment ends today for our inaugural Deep Learning class
https://medium.com/udacity/deep-learning-and-neural-nets-b5c6fba83a65?source=tag_archive---------7----------------,b5c6fba83a65,4,"Deep Learning and Neural NetsAs I’m typing this, I’m thinking to myself, I hope everyone that reads this knows about the new Nanodegree…"
https://medium.freecodecamp.org/how-a-robot-got-super-mario-64-and-portal-to-run-on-a-super-nintendo-from-1990-34b7ee132f83?source=tag_archive---------9----------------,34b7ee132f83,3,How a robot got Super Mario 64 and Portal to run on a Super Nintendo from 1990
https://blog.markgrowth.com/8-artificial-intelligence-trends-eating-up-the-marketers-toolkit-72532c65099e?source=tag_archive---------10----------------,72532c65099e,6,8 Artificial Intelligence Trends Eating Up The Marketer’s Toolkit
https://medium.com/@vivek.yadav/open-letter-to-all-the-readers-for-making-me-top-writer-of-artificial-intelligence-self-driving-d8efb8cd0bd1?source=tag_archive---------13----------------,d8efb8cd0bd1,8,"Open letter to all the readers for making me top writer of Artificial Intelligence, Self-driving cars and Education on MediumDear Readers"
https://medium.com/@k3no/memory-and-the-machine-ba380dcdb1c1?source=tag_archive---------20----------------,ba380dcdb1c1,1,"Memory and The MachineI would like to talk about memory , the act of encoding,saving and remembering in a mostly nuts and bolts kind of way…"
https://chatbotslife.com/how-neural-networks-work-ff4c7ad371f7?source=tag_archive---------0----------------,ff4c7ad371f7,6,How Neural Networks WorkArtificial neural networks (ANN) have become a hot topic of interest and chat-bots often use them in text…
https://medium.com/@epireve/i-couldt-afford-siraj-raval-s-deep-learning-udacity-course-c41ae2a55554?source=tag_archive---------1----------------,c41ae2a55554,7,"I could’t afford Siraj Raval’s deep learning Udacity course. So, I curated his Youtube content instead.I am sad. Because I can’t afford this £300 course, I mean yeah can’t this week. The course enrolment is ended today (20 Jan 2017), but if Udacity extends…"
https://medium.com/simple-ai/decision-tree-learning-intro-to-machine-learning-2-8592720a739e?source=tag_archive---------2----------------,8592720a739e,2,Decision Tree Learning — Intro To Machine Learning #2
https://medium.com/@heerasaeed/ai-and-cyber-security-will-be-more-important-than-ever-in-2017-62602cbc68f5?source=tag_archive---------3----------------,62602cbc68f5,1,"AI and Cyber-security will be more important than ever in 2017This story originally appeared on VentureBeat on December 27, 2016 and was written by Hira Saeed."
https://medium.com/intuitionmachine/the-fundamental-problem-with-ai-is-rooted-in-the-traditional-corporation-f1bdfb082c54?source=tag_archive---------7----------------,f1bdfb082c54,2,Deep Learning and the Responsive CorporationNot a day goes by that we find news about how automation is destroying jobs and…
https://medium.com/@adorath/smart-mirror-smart-everything-b2e7e30a81a5?source=tag_archive---------18----------------,b2e7e30a81a5,1,Smart mirror __ smart everythingIn my last story I wrote about our concept of a smart mirror and the challenges in creating a smart device with different interaction paradigms compared to the omnipresent tablets and smartphone touchscreens.
https://medium.com/@edsegura1608/la-tecnolog%C3%ADa-en-cuatro-ruedas-15bb09a676e5?source=tag_archive---------20----------------,15bb09a676e5,2,"La tecnología en cuatro ruedasHe estado pensando en qué podría escribir en este blog. No sabía bien cómo empezar o de qué escribir exactamente, porque no soy muy bueno con esto y es la primera vez que me encuentro del otro lado de la pantalla. Finalmente me decidí por un tema que me interesa y del cual…"
https://medium.com/@greenpolitico/thought-provoking-article-fe9b5e554c2?source=tag_archive---------26----------------,fe9b5e554c2,1,"Thought provoking article. Absolutely agree we need to change the system even more so in 2017 as we see the political system in Europe and the USA retreat into protectionist financially driven policy.We must begin to take action in small groups, share our ideas and actions and take the first steps to making a change for the…"
https://hackernoon.com/maths-students-are-trapped-in-searles-chinese-room-d5ab9eafbc51?source=tag_archive---------0----------------,d5ab9eafbc51,14,"Maths students are trapped in Searle’s Chinese roomAs the quest for strong AI unfolds, are we losing our grip on human intelligence?You are in a closed room. A passer by slips a sheet under the door containing a…"
https://medium.com/enrique-dans/artificial-intelligence-is-not-a-threat-to-humanity-7950d2c47293?source=tag_archive---------2----------------,7950d2c47293,1,Artificial intelligence is not a threat to humanity
https://medium.com/@sujaybabruwad/how-to-identify-a-traffic-sign-using-machine-learning-7aa98c871469?source=tag_archive---------3----------------,7aa98c871469,2,How to identify a Traffic Sign using Machine Learning !!
https://medium.com/@stoweboyd/this-week-at-work-2017-01-22-f73d99212e07?source=tag_archive---------6----------------,f73d99212e07,1,"This Week at Work: 2017–01–22AI building AI, trust implosion, novelty and innovation, inequality, friendlies, and more.Rob Walker’s Workologist column included this bit of insight in I’m Here to Work. Not to Be Your…"
https://medium.com/cyberknights/01-introduction-1aa08847bbcb?source=tag_archive---------29----------------,1aa08847bbcb,1,01 Introduction | What Happened to Cybernetics?“It’s like making a map; I know the future horizon and some landmarks — and some milestones in the past — but I’ll be making the map myself”
https://medium.com/@FranklynZhu/isl-statistical-learning-a11eac663d07?source=tag_archive---------38----------------,a11eac663d07,.,"ISL: Statistical LearningBroadly speaking, there are two types of statistical learning tools: supervised and unsupervised.Supervised learning involves output based on inputs. For instance, predicting salary (output/response/DV) based on education and age (input…"
https://hackernoon.com/visualizing-parts-of-convolutional-neural-networks-using-keras-and-cats-5cc01b214e59?source=tag_archive---------0----------------,5cc01b214e59,4,"Visualizing parts of Convolutional Neural Networks using Keras and CatsIt is well known that convolutional neural networks (CNNs or ConvNets) have been the source of many major breakthroughs in the field of Deep learning in the last few years, but they are rather unintuitive to…"
https://hackernoon.com/learning-ai-if-you-suck-at-math-part-two-practical-projects-47d7a1e4e21f?source=tag_archive---------1----------------,47d7a1e4e21f,8,Learning AI if You Suck at Math — Part Two — Practical Projects
https://medium.com/@erikpmvermeulen/there-is-no-escape-from-blockchains-and-artificial-intelligence-lawyers-better-be-prepared-2d7a8221c627?source=tag_archive---------3----------------,2d7a8221c627,1,There is No Escape from Blockchains and Artificial Intelligence… Lawyers Better Be Prepared!
https://hackernoon.com/intelligent-agents-things-87b866f711ef?source=tag_archive---------4----------------,87b866f711ef,3,"Intelligent Agents + ThingsArtificial Intelligence is all the rage amongst founders and investors. And for good reason: regardless of where you think we are in the hype cycle, it’s increasingly clear AI is eventually going to touch everything. The questions now turn to when and how it will impact specific…"
https://medium.com/generative-design/generative-design-introduction-64fb2db38e1?source=tag_archive---------5----------------,64fb2db38e1,1,"The problem of learningThis course will teach the concepts of generative design, specifically geared towards applications in architectural design. The goal of the course is to present both tools and concepts in a way that helps designers build intuition for how these tools work, how they can affect the design…"
https://blog.framer.com/understanding-how-machines-learn-through-prototyping-486fef5de703?source=tag_archive---------6----------------,486fef5de703,2,"Understanding How Machines Learn, Through Prototypingby Big Tomorrow | January 23, 2017 | More ArticlesMachine Learning — This is the second article in a larger series exploring the intersection of design and existing artificial…"
https://machinelearnings.co/why-chatbots-arent-just-a-fad-541316e7d64a?source=tag_archive---------8----------------,541316e7d64a,2,Why Chatbots aren’t just a fadWhat’s interesting to me is that as a ‘millennial’ I hardly text anymore. The $300 dollars worth of text…
https://medium.com/@andresmariscal/unbeatable-tic-tac-toe-an-android-app-using-kotlin-4f4d2576e6fd?source=tag_archive---------13----------------,4f4d2576e6fd,1,Unbeatable Tic Tac Toe — An android app using Kotlin
https://medium.com/@gabrielharrison/an-imaginary-conversation-with-elon-musk-at-a-pub-in-yorkshire-866d22f743ee?source=tag_archive---------14----------------,866d22f743ee,2,"An imaginary conversation with Elon Musk at a pub in Yorkshire.Elon Musk suggests that we should merge with Artificial Intelligence to become ‘AI-human symbiotes’. An interesting concept. I find it’s always good to know what sort of plan these futurists are cooking up. So, what is…"
https://medium.com/@fedor/weekly-briefing-3-2a08b0b74b88?source=tag_archive---------38----------------,2a08b0b74b88,1,Weekly Briefing #3Last week was pretty busy for me with attending OneAirbnb conference and some other fun stuff. But I came around an awesome video on deep learning! I’ve seen many of them but this one is the best yet.
https://medium.com/mit-media-lab/building-character-ai-through-machine-learning-7a3159dc4940?source=tag_archive---------0----------------,7a3159dc4940,1,"Building character AI through machine learningModern character AI could be better.For most of us, NPCs and electronic toy characters cannot sustain an illusion of life past our initial interaction with them. They suffer from predictability, simplicity, and inauthentic…"
https://medium.com/building-storyworlds-the-art-craft-biz-of/digital-storytelling-a-look-at-the-last-12-months-b3f01e7213a0?source=tag_archive---------1----------------,b3f01e7213a0,4,Digital Storytelling — a look at the last 12 months
https://hackernoon.com/life-is-gradient-descent-880c60ac1be8?source=tag_archive---------2----------------,880c60ac1be8,4,Life is gradient descentHow machine learning and optimization theory can change your perspective
https://medium.com/@henrymao/reinforcement-learning-using-asynchronous-advantage-actor-critic-704147f91686?source=tag_archive---------5----------------,704147f91686,1,"Reinforcement Learning using Asynchronous Advantage Actor CriticIn my research, I stumbled upon an effective learning method called Asynchronous Advantage Actor Critic (A3C) published by DeepMind. This algorithm beats the famous DQN by quite a margin and also seems to yield more…"
https://medium.com/@petervoss/the-orthogonality-thesis-is-not-relevant-796447cb3754?source=tag_archive---------14----------------,796447cb3754,2,The Orthogonality Thesis Is Not RelevantThe Orthogonality Thesis (OT) was raised as an objections to my essay ‘Improved Intelligence Yields Improved Morality’. This is a brief reply.The Orthogonality Thesis: “The idea that the final goals and intelligence levels of…
https://medium.com/@cabot_solutions/11-mobile-app-development-trends-that-will-rule-2017-2aa964bda271?source=tag_archive---------16----------------,2aa964bda271,1,11 Mobile App Development Trends that will Rule 2017
https://blog.make.technology/are-we-now-living-in-an-artificial-intelligence-first-world-7bb8019c2e29?source=tag_archive---------18----------------,7bb8019c2e29,1,Are we now living in an AI-first world?Marketers have been urged to take AI more seriously over the…
https://austinstartups.com/parade-received-alternate-by-sxsw-accelerator-competition-b8e08d3bb760?source=tag_archive---------19----------------,b8e08d3bb760,1,Parade Received Alternate by SXSW Accelerator Competition
https://blog.bhuman.it/the-10-consumer-technology-trends-for-2017-3cad8744ede3?source=tag_archive---------22----------------,3cad8744ede3,1,"The 10 consumer technology trends for 2017We are ready for cars which drive themselves, to use…"
https://medium.com/botstrategy/a-case-of-the-curiously-camouflaged-cognitive-rule-engine-96dc733346e1?source=tag_archive---------28----------------,96dc733346e1,1,A Case of the Curiously Camouflaged Cognitive Rule Engine
https://medium.com/botsupply/i-chatbots-non-sono-una-moda-sono-una-rivoluzione-2ea6227cdf65?source=tag_archive---------30----------------,2ea6227cdf65,1,"I chatbots non sono una moda. SONO UNA RIVOLUZIONE!Se pensavate che i chat bots sarebbero scomparsi silenziosamente, ricredetevi. Si stanno evolvendo velocemente e stanno diventando sempre più…"
https://medium.com/@malharbarai/artificial-intelligence-in-content-writing-2e5e95cd2492?source=tag_archive---------39----------------,2e5e95cd2492,3,Artificial Intelligence in Content WritingRecently I came across two websites ContentHop and WordAI promising to write and…
https://medium.com/writing-150-sc/looking-back-has-google-made-us-stupid-c7b23c2e7f4f?source=tag_archive---------48----------------,c7b23c2e7f4f,3,"Looking back: has Google made us stupid?In 2008, Nicholas Carr wrote an article for The Atlantic arguing that the Internet’s…"
https://medium.com/@saddington/asimov-17c35c95f501?source=tag_archive---------49----------------,17c35c95f501,1,"AsimovHoly hell:To match the number of novels, letters, essays, and other scribblings Asimov produced in his lifetime, you…"
https://medium.com/@lud.toussaint/i-believe-the-difference-between-the-past-technological-revolution-and-the-one-ahead-or-i-should-421847b15ea?source=tag_archive---------64----------------,421847b15ea,1,I believe the difference between the past technological revolution and the one ahead (or I should say happening right now) is that the unskilled worker of the disrupted industry could find other unskilled jobs easily. That will become increasingly difficult when your self-driving car will bring you to an amazon shop without cashier to buy goods…
https://medium.com/understanding-us/are-we-destined-to-fall-in-love-with-androids-2a1ef8a1d1e2?source=tag_archive---------0----------------,2a1ef8a1d1e2,9,"Are We Destined to Fall in Love with Androids?Sex between species is relatively rare, but it does happen. Seals have forced…"
https://medium.com/pillar-companies/what-will-the-natural-language-technology-stack-look-like-in-5-years-ede36bb54a3f?source=tag_archive---------1----------------,ede36bb54a3f,7,What Will The Natural Language Technology Stack Look Like in 5 Years?
https://towardsdatascience.com/back-propagation-414ec0043d7?source=tag_archive---------2----------------,414ec0043d7,1,Deep Learning: Back PropagationNow the problem that we have to solve is to update weight and biases such that our cost function can be…
https://medium.com/shasta-apex/vr-ai-the-very-real-reality-of-virtual-artificial-intelligence-bebcdbbd35a4?source=tag_archive---------3----------------,bebcdbbd35a4,3,VR + AI: the very real reality of virtual artificial intelligence
https://medium.com/computer-car/neural-network-tuning-with-tensorflow-cc14a23f132c?source=tag_archive---------4----------------,cc14a23f132c,1,"Neural Network Tuning with TensorFlowMy struggle with learning to classify thousands of traffic sign images using deep learning. In the end, the pain taught me more than the successful results."
https://towardsdatascience.com/cnn-model-comparison-in-udacitys-driving-simulator-9261de09b45?source=tag_archive---------5----------------,9261de09b45,2,CNN Model Comparison in Udacity’s Driving Simulator
https://blog.mbeck.com.br/voc%C3%AA-n%C3%A3o-precisa-de-intelig%C3%AAncia-artificial-para-criar-um-chatbot-4fcbd18f4c55?source=tag_archive---------9----------------,4fcbd18f4c55,3,Você não precisa de inteligência artificial para criar um chatbotNem Machine Learning e Processamento…
https://medium.com/@courtneyharwood/women-are-not-the-secretaries-of-life-be02f900c698?source=tag_archive---------15----------------,be02f900c698,3,"Women Are Not The Secretaries Of LifeHow our “friends” Alexa, Siri and Cortana perpetuate gender biasesIn my house, both my husband and I work outside the home. We both run companies. Every morning we both hop on the suburban…"
https://medium.com/@prakharshivam/your-mind-is-your-canvas-a5227402b500?source=tag_archive---------16----------------,a5227402b500,2,"Your Mind Is Your CanvasThe most underestimated machine.Today, we are seeing advancements…"
https://medium.com/@realjoet/the-ultimate-guide-to-chatbots-whats-taking-so-long-dude-961c45229c7d?source=tag_archive---------19----------------,961c45229c7d,1,The Ultimate Guide To Chatbots: What’s taking so long dude?!
https://medium.com/@ulric.musset/hyperspecialization-complexity-and-progress-bc45f7a5414e?source=tag_archive---------20----------------,bc45f7a5414e,1,"Hyperspecialization, Complexity and ProgressDo you remember those old times when it required only a “webmaster” to launch a…"
https://medium.com/@DonBasile/ethics-the-next-frontier-for-artificial-intelligence-1689cd75bc56?source=tag_archive---------49----------------,1689cd75bc56,2,Ethics — the next frontier for artificial intelligence
https://machinelearnings.co/text-classification-using-neural-networks-f5cd7b8765c6?source=tag_archive---------0----------------,f5cd7b8765c6,25,Text Classification using Neural NetworksUnderstanding how chatbots work is important. A fundamental piece of machinery inside a chat-bot is the text classifier. Let’s look at the inner workings of an artificial neural network (ANN) for text classification.
https://blog.grakn.ai/chatbots-and-grakn-ai-67563c64cfde?source=tag_archive---------1----------------,67563c64cfde,4,Building Chatbots with API.AI and GRAKN.AIA Slack movie chatbot built using API.AI and Grakn’s knowledge graph
https://medium.com/@Francesco_AI/the-psychology-of-data-science-3f3a72bc1b72?source=tag_archive---------6----------------,3f3a72bc1b72,1,The Psychology of Data ScienceThe who’s who game in a data science team
https://medium.com/morph-ai/a-botful-life-3755cf1e14f7?source=tag_archive---------11----------------,3755cf1e14f7,3,"A Botful LifeWhen I was young, I used to hate Indian Railways website. Booking a ticket on IRCTC was one of the toughest feats to achieve on the…"
https://medium.com/aimarketingassociation/intelligence-as-its-core-what-happens-when-ai-drives-marketing-5d1392e7c5e9?source=tag_archive---------19----------------,5d1392e7c5e9,1,Intelligence As Its Core: What Happens When AI Drives Marketing
https://medium.com/@robbiew/like-it-or-not-its-the-age-of-ai-fa26d9005bec?source=tag_archive---------38----------------,fa26d9005bec,1,"Like it or not, it’s the Age of AITry and go a day without noticing “machine learning” or “AI” in your newsfeed(s), search result or…"
https://medium.com/@nishantnikhil/adam-optimizer-notes-ddac4fd7218?source=tag_archive---------0----------------,ddac4fd7218,5,Everything you need to know about Adam OptimizerPaper : Adam: A Method for Stochastic OptimizationThis is used to perform optimization and is one of the best optimizer at present. The author claims that it inherits from RMSProp and AdaGrad (Well it inherits from…
https://towardsdatascience.com/peter-norvigs-sudoku-solver-25779bb349ce?source=tag_archive---------1----------------,25779bb349ce,3,Sudoku Solver by Peter NorvigI recently came across Peter Norvig’s Solving Every Sudoku Puzzle. I was impressed with his concise and beautiful Python code that solves any Sudoku puzzles systematically.
https://chatbotslife.com/introduction-to-deep-learning-on-social-networks-how-to-learn-even-more-about-your-personal-life-cd1da6d67770?source=tag_archive---------2----------------,cd1da6d67770,59,INTRODUCTION TO DEEP LEARNING ON SOCIAL NETWORKS: “HOW TO LEARN EVEN MORE ABOUT YOUR PERSONAL LIFE USING NEURAL NETWORKS TECHNOLOGY”POSTED BY CRISTIAN RANDIERI IN TECHNOLOGY NEWS
https://medium.com/homeland-security/top-10-strategic-technology-trends-part-1-a7393aca7f2d?source=tag_archive---------4----------------,a7393aca7f2d,2,Top 10 Strategic Technology Trends (Part 1): Artificial Intelligence & Machine Learning
https://towardsdatascience.com/behavioural-cloning-applied-to-self-driving-car-on-a-simulated-track-5365e1082230?source=tag_archive---------5----------------,5365e1082230,1,"Behavioural Cloning Applied to Self-Driving Car on a Simulated TrackRecently I have been taking a course on Udacity focused on Self-Driving Cars, so I am finally able to post one of the projects in the course."
https://hackernoon.com/an-extensive-list-of-european-ai-tech-startups-to-watch-in-2017-bbfbed9c9009?source=tag_archive---------6----------------,bbfbed9c9009,1,An extensive list of European AI tech startups to watch in 2017
https://medium.com/center-for-data-science/beyond-vectors-efficiency-in-natural-language-processing-c81084abfd52?source=tag_archive---------12----------------,c81084abfd52,1,"Beyond vectors: efficiency in Natural Language ProcessingNYU MSDS student Raul Delgado Sanchez talks diffusion mapsWhen you text a friend saying ‘I’ll fall you later’, how does your iPhone know to correct ‘fall’ to ‘call’…"
https://medium.com/@wimrampen/https-medium-com-wimrampen-how-smart-artificial-intelligence-is-d16b8aa6078e?source=tag_archive---------35----------------,d16b8aa6078e,2,"How Smart Artificial Intelligence isArtificial Intelligence is poised to solve world-peace, poverty and hunger as well as the climate crisis. At least that’s what one could think when reading the headlines."
https://hackernoon.com/how-do-gans-intuitively-work-2dda07f247a1?source=tag_archive---------0----------------,2dda07f247a1,11,How do GANs intuitively work?GANs or Generative Adversarial Networks are a kind of neural networks that is composed of 2 separate deep…
https://medium.com/@gsvpioneer/10-most-important-people-in-artificial-intelligence-in-2017-4120ef6cbec7?source=tag_archive---------1----------------,4120ef6cbec7,16,"10 Most Important People in Artificial Intelligence in 2017“As soon as it works, no one calls it AI anymore.”— John McCarthy"
https://medium.com/@mscansian/a-with-navigation-meshes-246fd9e72424?source=tag_archive---------2----------------,246fd9e72424,2,"A* with navigation meshesThis was originally posted on my blog drpexe.com. I moved it here because I didn’t want to spend money and time maintaining a VM with only a single WordPress blog installed. Written in July 23, 2011."
https://blog.founders.as/talking-to-machines-90a15eea618e?source=tag_archive---------3----------------,90a15eea618e,3,Do we really need to “talk” to machines?How to embrace native human-machine communication and reject…
https://medium.com/@keithpotacasamento/an-iced-latte-and-my-chatbot-1dcc45e04d34?source=tag_archive---------4----------------,1dcc45e04d34,2,An Iced Latte and My ChatBotI’m Keith and I’m a coffee addict. I recently lead an effort to bring an app all the way from inception to a…
https://medium.com/@david.vavra/my-first-google-home-app-prague-public-transport-4a4d04b0883e?source=tag_archive---------5----------------,4a4d04b0883e,2,"My First Google Home App: Prague Public TransportI’ve had my Google Home device since November and I was curious how to build apps for it. Actions on Google API is made just for that. It’s been open for developers since December and it will eventually work not just on Google Home, but also on…"
https://medium.com/@Lillayla/robots-are-not-taking-over-humanity-but-we-are-slowly-losing-it-5369cda7ecfa?source=tag_archive---------9----------------,5369cda7ecfa,1,"Robots are not taking over humanity, but we are slowly losing it"
https://medium.com/@sarath.nairson/what-do-you-deeply-emotionally-want-a485c49ddb30?source=tag_archive---------27----------------,a485c49ddb30,My,"What do you deeply, emotionally want?My colleagues and I were having a discussion today about the reduction in response we were getting to social media content. I am certain that similar content used to get a lot more engagement previously. Now, what happened?? I am having to pen down really really…"
https://medium.com/@brijrajsingh/chat-bots-designing-intents-and-entities-for-your-nlp-models-35c385b7730d?source=tag_archive---------0----------------,35c385b7730d,8,Chat Bots — Designing Intents and Entities for your NLP Models
https://tutorials.botsfloor.com/chatting-with-luis-e7ec94b4e0de?source=tag_archive---------1----------------,e7ec94b4e0de,2,Chatting with LUISHow to model your application using Microsoft’s LUIS
https://medium.com/simple-ai/pandas-library-in-a-nutshell-intro-to-machine-learning-3-acbd39ec5c9c?source=tag_archive---------2----------------,acbd39ec5c9c,1,Pandas Library in a Nutshell — Intro To Machine Learning #3
