link,post_id,response,title
https://medium.com/@arthurb/the-name-probabilistic-programming-is-just-terrible-8dfce621d4f0?source=tag_archive---------1----------------,8dfce621d4f0,1,"The name “probabilistic programming” is just terrible.As much as I love the concept probabilistic programming, the name makes me cringe every time I hear it. It’s verbose, doesn’t abbreviate well and borders on being on a tongue twister. More substantially, the name suggests that the act…"
https://medium.com/@olegrogynskyy/i-tend-to-agree-with-you-that-machine-learning-right-now-is-very-hard-to-master-unless-you-are-a-d528a16d40d?source=tag_archive---------1----------------,d528a16d40d,1,"I tend to agree with you that machine learning right now is VERY hard to master (unless you are a PhD in a related topic). However, with the latest advances in so called autoML (check out DataRobot or some of the related work being done by H2O and other open source communities), you won’t need to know data science in that much detail to figure out…"
https://medium.com/technology-invention-and-more/everything-you-need-to-know-about-artificial-neural-networks-57fac18245a1?source=tag_archive---------0----------------,57fac18245a1,2,Everything You Need to Know About Artificial Neural Networks
https://medium.com/jim-fleming/highway-networks-with-tensorflow-1e6dfa667daa?source=tag_archive---------0----------------,1e6dfa667daa,1,Highway Networks with TensorFlowThis week I implemented highway networks to get an intuition for how they work. Highway networks…
https://medium.com/@CognitiveScale/trending-in-2016-next-machina-augmented-intelligence-bfbf53932cc7?source=tag_archive---------1----------------,bfbf53932cc7,3,Trending in 2016: Next Machina. Augmented Intelligence.
https://medium.com/kickstarter-tips/onering-how-i-bootstrapped-my-kickstarter-video-on-a-high-schooler-s-budget-3077302ceb76?source=tag_archive---------2----------------,3077302ceb76,1,OneRing: How I bootstrapped my Kickstarter video on a high-schooler’s budget.
https://medium.com/game-dev-daily/managing-ai-in-gigantic-523dc84763cf?source=tag_archive---------0----------------,523dc84763cf,2,Managing AI in GiganticGigantic is a 5-on-5 competitive multiplayer game in which each team is paired with a giant creature called a…
https://medium.com/designing-for-bots-and-humans/from-art-direction-to-designing-for-bots-and-humans-83ba2f7cba19?source=tag_archive---------1----------------,83ba2f7cba19,1,From art direction to designing for bots and humans.
https://ai-alignment.com/act-based-agents-8ec926c79e9c?source=tag_archive---------2----------------,8ec926c79e9c,1,Act-based agentsThe interesting category of which approval-directed agents are representative.I’ve recently discussed three kinds of learning systems:
https://medium.com/@mattwichrowski/navigating-the-ai-noise-1c143b60d909?source=tag_archive---------1----------------,1c143b60d909,1,Navigating the AI NoiseGetting your head around what AI is has grown increasingly difficult and there are a lot of ways to think about this…
https://medium.com/@EskoKilpi/art-and-artificial-intelligence-b13daa57435?source=tag_archive---------0----------------,b13daa57435,4,Art and AIWe have great expectations of Artificial Intelligence (AI). Those expectations are based on the ways we have used the scientific method to…
https://ai-alignment.com/on-heterogeneous-objectives-b38d0e003399?source=tag_archive---------0----------------,b38d0e003399,4,On heterogeneous objectivesDefending AI systems in which different pieces optimize different objectives.Eliezer Yudkowsky has said:
https://ai-alignment.com/reinforcement-learning-and-linguistic-convention-1f75f7f4f158?source=tag_archive---------3----------------,1f75f7f4f158,1,Reinforcement learning and linguistic conventionI plan to use the term “reinforcement learning” very broadly.Existing machine learning techniques are most effective when we can provide concrete feedback — such as prediction…
https://medium.com/doransky/ai-menedzsment-b53f4170a063?source=tag_archive---------2----------------,b53f4170a063,1,"AI menedzsmentEljutottunk oda, hogy egy mai célspecifikus mesterséges intelligencia már képes bejutni egy egyetemre. Lassan ideje elgondolkodni, hogy milyen világot is építünk, ahol minden ilyen körbehatárolható célfeladatra lehetnek jobb AI-k, mint az adott ponton jelenleg munkát végző emberek."
https://medium.com/@samim/adversarial-machines-998d8362e996?source=tag_archive---------0----------------,998d8362e996,4,"Adversarial MachinesFooling A.Is (and turn everyone into a Manga)Adversarial A.Is are a common sci-fi theme: Robot VS Robot. In recent years, real adversarial examples have emerged. This experiment explores how to generate images to fool A.Is (and turn…"
https://digitalculturist.com/can-an-artificial-intelligence-ever-help-humans-without-enslaving-us-18672afbd88f?source=tag_archive---------2----------------,18672afbd88f,4,Machine Intelligence Vs. Human PoliticsWhat if humankind invented a technology that gave us the answers to all of our most…
https://textio.ai/beyond-job-ads-textio-for-email-92605b7b8c04?source=tag_archive---------5----------------,92605b7b8c04,1,"Beyond job ads: Textio for emailLet’s say you’re trying to fill a data scientist job. You know exactly what skills you want for the hire: what they studied, where they’ve worked, what tools they use, what temperament you’re aiming for. Ok, great. You write the whole thing down in a job ad, which you…"
https://medium.com/artificial-endings/endless-5e1dd6e455c1?source=tag_archive---------0----------------,5e1dd6e455c1,37,EndlessYou were killed suddenly in a car accident at the age of nineteen. You and a group of friends had driven to Nogales from Tucson for an evening…
https://medium.com/@NathanBenaich/investing-in-artificial-intelligence-a-vc-perspective-afaf6adc82ea?source=tag_archive---------1----------------,afaf6adc82ea,8,"Investing in Artificial IntelligenceFor more AI news and analysis, sign up to my newsletter here.My (expanded) talking points from a presentation I gave at the Re.Work Investing in Deep Learning dinner in London on 1st December 2015."
https://medium.com/@yonatanzunger/asimov-s-three-laws-and-human-morality-12522d7546e4?source=tag_archive---------2----------------,12522d7546e4,4,Asimov’s “Three Laws” and Human MoralityHow the six possible orderings reflect on our moral sensesRandall Munroe recently drew an excellent XKCD considering why Isaac Asimov put the Three Laws of Robotics in the order that he did…
https://medium.com/building-jukedeck/building-jukedeck-84058a394043?source=tag_archive---------4----------------,84058a394043,2,"Building JukedeckFrom idea to launch: how we built our music startupIt was an October day in Harvard in 2010. My girlfriend was studying there and I was visiting, having dinner in student halls and accompanying her to the lectures I thought sounded interesting (which was most of them)…"
https://medium.com/@gluehuff/computer-chess-and-how-it-works-e3aea346d757?source=tag_archive---------7----------------,e3aea346d757,1,"Computer Chess And How It WorksThe first record of a chess computer is the “Chess Automaton”, which was built by Wolfgang Von Kempelen…"
https://medium.com/dima-korolev/modern-cloud-ml-frameworks-fbae503ace8e?source=tag_archive---------1----------------,fbae503ace8e,1,Modern Cloud ML FrameworksAnd why they are a joke.
https://medium.com/lux-capital/forevery-and-the-coming-wave-of-ambient-technology-12031ddfea9e?source=tag_archive---------4----------------,12031ddfea9e,1,"Forevery and the Coming Wave of Ambient TechnologyBy Zavain DarHello from Machine Learning Conference (NIPS) in Montreal! While I’m lucky to find myself chatting, exploring ideas, and anticipating the future with leading minds in Machine Learning, AI, and Deep…"
https://medium.com/@juliaenander/i-d-fire-my-intern-if-i-had-one-297ffcb3ad22?source=tag_archive---------7----------------,297ffcb3ad22,2,"I’d fire my intern — if I had oneAccording to the Contagious Report 2015, it has been a very good but controversial year for artificial intelligence. Opinions seem to vary even among the tech wizards of Silicon Valley, about the possible consequences and applications of AI. As companies like Google and…"
https://medium.com/@ratiwanj/can-a-i-may-replace-humanity-c141aedcb72?source=tag_archive---------10----------------,c141aedcb72,1,"Can A.I. may replace humanity ?Based on my own experience, I used to watch a very thick fat TV screen with only a few channels available in order to catch up the trend and news. I used to wait to talk with my friend at school to catch up about their holiday. It was just 20 years ago everything has change…"
https://medium.com/machine-intelligence-report/a-gentle-guide-to-machine-learning-9bdfd3b8441b?source=tag_archive---------0----------------,9bdfd3b8441b,1,A Gentle Guide to Machine LearningOriginally posted on MonkeyLearn blog…
https://medium.com/attraverso-lo-schermo/humans-i-robot-che-vogliono-diventare-umani-6885fc9010b7?source=tag_archive---------0----------------,6885fc9010b7,1,“Humans”: i robot che vogliono diventare umani
https://medium.com/@navsha/introducing-project-turing-our-first-steps-towards-human-level-intelligence-2294f2854c16?source=tag_archive---------0----------------,2294f2854c16,1,Introducing Project Turing : Our First Steps Towards Human Level Intelligence
https://medium.com/@kleinsound/openai-some-thoughts-mostly-questions-30fb63d53ef0?source=tag_archive---------1----------------,30fb63d53ef0,1,"OpenAI: Some thoughts, mostly questionsThis week, during the machine-learning flagship conference NIPS, seemingly dominated by…"
https://medium.com/the-final-invention/what-openai-means-for-the-future-54c6536c9428?source=tag_archive---------2----------------,54c6536c9428,1,"What OpenAI Means for the FutureSome of the top leaders of Silicon Valley including Peter Thiel, Elon Musk, and YCombinator have…"
https://medium.com/@nebupookins/i-think-musk-is-assuming-ai-is-like-a-gun-in-that-if-only-one-human-or-a-handful-of-humans-have-30ccb9ddb7cc?source=tag_archive---------6----------------,30ccb9ddb7cc,1,"I think Musk is assuming AI is like a gun, in that if only one human or a handful of humans have guns, they can probably lord over all the other humans, whereas if all the humans have a gun, then they’re all safe because no one has an advantage over anyone else."
https://medium.com/wound-up-spring/the-person-is-the-ego-563226c83ea5?source=tag_archive---------2----------------,563226c83ea5,1,"The person is the egoApparently we don’t need no ghost in the shellThe problem with time is that it is passing so fast. Its like one day you’re young and full of hope, and the next day you’re almost old and full of nope. And then, the next day you’re old…"
https://medium.com/message/star-wars-script-leaked-477d63a60c3f?source=tag_archive---------0----------------,477d63a60c3f,6,Star Wars Script Leaked!!!Forget the Ancient Weapons. The Real Deal.
https://medium.com/@futurebec/messaging-bots-the-shift-to-conversational-user-interface-7d9baad739d8?source=tag_archive---------8----------------,7d9baad739d8,1,Messaging Bots & The Shift to Conversational User Interface
https://medium.com/machine-intelligence-report/the-current-state-of-machine-intelligence-2-0-a9e0bab95511?source=tag_archive---------0----------------,a9e0bab95511,12,The Current State of Machine Intelligence 2.0(This article was originally posted at…
https://tutorials.botsfloor.com/ibm-watson-s-personality-insights-and-howdy-ai-s-slackbot-tutorial-be68da6cfa10?source=tag_archive---------0----------------,be68da6cfa10,5,"IBM Watson’s Personality Insights and Howdy.AI’s Slackbot tutorial{intro: start}Chances are if you work in tech you know what it’s like for your work to not be understood by the vast majority of people. Odd acronyms like API, OKR, or CRM, funny…"
https://medium.com/machine-intelligence-report/practicing-artificial-intelligence-programming-6f8fc829bd14?source=tag_archive---------1----------------,6f8fc829bd14,2,"Welcome to (easy) Artificial Intelligence ProgrammingAccording to Schalkoff, R.J. (1990), artificial intelligence is “A…"
https://medium.com/@davidjnelson/motion-ai-has-raised-700k-to-create-the-ui-for-ai-ca56f7a1555c?source=tag_archive---------3----------------,ca56f7a1555c,1,"Motion AI has raised $700K to create visual chatbot platformToday I’m incredibly excited to announce that Motion AI has raised $700,000 in seed funding, as announced in the Chicago Tribune."
https://medium.com/@AmsterdamFuturist/the-ghost-is-already-in-the-machine-3cb35f5a47cf?source=tag_archive---------6----------------,3cb35f5a47cf,1,"The ghost is already in the machineby Devin GuteliusThere’s little time to explain, so I won’t. This article is to the herald the coming of a machine which may change our lives indefinitely; and no — it’s not a new kind of cellphone."
https://medium.com/@saranormous/clippy-s-revenge-39f7387f9aab?source=tag_archive---------0----------------,39f7387f9aab,20,Clippy’s Revenge — Smart Messaging as Platform Shift
https://medium.com/@Michael_Spencer/the-threat-of-artificial-intelligence-to-humanity-419795cd55ff?source=tag_archive---------9----------------,419795cd55ff,1,"The Threat of Artificial Intelligence to HumanityDec 13, 2015Share on LinkedIn"
https://medium.com/syncedreview/big-data-vs-isis-part-1-interview-with-paulo-shakarian-1aabc3fe9e5e?source=tag_archive---------2----------------,1aabc3fe9e5e,1,"Big Data vs ISIS ( Part 1) : Interview with Paulo ShakarianPaulo Shakarian is an Assistant Professor at Arizona State University where he directs the Cyber-Socio Intelligent Systems (CySIS) Lab. He is a recipient of the AFOSR Young Investigator Award, the DoD Minerva Award (as a…"
https://medium.com/@jfutral/well-i-guess-when-an-ai-burnes-out-and-dies-at-27-years-old-we-ll-really-know-that-it-can-be-fcfddb398015?source=tag_archive---------10----------------,fcfddb398015,1,"Well, I guess when an AI burns out and dies at 27 years old we’ll really know that it can be creative! :-)One reason I don’t think AI will put people out of work, no matter how creative it is or isn’t, is it doesn’t create what _I_ create. For instance, there is already a plethora of creative music being written, recorded…"
https://medium.com/@samim/assisted-drawing-7b26c81daf2d?source=tag_archive---------0----------------,7b26c81daf2d,3,Assisted DrawingExploring Augmented Creativity
https://medium.com/@genekogan/from-pixels-to-paragraphs-eb2763da0e9b?source=tag_archive---------1----------------,eb2763da0e9b,2,"From Pixels to ParagraphsHow artistic experiments with deep learning guard us from hypeIn recent months, a raft of art projects concerned with deep learning [1][2] have appeared, helping to popularize a branch of machine learning that has…"
https://medium.com/the-digital-civil-society-lab/artificial-intelligence-and-nonprofits-48f7280ef16e?source=tag_archive---------2----------------,48f7280ef16e,4,Artificial Intelligence and NonprofitsYou’ve probably heard about OpenAI — a new nonprofit to focus on artificial intelligence research that is good for humanity. In their own words:“OpenAI is a non-profit artificial intelligence research…
https://medium.com/building-the-robot-assistant/our-first-week-on-the-slack-platform-8d5a996f6bb6?source=tag_archive---------0----------------,8d5a996f6bb6,2,"Our First week on the Slack PlatformThe good, the bad, the ugly"
https://medium.com/machine-intelligence-report/3-favorite-machine-learning-papers-406165f251e5?source=tag_archive---------1----------------,406165f251e5,1,"3 Favorite Machine Learning PapersWhy read these papers?Well, because 1) these papers are broadly applicable and has a fair chance to influence your product 2) are not loaded with random greek alphabets and useless theorems 3) it’s unlikely you’ll come up with all of it by…"
https://medium.com/warwick-tech/artificial-intelligence-why-we-need-take-an-interdisciplinary-approach-f4db03ed53ec?source=tag_archive---------2----------------,f4db03ed53ec,1,Artificial Intelligence: Why we need take an interdisciplinary approach
https://medium.com/@hellovidya/silicon-valley-s-next-mission-saving-humanity-is-fraught-with-problems-cf65f5e9ff89?source=tag_archive---------4----------------,cf65f5e9ff89,2,"Silicon Valley’s Next Mission — Saving Humanity — Is Fraught With ProblemsSilicon Valley’s untold mission is all about saving humanity from ourselves. I mean, using intelligence and knowledge under the broad umbrella of Artificial Intelligence (AI) to help us balance our…"
https://medium.com/@capybaralet/transhumanism-immortality-pattern-identity-theory-choose-2-30369bfef232?source=tag_archive---------8----------------,30369bfef232,1,"Transhumanism, Immortality, Pattern Identity Theory: Choose 2It seems like a lot of transhumanists believe:1. they will live indefinitely2. their self is a pattern of information (aka Pattern Identity Theory (aka PIT))"
https://medium.com/@moonshinedesign/ibm-s-watson-the-future-of-shopping-b1f600904626?source=tag_archive---------3----------------,b1f600904626,1,"IBM’s Watson & The Future of Shopping (assistants)Shopping assistants, understanding human emotions…"
https://medium.com/savvy/virtual-reality-and-the-parallel-universe-of-cyberclones-d96b1b34a418?source=tag_archive---------1----------------,d96b1b34a418,1,Virtual Reality and the Parallel Universe of CyberclonesA roboticist’s perspective on the future of…
https://medium.com/@marshallk/watch-out-for-the-simplest-answer-a43c0d8c580a?source=tag_archive---------2----------------,a43c0d8c580a,2,"Watch out for the simplest answerToday I read a critique of an industry (economists) who have a tendency toward using Occam’s Razor as explanation for everything, from Tyler Cowan. “If anyone is trying to tell you it’s not complicated, be very, very suspicious. The inclination of economists is Occam’s…"
https://medium.com/@jeffmoss/artificial-super-intelligence-is-an-illusion-103acb92249f?source=tag_archive---------4----------------,103acb92249f,1,"Artificial Super-Intelligence is an IllusionWhether it’s the James Cameron Skynet doomsday scenario, popularized by the…"
https://medium.com/@gerstenzang/artificial-intelligence-a-high-technology-for-us-all-864c5e2ce43a?source=tag_archive---------0----------------,864c5e2ce43a,4,Artificial intelligence: a high technology for us all
https://medium.com/@DemiurgeTech/the-quest-for-the-brain-chip-c8cbacda378e?source=tag_archive---------0----------------,c8cbacda378e,1,"The Quest for the Brain Chip:A revolution is neededWritten by Bragi Lovetrue, founder & CTO, Demiurge Technologies AG. Originally published on EE Times.Alan Turing insisted human brains and modern computers share the computational model…"
https://medium.com/@ishaheen10/my-convictions-my-actions-and-a-high-level-plan-570408669f4?source=tag_archive---------2----------------,570408669f4,1,Are your actions aligned with your convictions?Isn’t it great when you are being true to your convictions? How often does that happen? I think understanding the source of our convictions and digitising…
https://medium.com/pragmatic-idealism/the-next-industrial-age-is-about-smart-not-automation-850b443714b?source=tag_archive---------2----------------,850b443714b,2,The Next Industrial Age is about Smart & not Automation
https://medium.com/technology-invention-and-more/everything-you-need-to-know-about-artificial-neural-networks-57fac18245a1?source=tag_archive---------0----------------,57fac18245a1,2,Everything You Need to Know About Artificial Neural Networks
https://medium.com/@yolcumeh/fourth-industrial-revolution-downfall-or-uptrend-for-humanity-8a185932939a?source=tag_archive---------2----------------,8a185932939a,1,The Fourth Industrial Revolution: Downfall or Uptrend for Humanity?Why this time is entirely…
https://medium.com/snips-ai/the-future-of-computing-and-search-or-why-and-how-i-joined-snips-b7e7eddeffbd?source=tag_archive---------0----------------,b7e7eddeffbd,8,"The future of computing and search, or why and how I joined Snips"
https://medium.com/@CognitiveScale/trending-in-2016-next-machina-augmented-intelligence-bfbf53932cc7?source=tag_archive---------1----------------,bfbf53932cc7,3,Trending in 2016: Next Machina. Augmented Intelligence.
https://medium.com/@dennismortensen/how-to-talk-to-your-mom-about-ai-e88c8d094bb6?source=tag_archive---------3----------------,e88c8d094bb6,1,How to talk to your Mom about AIClassifying services as either Vertical or Horizontal AI.
https://medium.com/@chochinov/top-long-reads-of-2015-e95e3afb7bb2?source=tag_archive---------4----------------,e95e3afb7bb2,1,"Top Long Reads of 2015For those looking for some big reading around big topics, these are some of the articles I’ve found most fascinating…"
https://medium.com/@navsha/competitors-and-you-33f8571d860d?source=tag_archive---------5----------------,33f8571d860d,1,"Competitors and YouThe more you think about your competitors, the more you become like them. And that’s how you lose sight of your innovative…"
https://medium.com/@nellwatson/an-acceleration-of-values-694638227ebe?source=tag_archive---------7----------------,694638227ebe,1,An Acceleration of ValuesLoading (Broken) Values into Machine Intelligence
https://medium.com/jim-fleming/highway-networks-with-tensorflow-1e6dfa667daa?source=tag_archive---------0----------------,1e6dfa667daa,1,Highway Networks with TensorFlowThis week I implemented highway networks to get an intuition for how they work. Highway networks…
https://medium.com/@NathanBenaich/investing-in-artificial-intelligence-a-vc-perspective-afaf6adc82ea?source=tag_archive---------1----------------,afaf6adc82ea,8,"Investing in Artificial IntelligenceFor more AI news and analysis, sign up to my newsletter here.My (expanded) talking points from a presentation I gave at the Re.Work Investing in Deep Learning dinner in London on 1st December 2015."
https://medium.com/jim-fleming/loading-tensorflow-graphs-via-host-languages-be10fd81876f?source=tag_archive---------2----------------,be10fd81876f,5,Loading TensorFlow graphs from Node.jsCheck out the related post: Loading a TensorFlow graph with the C++ API.
https://medium.com/@genekogan/from-pixels-to-paragraphs-eb2763da0e9b?source=tag_archive---------3----------------,eb2763da0e9b,2,"From Pixels to ParagraphsHow artistic experiments with deep learning guard us from hypeIn recent months, a raft of art projects concerned with deep learning [1][2] have appeared, helping to popularize a branch of machine learning that has…"
https://medium.com/google-cloud/what-google-cloud-vision-api-means-for-deep-learning-startups-cd39226922e5?source=tag_archive---------4----------------,cd39226922e5,4,What Google Cloud Vision API means for Deep Learning Startups
https://medium.com/@DemiurgeTech/the-quest-for-the-brain-chip-c8cbacda378e?source=tag_archive---------8----------------,c8cbacda378e,1,"The Quest for the Brain Chip:A revolution is neededWritten by Bragi Lovetrue, founder & CTO, Demiurge Technologies AG. Originally published on EE Times.Alan Turing insisted human brains and modern computers share the computational model…"
https://medium.com/jim-fleming/highway-networks-with-tensorflow-1e6dfa667daa?source=tag_archive---------0----------------,1e6dfa667daa,1,Highway Networks with TensorFlowThis week I implemented highway networks to get an intuition for how they work. Highway networks…
https://medium.com/@NathanBenaich/investing-in-artificial-intelligence-a-vc-perspective-afaf6adc82ea?source=tag_archive---------1----------------,afaf6adc82ea,8,"Investing in Artificial IntelligenceFor more AI news and analysis, sign up to my newsletter here.My (expanded) talking points from a presentation I gave at the Re.Work Investing in Deep Learning dinner in London on 1st December 2015."
https://medium.com/jim-fleming/loading-tensorflow-graphs-via-host-languages-be10fd81876f?source=tag_archive---------2----------------,be10fd81876f,5,Loading TensorFlow graphs from Node.jsCheck out the related post: Loading a TensorFlow graph with the C++ API.
https://medium.com/@genekogan/from-pixels-to-paragraphs-eb2763da0e9b?source=tag_archive---------3----------------,eb2763da0e9b,2,"From Pixels to ParagraphsHow artistic experiments with deep learning guard us from hypeIn recent months, a raft of art projects concerned with deep learning [1][2] have appeared, helping to popularize a branch of machine learning that has…"
https://medium.com/google-cloud/what-google-cloud-vision-api-means-for-deep-learning-startups-cd39226922e5?source=tag_archive---------4----------------,cd39226922e5,4,What Google Cloud Vision API means for Deep Learning Startups
https://medium.com/@DemiurgeTech/the-quest-for-the-brain-chip-c8cbacda378e?source=tag_archive---------8----------------,c8cbacda378e,1,"The Quest for the Brain Chip:A revolution is neededWritten by Bragi Lovetrue, founder & CTO, Demiurge Technologies AG. Originally published on EE Times.Alan Turing insisted human brains and modern computers share the computational model…"
https://medium.com/google-cloud/what-google-cloud-vision-api-means-for-deep-learning-startups-cd39226922e5?source=tag_archive---------0----------------,cd39226922e5,4,What Google Cloud Vision API means for Deep Learning Startups
https://medium.com/jim-fleming/loading-tensorflow-graphs-via-host-languages-be10fd81876f?source=tag_archive---------0----------------,be10fd81876f,5,Loading TensorFlow graphs from Node.jsCheck out the related post: Loading a TensorFlow graph with the C++ API.
