link,post_id,response,title
https://medium.com/@m0nologuer/the-babel-fish-ce223dcd0964?source=tag_archive---------12----------------,ce223dcd0964,1,"The babel fishFrom ‘The Hitchhikers’ Guide to the Galaxy’:The Babel fish is small, yellow, leechlike, and probably the oddest thing in the Universe. It feeds on brainwave energy received not from its own carrier but from those around it. It absorbs all unconscious mental frequencies from…"
https://medium.com/enrique-dans/why-cant-some-people-accept-that-intelligence-is-not-exclusive-to-humankind-e4d74d28bf3a?source=tag_archive---------13----------------,e4d74d28bf3a,1,Why can’t some people accept that intelligence is not exclusive to humankind?
https://chatbotnewsdaily.com/chat-bots-for-user-retention-and-acquisition-a-case-study-135e2fdfa945?source=tag_archive---------15----------------,135e2fdfa945,1,Chat Bots for User Retention and Acquisition — A case study
https://medium.com/@m0nologuer/its-time-for-some-automated-game-theory-8ac6d0b4f4dc?source=tag_archive---------16----------------,8ac6d0b4f4dc,1,"It’s time for some (automated) game theoryA major landmark in the 1970s for AI was the automated discovery of the mathematical proof for the ‘Four Color Theorem’. The AI in this case was not especially sophisticated, human mathematicians still did the heavy lifting of simplifying the proof of the…"
https://mustapha.me/is-voice-truly-the-future-of-computing-b34b973c3a10?source=tag_archive---------18----------------,b34b973c3a10,2,"Is Voice Truly the Future of Computing?The noise is getting louder around voice assistants taking over computing, but I’m still skeptical"
https://rom.feria.name/tech-to-expect-in-2017-61bca4b41727?source=tag_archive---------38----------------,61bca4b41727,1,"Tech to expect in 2017Last year, I have outlined the tech that we expected in 2016, so for 2017, I’ll do the same thing.TV set-top box and streaming TV.Amazon, Netflix and Hulu continued to produce great TV shows that rival the traditional TV networks, and 2017 will be no different…"
https://medium.com/@ideasware/its-a-lot-more-urgent-8ccaf367766f?source=tag_archive---------50----------------,8ccaf367766f,1,"It’s A Lot More Urgent.A good, sobering, dystopian review of a book that aims to show that humans will simply slowly (by human standards) give up, as “humans”, version 2, which are actually AI/robots, take the lead. This is exactly what I’m afraid of too, and I think it’s likely to come to pass in less then…"
https://hackernoon.com/learning-ai-if-you-suck-at-math-8bdfb4b79037?source=tag_archive---------0----------------,8bdfb4b79037,47,"Learning AI if You Suck at MathIf you’re like me, you’re fascinated with AI."
https://medium.com/@nateparrott/give-your-kids-futuristic-names-with-a-neural-network-9078bed0894d?source=tag_archive---------1----------------,9078bed0894d,5,"Give your kids futuristic names with a neural network!Use deep neural nets to add, subtract, mix and…"
https://medium.com/@mchrbn/ethical-autonomous-algorithms-5ad07c311bcc?source=tag_archive---------2----------------,5ad07c311bcc,2,Ethical Autonomous AlgorithmsResearch by design in machine ethics. How to design ethics into a…
https://medium.com/intuitionmachine/data-science-is-informative-but-deep-learning-is-transformative-316e61871dd8?source=tag_archive---------3----------------,316e61871dd8,7,"Deep Learning is Transformative, Data Science is Just Informative"
https://medium.com/cognitivebusiness/i-know-what-you-want-3889af7b0698?source=tag_archive---------5----------------,3889af7b0698,2,"I know what you wantPartnership between Panasonic and Watson nods to new personalized experiences“Can I adjust the mirrors for you, sir?”"
https://medium.com/botstrategy/2017-ux-trends-conversational-ui-1a9e88a2a62a?source=tag_archive---------6----------------,1a9e88a2a62a,2,2017 UX Trends: Conversational UILast year we saw a paradigm shift from social networks to messaging. For the first time in history messaging apps usage surpassed social networks.
https://blog.nawazdhandala.com/life-a-thought-experiment-a44e8ad7a2a7?source=tag_archive---------11----------------,a44e8ad7a2a7,1,"Life | A thought experiment.If you look at what life is from around the world, It basically boils down to atoms which interacts with each…"
https://medium.com/@consttype/the-turing-closet-da583bcea6ac?source=tag_archive---------12----------------,da583bcea6ac,1,"The Turing ClosetIn popular culture, the words “Turing Test” evoke a simple dialogue, a series of questions and answers, between a human interrogator and a computer, where the task of the computer is to make the interrogator believe that it’s actually a human being. Usually the discussion happens through some…"
https://hackernoon.com/why-big-data-and-algorithms-wont-improve-business-strategy-54e4ebe2398?source=tag_archive---------0----------------,54e4ebe2398,13,"Why big data and algorithms won’t improve business strategy… for most companies.Over the years, I’ve heard a lot of people talk about algorithmic business and how big data will improve business strategy. For most, I strongly suspect it won’t. I…"
https://chatbotsmagazine.com/defining-your-bots-purpose-and-focusing-its-domain-knowledge-2e8c3e684987?source=tag_archive---------3----------------,2e8c3e684987,2,Defining Your Bot’s Purpose and Focusing Its Domain KnowledgeA Minimal Viable Knowledge (MVK)…
https://medium.com/@withfries2/16-questions-about-self-driving-cars-3c8f655309f7?source=tag_archive---------4----------------,3c8f655309f7,1,"16 Questions about Self-Driving CarsAnything that moves will go autonomous—planes, trains, trucks, cars, shopping carts, drones—if there’s an economic driver. And in most cases, there will be because the cost of humans driving is very high, in terms of both dollars and lives. We spend far too much…"
https://medium.com/@TomasDeCamino/lo-irrelevante-de-los-ex%C3%A1menes-estandarizados-3795911ab256?source=tag_archive---------6----------------,3795911ab256,1,Lo irrelevante de los exámenes estandarizadosY un examen de exámenes
https://medium.com/@evolutioneer/artificial-intelligence-start-ups-in-germany-austria-and-switzerland-ai-db2ba462f3e3?source=tag_archive---------11----------------,db2ba462f3e3,1,"Artificial Intelligence Start-ups in Germany, Austria and Switzerland (AI)This article is intended for everyone interested to learn more about artificial intelligence start-ups, their business cases and application fields. The topic is very exiting for me considering the…"
https://medium.com/@gkrasadakis/medium-adding-a-social-content-discovery-component-bfc8c07663c7?source=tag_archive---------12----------------,bfc8c07663c7,1,How a social content discovery component could improve MediumAllow people to naturally discover content by accessing the most popular & recently consumed topics or content in reference to a particular…
https://medium.com/@jeff.shuey/transfer-learning-will-power-knowledge-transfer-bda19cdd168?source=tag_archive---------34----------------,bda19cdd168,1,Transfer Learning will power Knowledge TransferIn humans AND machines.Machine Learning and DNN’s will be at the CenterIn a sense this is both scary and a new reality. We need to be ready. Because like most things that seem likely to happen…
https://medium.com/@nafrondel/you-requested-someone-with-a-degree-in-this-holds-up-hand-d4bf18e96ff?source=tag_archive---------0----------------,d4bf18e96ff,31,"You requested someone with a degree in this? *Holds up hand*So there are two main schools of Artificial Intelligence — Symbolic and non-symbolic.Symbolic says the best way to make AI is to make an expert AI — e.g. if you want a doctor AI, you feed it medical text books and it answers questions by…"
https://medium.com/@avihay/bring-magic-to-your-mobile-app-with-deep-learning-184d9062d7fc?source=tag_archive---------1----------------,184d9062d7fc,10,"Bring Magic To Your Mobile App With Deep LearningTeaching Your App To Detect Traffic Lights From 18,000 Images Is The First Step In Building Your Own Self Driving Car"
https://news.greylock.com/https-news-greylock-com-the-conversational-economy-voice-and-the-new-era-of-multi-modal-computing-96f535c058f6?source=tag_archive---------2----------------,96f535c058f6,10,The Conversational Economy — Voice and the New Era of Multi-Modal ComputingPart 3 in a series on the…
https://medium.com/startup-grind/a-web-for-the-person-you-wish-you-were-7a340ae3d73a?source=tag_archive---------6----------------,7a340ae3d73a,3,A web for the person you wish you wereAs we move into a new year two things are customary: best wishes and resolutions. I’m going to be the nerd in the room and combine both. I wish that you keep your resolutions.
https://medium.com/intuitionmachine/ai-as-an-existential-threat-to-humanity-a45dc2e0db76?source=tag_archive---------7----------------,a45dc2e0db76,4,"AI as an existential threat to humanity?Nick Bostrom, a Swedish philosopher turned futurist, argues that “AI” will become “superintelligent” and this is an existential threat to humanity. This has some people worried and has spurred a lot of discussion, is this realistic or science fiction?"
https://becominghuman.ai/real-time-speech-recognition-for-communication-apps-a459543425d?source=tag_archive---------12----------------,a459543425d,1,Real-time speech recognition for communication appsSpeech recognition in the cloud
https://virtualrealitypop.com/technology-the-change-agent-for-education-9e370aec641e?source=tag_archive---------19----------------,9e370aec641e,5,"Technology, The Change Agent For Education…Within the last 10 years, there has been a rapid growth of new jobs and industries…"
https://medium.com/@seanaubin/deep-learning-is-almost-the-brain-3aaecd924f3d?source=tag_archive---------20----------------,3aaecd924f3d,6,Deep Learning is almost the brain(and it’s results still look like one sometimes)
https://medium.com/@makingthematrix/theres-one-thing-i-don-t-like-about-comparing-dl-with-how-a-human-brain-works-f96be038835d?source=tag_archive---------50----------------,f96be038835d,1,"There’s one thing I don’t like about comparing DL with how a human brain works. That is, one thing apart from that the number of hurraoptimistic articles on DL reminds me eerily of hypes about perceptrons and Lisp machines, which were both soon followed by long AI winters."
https://medium.com/swlh/lets-talk-about-self-driving-cars-387cd5adb834?source=tag_archive---------0----------------,387cd5adb834,50,Let’s Talk About Self-Driving CarsOverview of a presentation by Andreessen Horowitz on the future of…
https://medium.com/@mimoralea/so-you-want-to-become-a-self-driving-car-engineer-209d4b0b59e2?source=tag_archive---------1----------------,209d4b0b59e2,7,"So, you want to become a Self-Driving Car Engineer?I gathered a bunch of information from several job posts for Self-Driving Car Engineers and wanted to share what I found to be the most common skills needed for the job."
https://medium.com/singularityu/7-uses-of-exponential-technology-were-excited-to-watch-in-2017-e51ec2f6bdc7?source=tag_archive---------2----------------,e51ec2f6bdc7,1,7 Uses of Exponential Technology We’re Excited to Watch in 2017
https://medium.com/@artefactgroup/ai-and-the-future-of-design-what-will-the-designer-of-2025-look-like-b27ad0f6ef3a?source=tag_archive---------3----------------,b27ad0f6ef3a,2,AI and the Future of Design: What will the designer of 2025 look like?In the latest installment of…
https://chatbotsmagazine.com/designing-conversational-ui-with-information-architecture-part-3-b4746835a517?source=tag_archive---------4----------------,b4746835a517,1,Designing Conversational UI with Information Architecture — Part 3An IA for AI Learning
https://medium.com/@Rebecca.Wicker/noam-chomsky-linguistics-and-ai-e2f29a920ea?source=tag_archive---------6----------------,e2f29a920ea,1,"Noam Chomsky, Linguistics and AIAfter my first Future Technologies & Innovation meeting at Pearson, and the issues it raised regarding AI, I was led to The Atlantic’s 2012 article on Noam Chomsky ‘On Where Artificial Intelligence Went Wrong’. It is quite dense and covers a variety of topics from AI and…"
https://chatbotsmagazine.com/typical-answers-for-typical-questions-from-enterprise-clients-e9e6e908e45d?source=tag_archive---------7----------------,e9e6e908e45d,1,Typical Answers For Typical Questions From Enterprise Clients
https://medium.com/@petervoss/human-level-ai-is-possible-e8860d2b08b3?source=tag_archive---------11----------------,e8860d2b08b3,3,"Human-level AI is possibleMany people fret about AI growing too smart, and becoming an existential threat — a position loaded with its own…"
https://medium.com/@nextupai/jira-bot-for-slack-take-2-a4d903a72268?source=tag_archive---------17----------------,a4d903a72268,1,Jira bot for Slack — Take 2Hello world! Again. We are the makers of the JIRA bot for Slack that creates a connection between your Slack…
https://medium.com/@pietz/i-have-trouble-imagining-that-my-mouse-had-built-in-ai-c818009d451c?source=tag_archive---------22----------------,c818009d451c,1,I have trouble imagining that my mouse had built in AI. But maybe it’s just not clear to me where AI starts. The definition seems vague.1 if-block certainly cannot represent somehting artificial intelligent. But can 100 or 1000? Is it considered AI when my mail software lists me my most frequent contacts? Because those are…
https://medium.com/@theaiguy/the-future-of-insurance-a-shift-from-risk-assessment-to-loss-prediction-prevention-513582488c9f?source=tag_archive---------26----------------,513582488c9f,2,"The Future of Insurance: A Shift from Risk Assessment to Loss Prediction & PreventionNew artificial intelligence (AI) capabilities and other technology advancements, such as the Internet of Things, are beginning to enhance human activities dramatically. While even the…"
https://medium.com/@timboucher/did-hillary-use-a-i-to-campaign-84060785b7a2?source=tag_archive---------40----------------,84060785b7a2,1,Did Hillary use A.I. to run campaign?That’s what I’m wondering after reading this:
https://medium.com/@deb_19342/i-appreciate-the-elegance-but-wheres-the-off-switch-2d4d32fc6f56?source=tag_archive---------51----------------,2d4d32fc6f56,1,"I Appreciate the Elegance, But Where’s the Off Switch?"
https://chatbotslife.com/text-classification-using-algorithms-e4d50dcba45?source=tag_archive---------0----------------,e4d50dcba45,13,Text Classification using AlgorithmsUnderstanding how chatbots work is useful. A fundamental piece of machinery inside a chat-bot is the text classifier.Let’s look at the inner workings of an algorithm approach: Multinomial Naive Bayes. This is a classic algorithm for text…
https://blog.uptech.team/how-to-create-an-ordering-chatbot-with-simple-nlp-a12f6d999527?source=tag_archive---------1----------------,a12f6d999527,3,How to create an ordering chatbot with simple NLP
https://medium.com/the-official-neura-blog/what-digital-health-apps-must-do-to-increase-medication-adherence-7a6956538484?source=tag_archive---------2----------------,7a6956538484,2,What Digital Health Apps Must Do to Increase Medication AdherenceNew AI can personalize mHealth apps…
https://chatbotsmagazine.com/ai-in-2017-13-snapshots-of-our-future-20ed3237375?source=tag_archive---------3----------------,20ed3237375,1,"AI in 2017 — 13 snapshots of our futureIf nothing else, the start of 2017 has given us a plethora of predictions. As well as a…"
https://chatbotnewsdaily.com/chatbots-ushering-in-a-new-era-for-women-in-tech-d0ee7304d7c5?source=tag_archive---------7----------------,d0ee7304d7c5,3,Chatbots: Ushering in a New Era for Women in TechThe Rise of the Conversational Architect
https://medium.com/@twoXAR/the-ai-100-combining-artificial-intelligence-with-human-intelligence-in-drug-development-da6229a853d7?source=tag_archive---------8----------------,da6229a853d7,1,"The AI 100 & Combining Artificial Intelligence with Human Intelligence in Drug Developmentby: Carl FarringtonSoftware Architect, twoXAR"
https://architecht.io/who-will-actually-keep-ai-in-check-738ff9fb3dfc?source=tag_archive---------10----------------,738ff9fb3dfc,1,Who will actually keep AI in check?Ethics are one thing. Laws are another.
https://render.betaworks.com/announcing-voicecamp-9f3690b55f47?source=tag_archive---------12----------------,9f3690b55f47,2,Announcing Voicecamp
https://medium.com/westin-online/captchas-capisce-259cd5d3821b?source=tag_archive---------14----------------,259cd5d3821b,2,"I’m not a robot. Or Google’s human.reCAPTCHA has become an embedded, obligatory free labor platform."
https://medium.freecodecamp.org/recognizing-traffic-lights-with-deep-learning-23dae23287cc?source=tag_archive---------0----------------,23dae23287cc,50,"Recognizing Traffic Lights With Deep LearningHow I learned deep learning in 10 weeks and won $5,000"
https://medium.com/intuitionmachine/the-many-tribes-problem-of-artificial-intelligence-ai-1300faba5b60?source=tag_archive---------1----------------,1300faba5b60,14,The Many Tribes of Artificial IntelligenceOne of the biggest confusions about “Artificial Intelligence” is that it is a very…
https://hackernoon.com/remastering-classic-films-in-tensorflow-with-pix2pix-f4d551fa0503?source=tag_archive---------2----------------,f4d551fa0503,12,Remastering Classic Films in Tensorflow with Pix2Pix
https://500ish.com/the-voice-28dd9a7ef462?source=tag_archive---------3----------------,28dd9a7ef462,22,The VoiceVocal computing has a shot at being the next platform — or more — if the big guys don’t…
https://industry4magazine.com/the-beginners-guide-to-the-industry-4-0-f45b93a95649?source=tag_archive---------5----------------,f45b93a95649,1,The Beginners Guide To The Industry 4.0Everything you need to know
https://medium.com/intuitionmachine/deep-learning-to-predict-human-behavior-a2cd2ce14132?source=tag_archive---------6----------------,a2cd2ce14132,5,The Uncanny Intuition of Deep Learning to Predict Human Behavior
https://blog.prototypr.io/design-through-the-looking-glass-reflections-on-the-future-of-technology-in-2017-39bad2547f0b?source=tag_archive---------8----------------,39bad2547f0b,1,Design Through the Looking Glass: Reflections on the Future of Technology in 2017by the argo design…
https://medium.com/@heratypaul/experiment-using-deep-learning-to-find-lane-lines-c668a6e42070?source=tag_archive---------9----------------,c668a6e42070,6,"Experiment Using Deep Learning to find Road Lane LinesAfter creating an OpenCV pipeline to detect road lanes for self driving cars (see https://medium.com/@heratypaul/udacity-sdcnd-advanced-lane-finding-45012da5ca7d#.yskumiuql), I was curious to see what results I could get using a CNN to…"
https://medium.com/botstrategy/chatbots-building-platforms-list-7f4bbd3fb11c?source=tag_archive---------10----------------,7f4bbd3fb11c,12,Chatbots Building Platforms ListSince I have started writing about chatbots and run a few bot building workshops I have been asked…
https://medium.com/botstrategy/natural-language-processing-nlp-and-a-i-eb21411c57c4?source=tag_archive---------11----------------,eb21411c57c4,2,Natural Language Processing (NLP) and A.I.by Zacharias VoulgarisWhat is the relationship…
https://medium.com/real-solutions-artificial-intelligence/teaching-machines-to-see-beyond-the-hashtag-a7a951d5203c?source=tag_archive---------12----------------,a7a951d5203c,1,Teaching Machines to See Beyond The HashtagThe pixels are the source of truth.This is a statement I find myself frequently sharing on calls with prospective customers learning about Clarifai’s new visual search and custom training products. We are a 40 person team here…
https://medium.com/cognitivebusiness/robotic-roommate-helps-seniors-stay-safe-13ce24ae401b?source=tag_archive---------13----------------,13ce24ae401b,1,Robotic Roommate Helps Seniors Stay SafeIBM and Rice University to develop a smart companion for the elderly
https://tarosite.net/%E3%82%A2%E3%83%83%E3%83%97%E3%83%AB%E3%83%8E%E3%83%BC%E3%83%88-%E3%82%92%E5%89%B5%E5%88%8A%E3%81%97%E3%81%BE%E3%81%99-86861de403aa?source=tag_archive---------14----------------,86861de403aa,1,#アップルノート を創刊しますAi時代を読み解く過激なノート「Ai時代」を読み解く、過激なノート
https://medium.com/world-economic-forum/ai-doesnt-mean-a-cold-robotic-future-here-s-how-the-machines-can-work-for-us-b295a97c7cf6?source=tag_archive---------15----------------,b295a97c7cf6,2,"AI doesn’t mean a cold, robotic future. Here’s how the machines can work for us"
https://medium.com/@bardiapourvakil/excellent-article-as-always-mr-siegler-ed03453ac3de?source=tag_archive---------30----------------,ed03453ac3de,2,"Excellent article as always, Mr. Siegler.However, I have a couple reservations about Voice UI becoming the next big platform.One, speaking aloud to an Alexa in your house is much different than speaking aloud in public. To speak to a computer your voice has to be loud enough that the person near…"
https://blog.messengerpony.com/hybrid-bots-are-better-than-ai-bots-for-now-2a83bb63f3e6?source=tag_archive---------36----------------,2a83bb63f3e6,1,Hybrid Bots are Better than AI Bots…for nowUntil AI can catch up and interact with humans like a…
https://blog.bhuman.it/intelligenza-artificiale-made-in-china-58cfbe49d18a?source=tag_archive---------37----------------,58cfbe49d18a,1,"Intelligenza Artificiale Made in ChinaConsiderata nella sua accezione informatica, l’intelligenza…"
https://medium.com/the-data-intelligence-connection/will-artificial-intelligence-help-to-crack-biology-804a780adb14?source=tag_archive---------44----------------,804a780adb14,2,Will artificial intelligence help to crack biology?
https://medium.com/@ryancrosbie/ai-authors-are-computers-worth-reading-3c5314698bb7?source=tag_archive---------59----------------,3c5314698bb7,1,"AI authors: Are computers worth reading?January 11th, 2017. Day 11."
https://medium.com/@kkopczyn/the-singularity-is-irrelevant-85a730429c7d?source=tag_archive---------66----------------,85a730429c7d,1,"The singularity is irrelevant.Cyborgs will become gods.Artificial Intelligence will lead to a master race.The singularity (the moment that machines become more generally intelligent than humans) will come. But, its not going to be the first disruption…"
https://medium.com/@dougchavez/ai-assistants-battling-for-your-entertainment-pleasure-or-at-least-a-place-in-your-home-8810a381a583?source=tag_archive---------71----------------,8810a381a583,gets,"AI Assistants Battling For Your Entertainment Pleasure Or At Least A Place In Your HomeI vividly remember the scene in Star Trek IV, The Voyage Home, when Scotty sits down at the computer and says in his thick Scottish accent “Computer, Computer,” gets no response…"
https://medium.com/@replika/three-myths-about-replika-7717c2d2237?source=tag_archive---------0----------------,7717c2d2237,6,Three Myths About ReplikaSocial media has put forth a number of quite entertaining theories about Replika. Today we are listing some of the ideas that we love … even though they are not exactly true.Myth #1. You will date an AI
https://chatbotslife.com/small-u-net-for-vehicle-detection-9eec216f9fd6?source=tag_archive---------1----------------,9eec216f9fd6,11,"Small U-Net for vehicle detectionIn this post, we will go over using U-net for detecting vehicles in a video stream of images provided by Udacity. U-net is a encoder-decoder type of network for pixel-wise predictions. U-net is unique because in U-net, the receptive fields after convolution are…"
https://medium.com/the-mission/artificial-intelligence-at-work-the-future-of-workplace-ae0b3a4b1dda?source=tag_archive---------2----------------,ae0b3a4b1dda,13,Artificial Intelligence At Work: The Future Of Workplace
https://hackernoon.com/ai-vs-poker-pros-advantage-c4e66a4baead?source=tag_archive---------3----------------,c4e66a4baead,5,"AI vs poker pros (advantage 🤖)(Read my followup story for an update on the match. This is a good place to start, and my predictions are looking pretty good, 2/3 of the way through.)I got to Pittsburgh late on Wednsday to watch the first day of the Brains vs AI poker challenge…"
https://chatbotsmagazine.com/tailored-bot-interactions-using-watsons-personality-insights-a36f4f629d96?source=tag_archive---------4----------------,a36f4f629d96,5,Tailored Bot Interactions Using IBM WatsonWhat can bots do right now to make their user experience better than that of visiting…
https://architecht.io/pinterest-microsoft-and-why-artificial-intelligence-wants-to-be-open-21141fe3ab38?source=tag_archive---------12----------------,21141fe3ab38,1,"Pinterest, Microsoft and why artificial intelligence wants to be open"
https://medium.com/@Cylance/ai-for-good-ed8f45c4d85a?source=tag_archive---------13----------------,ed8f45c4d85a,1,"AI for GoodLike death and taxes, the inevitable question I cannot escape when on the road is, “Will artificial intelligence (AI) spell human extinction?” We humans have a natural fear of the unknown, so the question is, well, natural. The sentiment comes largely from countless movies portraying robots (with…"
https://medium.com/short-bytes/peak-stuff-d4f339e939f6?source=tag_archive---------14----------------,d4f339e939f6,2,"Peak StuffI have a theory that we are entering the era of ‘Peak Stuff,’ which I define as a local maximum in the amount of goods which are being…"
https://chatbotslife.com/ai-tries-to-take-over-the-world-pinky-bfcde08dc80f?source=tag_archive---------17----------------,bfcde08dc80f,1,"AI “Tries To Take Over The World,” PinkyTechnology has a long way to complete dominance"
